SongName,AlbumName,AlbumLink,Year,PlayCount,Lyrics,SongLink,Duration
Suckas Need Bodyguards,Hard To Earn,https://open.spotify.com/album/67kl5m0df6Bn0aSe3g5Ea7,1994,1718777,"MCs be fakin', so now they get taken
Fake MCs, they always act hard
But won't walk the streets without their bodyguard
Fake MCs, they always act hard
But won't walk the streets without their bodyguard
MCs are laid out like stiffs in a morgue
Praise the Lord, you're in awe when I'm grippin' my mic cord
Rhymes are ripped with swift execution
One verse could coerce your girl to prostitution
The Guru is now the brother that you're fearin'
Beware when I'm makin' hits with Premier and
Rollin' to a spot near you, lyrics tear through
Poem to your dome, you better watch your rearview
Niggas been held back too long, we're comin' up
In the streets, we roam alone, so watch me runnin' up
I'm sunnin' up a mad posse of warriors
Night crusaders able to break down barriers
And bringin' faces of death, puttin' MCs to rest
Until there's no fake chumps left
Run, step, yeah, bounce, nigga, bounce
My rhymes are cargo when yours is just a quarter ounce
Fake MCs, they always act hard
But won't walk the streets without their bodyguard
Fake MCs, they always act hard
But won't walk the streets without their bodyguard
Fake MCs, they always act hard
But won't walk the streets without their bodyguard
Fake MCs, they always act hard
But won't walk the streets without their bodyguard
Gang Starr, boy, and that's beyond your comprehension
Mad brothers in every city, you can feel the tension
To stop the killin', wack MCs must die
Who am I? I'm the substance that'll make your third eye cry
Too potent, too high in intelligence quotient
When I unleash my speech, I'll have you punk rappers hopin'
I won't expose your names and your identities
You know you're phony, get the fuck from in front of me
Hardcore fans are fed up from your folklore
Lines strip you raw and infect you like cold sores
And I hope you're not the one that I'm after
Since the days of Adidas, I've been a true master
Fake MCs, they always act hard
But won't walk the streets without their bodyguard
Fake MCs, they always act hard
But won't walk the streets without their bodyguard
Fake MCs, they always act hard
But won't walk the streets without their bodyguard
Fake MCs, they always act hard
But won't walk the streets without their bodyguard
I've been around, punk, but, yo, I still feel young
A few of my crew members like to pack guns
I'm high-strung, but don't mistake me when I smile
I'll murder an entire rap chart with my freestyle
After the killin', just like Casper, I'm ghost
Fakes thought I was friendly, at their wakes I was host
Toast without a gun, you'd be done
Throw up your hands, bitch, and now you know you stand to lose one
Choose one metaphor and then choose another
Wax that ass like a bully, have you callin' your big brother
Although I'm five-foot-eight, they call me sergeant
Got more hoes on my dick than you can fit in the garden
At Madison Square, I shot a fair one
So many niggas knew me that the kid wouldn't dare run
MCs pay cash to ensure their safety
They know they can't take me, the G-A-N-G, you crazy?
I'll be on 'em like a message from God
Knowledge of self while fake MCs play hard
Fake MCs, they always act hard
But won't walk the streets without their bodyguard
Fake MCs, they always act hard
But won't walk the streets without their bodyguard
Fake MCs, they always act hard
But won't walk the streets without their bodyguard
Fake MCs, they always act hard
But won't walk the streets without their bodyguard
Fake MCs, they always act hard
(I'm not a sucker, so I don't need a bodyguard)
Fake MCs, they always act hard
(I'm not a sucker, so I don't need a bodyguard)
Fake MCs, they always act hard
(I'm not a sucker, so I don't need a bodyguard)
Fake MCs, they always act hard
(I'm not a sucker, so I don't need a bodyguard)",https://open.spotify.com/track/4BbImhY7dimlHrMHi8l1IV,237
"Take Flight (Militia, Pt. 4)",One Of The Best Yet,https://open.spotify.com/album/4VxyKgulAGSpJwhIJjgiJr,2019,1006739,"(""Conversatin' like some raw pimps sportin' the minks"")
Rhymes take flight, gods get tight, it's serious
(""You know and I know"")
Rhymes take flight, gods get tight, it's serious
(""Nigga better bang"")
Rhymes take flight, gods get tight, it's serious
(""Then I'm runnin' through the spot"")
Rhymes take flight, gods get tight, it's serious
(""However it's gon' go, it's gon' be that"")
One in the spiritual, three in the physical
OG soul like Smokey and the Miracles
Grimy and lyrical—you want it? Here it go
We be in spots where bitch niggas fear to go
Abrasive, still smack faces
Grab you by your neck, smash your head in the basement
Godly, still controllin' the square
You the competition? Get the fuck outta here
We got the safeties and the locks off just in case it jump off
Count to three, only these niggas dump off
For the love of hip-hop, what's it worth?
For the pain of hip-hop, we bringin' the hurt
Fake niggas, we put in the dirt
Silly rap nigga wearin' a skirt
We unbeatable, don't even try
Fuck around, lay around, do or die
It's the militia
Rhymes take flight, gods get tight, it's serious
(""However it's gon' go, it's gon' be that"")
Rhymes take flight, gods get tight, it's serious
(""It's the militia"") (""It's the real"")
Let's see if you can rap and step with this production
I never left, plus I kept me somethin'
That I could use on these MC's that kept frontin'
They watched me unload and explode, I kept dumpin'
The Black Bruno, with the Mack uno uno
Crush you like a Black sumo, I'm back, you know
The man of the hour, I'm the man of the year
Make room and understand I'm here
Hell, my clientele is the most regal
I crush brain cells, my name rings bells to most people
You broke the rules, so I'ma have to get at you
Pussy, you're pitiful, your crew can catch a clip or two
Always the swiftest, you, watch the way I lift his jewels
He's woozy, excuse me while I rip this dude
I light a Dutch while you get touched with ease
And your chick steady fallin' in love with me
Rhymes take flight, gods get tight, it's serious
(""However it's gon' go, it's gon' be that"")
Rhymes take flight, gods get tight, it's serious
(""It's the militia"")
Raw
Yo, it's the gang Gang Starr across my chest
On Gu' and them, I never let Solar rest
Me robbin' them rappers that's braggin'
The pain is of Attica stabbin' you
Leakin' from holes you didn't know you was havin'
Bitch niggas take flight when Bump pick up the mic
I write what rappers wanna be like in real life
Then spit your favorite song with verses crazy long
'Cause I do what the fuck I want on every song
And you bitches are mad 'cause you spit a facade
For sad niggas who thought hip-hop was really gone
But not for very long, I'm back to carry on
Like I'm Marshawn Lynch, runnin' through every song
Wack rappers, take a knee, all races
In any race, Freddie Foxxx put that ox to they faces
And fuck your music is the basis
'Cause my shit hard, rip to the gods, say it, militia",https://open.spotify.com/track/36SKb3prCgLecgshOdHVaf,176
Take It Personal,Daily Operation,https://open.spotify.com/album/74DwNAuirHLDLVLrBQAnVg,1992,4716211,"I never thought that you would crab me
Undermine me, and backstab me
But I can see clearly now the rain is gone
The pain is gone but what you did was still wrong
There was a few times I needed your support
But you tried to play me like an indoor sport
Like racquetball, tennis, fool, whatever
All I know is you attempted to be clever
Nevertheless, cleverness can't impress
'Cause now you've been expose like a person undressed
And I see through you, 'cause I'm the Guru
Or what you gonna do when I start step to you
'Cause when I pay you back I'll be hurting you
And this ain't no threat, so take it personal
Uh
Uh
Uh
Uh
Rap is an art you can't own no loops
It's how you hook him up and the rhyme style troop
So don't even think you could say someone bit
Off your weak beat come on you need to quit
I flip lines and rhymes that never sound like yours
There ought to be laws against you yapping your jaws
Originality overflows in me
And the truth is, that you wish you could live the
Life I live and kick the lyrics I kick
But bear in mind that you can't think as quick
So Premier drops a beat, for me to says to verse two
And if I sound doper then take it personal
Don't be mad 'cause I don't come around the way
Like I used to, I don't have time these days
I'm keeping busy making power moves
Don't try to say I don't remember you
You shouldn't let your jealousy show like that
I stopped coming by, 'cause of the way you act
Telling my business to kids I don't even know
You're like a daytime talk show, and that's low
So you can tell everyone, that I'm jerking you
And if you don't like it kid, take it personal
Uh
Uh
Uh
Uh
Uh",https://open.spotify.com/track/6lqKYoYGYprzbFXT95tDTt,190
Take Two And Pass,Daily Operation,https://open.spotify.com/album/74DwNAuirHLDLVLrBQAnVg,1992,1681684,"You better take two and pass, take two and pass
Take two and pass so the blunt will last
Take two and pass so we can all get blunted
Don't smoke cigarettes so my growth ain't stunted
We got at least five heads and I rolled a White Owl
It's the break of dawn and we're awake like night owls
Phillies are cool but they burn much quicker
(Yeah yeah, just pass that blunt nigga)
We lounge to the sounds as we leave from uptown
It's time to go downtown and make some more rounds
The city never sleeps, it's what Sinatra sang
For that phat phat blunt, you know I got this thang
So hand it over 'cause I wanna get charged
I'm in love with Mary Jane, she keeps me large
So don't hog it, let's keep it movin' real fast
And everybody just chill and take like two pulls and pass
I sit and write a rhyme, when I'm done get blunted
I sit and write a rhyme, when I'm done get blunted
You better take two and pass, take two and pass
Take two and pass so the blunt will last
Take two and pass, take two and pass
Take two and pass so the blunt will last
The club is crowded, everyone's up in here
Yo Premier (Yo what's up man?) What's that you got there?
It looks like a nice plump blunt in your hand
I just know you're gonna share it with me 'cause I'm your man
So bust it, I got one too
And if you spark up yours, I'll light up mine when it's through
Oh shit, there goes my man, the fat mack
We used to get blazed, I know he got a fat sack
So let's go upstairs, grab a chair and unwind
And let the la la enhance our minds
The system boomin', let the bass increase
I find a seat so I can peep the chic
Ladies and maybe get my homeboy some ass
So all you gotta do is take like two pulls and pass
I sit and write a rhyme, when I'm done get blunted
I sit and write a rhyme, when I'm done get blunted
Even in the mornin' like the flavor of juice
A blunt adds spice and a blunt can spruce
Up your day, but I'm not advertisin'
Just tellin' of an aspect, a part of our lives and
Around the way there ain't no shame in our game
'Cause the fame is no thang, we get together and hang
And since you know that I got dash and class
Then I'm after you so take like two pulls and pass
I sit and write a rhyme, when I'm done get blunted
I sit and write a rhyme, when I'm done get blunted
Get blunted, get blunted, get blunted, get blunted
Get blunted, get blunted, get blunted, get blunted
Get blunted, get blunted, get blunted, get blunted
Get blunted, get blunted, get blunted, get blunted",https://open.spotify.com/track/4GVkrZMJdzKNo6rybHKe0l,197
The Illest Brother,Daily Operation,https://open.spotify.com/album/74DwNAuirHLDLVLrBQAnVg,1992,617690,"Got to be the illest brother to claim respect
It takes the illest brother, just to get respect
Got to be the illest brother when it's time to get wreck
Got to be the illest brother when I get my mic check
I'm one of the illest brothers known to man
But if you don't understand, see I'm a grown man
And I stand five foot eight and three quarters
Givin' orders to my squadron
'Cause I'm like the sergeant or general
But let me keep this minimal
I used to hang with kids who like to live trife
With a knife, cuttin' kids for fun and pullin' out much guns
And like rivalry champs, fellas stop to get amped
Dead bodies lay stamped to the pavement, so I gave it
Some thought, rememberin' the brothers who are gone now
I'll make a strong vow to make things right
Ignite the mic, get hype and all that
Suckers try to menace but they always fall flat
To the ground as I astound, come around
I'll put you down about the brothers who think they're boss
Think they're gettin' large but in the end they pay the cost
Of their lives and that ain't the way to go out
Even take their boys with 'em 'cause they know their boys'll go out
But when it comes to facin' some time, they're like cryin' like weak
And wanna call mom dukes
But mom dukes is fed, fed up with the shit you did
She knows that you shot and she knows that you crippled kids
But who's to judge when you're tryin' to survive?
The one who moves first may be the one to stay alive
So when you think you're hot and dominatin' the set
Just remember, the illest brother claims respect
♪
Like I said I'm an ill kid, so never dare test me
They wanna arrest me 'cause I'm causin' a frenzy
Fake gangsters come and fake gangsters go
Real gangsters chill 'cause real gangsters know
That quietly you stalk your prey on the down low
'Cause too much talk will get you beef on the street
And brothers in the city have to live this way
It may cause dismay, but I'ma tell it anyway
Yo, guns are easy to get and like a puppet
Some young kid is gonna be the subject
Of internal oppression and example of hard times
To make it out the trap in your mind it's a hard climb
But even if your change come right and exact
There's another brother schemin' so just watch your back
I know a brother who thought he had it all
But little did he know he was bound for a downfall
He'd pick up the heater and go stick somebody
He wouldn't give a damn if he killed somebody
'Cause if somebody would get in the way of him gettin' loot
There'd be no hesitation, he'd just shoot
It's like the good, the bad and the ugly
Except it's reality and you don't see it on TV
Brothers keep dyin' in the streets 'cause the streets are designed
To keep you from havin' peace of mind
I know an old man, he's got a rifle to stifle any young punk
He hides it under his bunk
And I know a kid who's been to jail and
He told me that the system had failed him
So now he's out the joint and he's like flippin' on kids
And the people in his neighborhood are flippin' their wigs
But you gotta check the move 'cause there's a reason
A method to the madness and you know what I'm meanin'
'Cause rather than bein' the herb, the, a chump
You can be just like my man called holdin' a pump
But livin' like that you take a chance with your life
But some things in life sometimes will make you uptight
I'm like an avalanche of knowledge poundin' down all fools
All fakes, all snakes and ones who try to break the rules
And regulations, stipulations made by the gangster
You try to flex muscle, you know you can't hang hops
You're makin' me vexed but yeah, you can go next
Just remember, the illest brother claims respect
♪
Got to be the illest brother to claim respect
It takes the illest brother, just to get respect
Got to be the illest brother when it's time to get wreck
You got to be the illest brother when I get my mic check
Yo money, don't front, you know you blew your chance
And now it's my turn so I'ma take command
'Cause I'm like the one who's got all the juice
I always get loose, I got the balls to reduce your crew
Very easily I got more ammo
I'm like the ill kid, psycho manual
'Cause now I'm past the point and I ain't gonna return
And when it comes to your destruction I ain't really concerned
About the consequences 'cause I'm livin' day to day
So who are you to comment about me and my ways?
I get my attitude from livin' and I'll never forget
You got to be the illest brother just to claim respect
The worst thing about jail is women come and visit you, man
And they get funky when a nigga's locked up
Right, you be eight inches of glass
You can't reach them motherfuckers
Right, she be talkin' about, ""I never did like your mama""
""Who you talkin' to?""
""Talkin' to you nigga, you the one in jail!""",https://open.spotify.com/track/3NrcZLDNeHlXpvDeXbFqxJ,284
The Mall,Moment Of Truth,https://open.spotify.com/album/5f6Nz2v1DESbpu1NerEql2,1998,2209199,"Make money money
Go shopping
Take money money
Go shopping
No matter what the weather
Winter spring or fall
We'll be doing it
At the mall
Make money money
Go shopping
Take money money
Go shopping
No matter what the weather
Winter spring it fall
We'll be doing it
At the mall
Yo, what the deal cousin
Gave him a pound now we huggin
In the mall thuggin
Fucking spent a few hundred
Shorties must be lovin
Shit jig to my wallows(?)
They watch like mavado(?)
So I floss like a model
You ain't loungin
Til you've been countin
by the thousands
Profilin/profoundin
pushin more weight than your medallion
We be rallin
Lockin blocks down just like the island
Dough pilin, we keeps it in the family like Italians
Ballin, custom chores, Jordan's and some icebergs
(?) Nice curves
girlfriend with the white fur
Pushed up feelin like some shots of tequila
Said her man's a dealer
With all these bags from Anne Taylor
He got to be, but you hot to me
You under lock and key, laid it down properly
This canister(?) is watchin me
Moved in me sloppily
Prepare for the fallout
We gas to blow the wall out
Clear the mall out
Make money money
Go shopping
Take money money
Go shopping
No matter what the weather
Winter spring or fall
We'll be doing it
At the mall
Make money money
Go shopping
Take money money
Go shopping
No matter what the weather
Winter spring or fall
We'll be doing it
At the mall
Yuh, don't be mad at me
I used to be king
ragged D fiends nagging me
Shit I had to breathe
Gradually, rhyme casually
Sharp hazardly
Vaseline slick shit
Green stick shit
Honey got some mean lipstick
My knots this thick
But cops frisk us
The block whispers
That we need to stop
How we coon
But you can guess like them jeans u rock
But now I'm rollin right
Cause I had four faces
Fightin four cases
In the north face and (?)
Shorty lookin innocent there
Nothin innocent here
Give us a year you really see clear
Through these cartiers
Shark skin is what I prolly wear
Designed by Pierre, trust me
And look lovely with it
Cap a 4.2 and get ugly with it
Snugly fitted rugby hittin
Fitted in my coogi knitted
Compliments on the doobie did it
Got the movie rented if the crew be with it yo
Make money money
Go shopping
Take money money
Go shopping
No matter what the weather
Winter spring or fall
We'll be doing it
At the mall
Most times I'm casual
but easily I switch
To some fly shit
Like some silk suits
by Paul smith
And purchase some kicks
by Kenneth Cole
Cop a hilfiger
a polo goose for when it's ycold
Armani and Gotier specs cover my eyes
The definition of jiggy so you best to recognize
at the mall I'm baggin up much more than gear
Victoria be whisperin mad secrets in my ear
She wanted me to knock her in the back of foot locker
I chuckled as she kicked more game than soccer
Others try to copy
I see 'em when they mock me
Baseball cap bent
The fresh end in (?)
All the way from Green Acres to the Beverly Center
Heads turned and i'm the main concern when I enter
And I be square
niggas wouldn't even dare
With that fake thugish rugish
when them Brooklyn kids be in there
Saw (?) And a sweet for my girl
Styling on the cellphone smilin
it's my world
Can't forget the Avarex
pocket for theroyalty checks
My crew be showin Loyalty
plus upmost respect
Yo son, go pioneer those bimbos
while I get some timbos
Later on that night
you'll find the nymphos
That's how it goes cause mad heads be in the mall
Let's breeze we got a show
Plus I got another phone call",https://open.spotify.com/track/6muJxW8lguXun64N322xph,220
The Militia,Moment Of Truth,https://open.spotify.com/album/5f6Nz2v1DESbpu1NerEql2,1998,12942443,"There's a bulletin, State Police, Princeton junction
The militia, certain individuals of unidentified nature
Is now under complete control
Hip hop is not, what it is today
It's the real, it's the militia
If heads only knew how I felt about the rap game
They'd relocate, and change their fuckin' name
I eradicate move fakers, roll with coat shakers
Give dap to mad money makers
Shared cells with lifetakers, have sex with rump shakers
I make moves so I'm a earthquaker
I've been known to instill fear
Although the world may be round, we still trapped in the square
City light, got me buggin' and trife
Some die by the gun, some die by the knife
It's alright, like a game of spades I'm trump tight
Premier hit me with music to ensure that it thump right
And my flight, will be taken solely at night
'Cause that's when the freaks come out, no doubt
And in the dark hours is when I will shower
With the knowledge of my trade to get paid
Still I make moves like a snake in the grass, roundabout
I'll be dickin' it down while you be assed out
Puff mad l's but never passed out
And if I'm caught up in a jam, I blast my way out
There'll be no lettin' up, just straight shuttin' up
Or we'll start the wettin' up
Lyrical infrared scepter never miss you
Big Shug, guru, Freddie Fox, the militia, militia
Everybody's spittin it, the rhyme is hot
'Cause it's big Shug, guru, and Freddie the Fox
When premier bring the beats, no it just don't stop
It's the militia, militia, militia
Everybody's spittin it, the rhyme is hot
'Cause it's big Shug, guru, and Freddie the Fox
When premier bring the beats, no it just don't stop
It's the militia, militia, militia
Yo, I ain't one to succumb to no man, but to command
And scoop up the troops when it's time to take a stand
Emphatically, deep strategies leave casualties
I creep gradually, 'til everybody knows
That I got more flows than rosebud got hoes
The anger inside had me trapped
'Til I got geared up with raps to tear you up like big gats
For big stacks, watch your back when I send 'em in
Caught you tremblin', my name and face you're rememberin'
Several attempts, but nah bitch, you'll never win
Rhymes pierce your skin or maybe limbs we'll be severin'
Take you to the mat, peep that, you should keep back
My ill-kid format will lay you flat like a doormat
That I walk on, I meditate while you talk on
And gossip, so I drop my hot shit, fully loaded glock clips
So get the fuck out my block, kid
As nights turn to days, days go back to nights, we be speaking it right
And keeping it tight up in the street life
I meet life, head on, no holds barred
Born with a heart of gold, now mostly cold and scarred
On guard, choose your weapon, or get to steppin'
Lyrical bullets make you dance from the trance you be kept in
Assessments are made before and during combat
I master my hunger, blow the spot when I bomb cats
One of us, equals many of us
Disrespect one of us, you'll see plenty of us
Conflict, is what I predict
You and your fellas is mad jealous, attempting to flare
We cleverly stalked ya, your fam 'll miss ya
The war's on, that's why we formed the militia, militia, militia
♪
Everybody's spittin it, the rhyme is hot
'Cause it's big Shug, guru, and Freddie the Fox
When premier bring the beats, no it just don't stop
It's the militia, militia, militia
You niggaz owe me for my rhymes, I come to collect
For you dope fiend niggaz in rap, I'm here to inject, check
My style is water baby, spread it around
But when you niggaz don't flow it right and fuck up my sound
I get down; in '89, I spit the buck in the face
Of every MC that came in the place, a scar you'll never erase
MC's are only recognized for their flows
I'm worldwide for the bitches, that I turned into hoes
You heard me spit it on jew-elz, that's how it goes
For all them faking ass niggaz and how I bust up they nose
And while your, nose is drippin', and drainin' blood
I be standing over you screamin',nigga, what, what, nigga, what
Niggas feel my presence, like I'm right in they palm
Cause a stormy day is coming, when you see me so calm, it's on
No more twin glocks, they jam up my plays
Now it's twin 40 calibre Walther PPK's
I'm in the control of my game, you must respect me like the ref
Uh-huh, you disrespect you get the tech
I turn you fake niggaz on and off, like I'm the clapper
I rob so many niggaz, they should call me Jack the Rapper
I'll the illest nigga doing this, dead or alive
Gloria Gaynor on you motherfuckers, I will survive
You can try to come at me, but do you want the kick back?
You snap inside the cage of a pit, and you get bit back
My war is so tight, my drama so ill
Beef with me hangs around like the unpaid bill
I push these lyrics through any MC, and make it burn
So the niggaz who be rhyming next, will miss a turn
When you speak of who's the dopest MC, I don't come up
But when you speak of who's the livest mc, I stay what up, what's up?
I got stripes while you got strikes and bogus mikes
Do what bitch niggaz do best bite
You niggaz can't make up a law that I don't overrule, overthrow
Prim' brought bumpy these tracks so I can let you know
Before I slide I'ma leave you this jewel
Even mechanics walk around with they tools, it's the militia",https://open.spotify.com/track/4PoqWtVeTMZTB7E9Uubwf9,288
