SongName,AlbumName,AlbumLink,Year,PlayCount,Lyrics,SongLink,Duration
Eulogy,The Ownerz,https://open.spotify.com/album/6U2LlflINhafc0e9vhs0lp,2003,697164,"(child's voice)
""word up kid!""
(Premier)
Yeah L.B., Bryan Moier
I miss you man rest in peace
To Endeara Bishop
Rest in peace little lady
To Claira Stewart
I love you Aunt Ploute
To the coffe boy Arden Franklin
Rest in peace Res
My nigga Headquarters
Head up eyes and ears open
Word is bond!
Jam Master J, Big L
Big Lee, Flamboyant for life
Aaliyah, Mad Mark
Boogie down Bronx
P. O., Left Eye
(Guru)
The emotions that one goes thourgh, over a loss of a loved one
Or friend then, knowing the cost of rebuilding and carrying on
It gets so damn hard in this modern day Babylon
And disease runs rampant, so many men carry arm
So many have a lonely painful road to travel on
Mothers losing sons, improper use of guns
Children go astray because their parents were abusive ones
I used to run with the illest guys
Thourgh the realest eyes
I seen the realest and the illest die
The cycle continues, so many times the good ones
The young ones
So many misunderstood ones
Remembering their faces and voices
And when the wise man said
Life is full of choices
Some get caught up, others are innocent victims
All I know is they were close to us, and that we miss them
* I'm not sure about any of these names *
(Premier)
Eazy-E, Big Pun
Lil Bro, East New York
Dorothy Clark, Sydney Clark Junior ""Rest in peace""
Clarence Elam, Charles Elam
Omar Pitts, D. J. Threat
Big Mellow, D. J. Screw
Aunt Nettie ""Rest in peace""
Uncle Frank, Harold Guy
Poetic, Gravediggaz
Fred Jordan, Ted Dimmy
G. B. Greg Box ""Rest in peace""
Taheim Cambell
Watch over your big brother
Bumpy Knucks
Yeah!
Harry Stricklin, Merla Santana ""Rest in peace""
Rod Roshodm, Gerald Wichard
Huey Beckam, Marie Clem
Tony Malvow, Paula Crutchfield
Ann Cambell ""Rest in peace""
Reverand Van Johnson, Coach Hoover Wright
Valerie Wilson, Ura Wilson
Jacob Boier, Weldon Irvine ""Rest in peace""
Yeah! Hoover Carden
Corey Stringer, Malik Sealy
Boostin Kev, Edward Star
Nina Simone, Ann Jones ""Rest in peace""",https://open.spotify.com/track/4xGlfUHot9y5Uf2IC3DdYZ,175
Execution Of A Chump,Step In The Arena,https://open.spotify.com/album/05wcY4zcfSawCyoutTTxda,1991,958489,"I knew this chump see... he tried to play me
he was my right hand man but he betrayed me
i let him chill at my crib cause we were down and
i went to work everyday while he was loungin
he tried to backstab he kept on jokin
he didn't know he could've got his back broken
i had to cut homeboy off for even tryin that
his game was mad weak know what i'm sayin black?
stepped to him quietly, he copped a plea
told him to fix it or i'd have to catch a body
in this society, there's many snakes
don't be too eager when you're seeking a break
cause chumps will exploit, use you to benefit
so just be keen and, learn all the ins of it
i've had my share, of dealing with fake men
i left them squealing, ""it was i who did the taking""
proceeding exactly, according to plan
i foiled the scheme cause it seemed i was that man
and if you step up like the kid who did front
you will bear witness... the execution of a chump
now, now... let's get the purpose of it
i'm snatchin hearts out of chumps, cause i deserve to love it
observin acts of a snake, while i evaluate
eliminate the nucleus, i'm doin this
pissed usin fists usin force of any sort
my conscience says it's nonsense, if i put up with it
it meaning sleazy, sorry-type slick types
i'll drive em all to danger, and make em hitchike
cause if you step up like the kid who did front
you will bear witness... the execution of a chump
call me the guru... known as a spiritual teacher
i'll reach you deftly, directly, correctly so select me
elect me as your prophet and we'll praise him as i drop it
pursue this, review this, i knowledge more than buddhist monks, punk
i'll wreck the set and grab a big chunk
known to be a wise one, known to be a seeker
following my calling in life, so i can keep the
minds in line to find devine designs of rhyme
rewind this on your box one time
but if you step up like the kid who did front
you will bear witness... the execution of a chump",https://open.spotify.com/track/2GLQCyOGdqpDbR9RszgKaL,161
Ex-Girl To Next Girl,Daily Operation,https://open.spotify.com/album/74DwNAuirHLDLVLrBQAnVg,1992,6318988,"You know I used to be a player, fly girl layer and a heart breaker
Love maker, back breaker, but then I made a mistake
Yes I fell in love with this ill chick
Sweatin' me for money, my name and the dilsnick
My homeboys told me drop her, 'cause it would be to my benefit
She used to say I'd better quit hanging with those derelects
Romancing is my thing but I can't swing with no scheming hoes
Wherever my Beemer goes you know that I'm driving
Surviving in the 90's is a must so I trust
That everyone listen up as my vocals give thrust
I bust my rhymes first never chasing a skirt
Do much work while other suckas need more time to rehearse
Now back to the ex-girls, ex-lovers, ex-friends
It made me mad to find that she was only after my ends
She phones me and goes on about her new life now
I wish she knew right now, I think she's busted let's discuss it
When I was with her no trust, just fights
Just the he-say-she-say and the neighborhood highlights
Now I got my new girl or as I say my baby doll
But still I'm gettin' crazy calls, my ex-girl's got balls
Don't wanna play the field 'cause I get lovin' at home base
Don't gimme no long face just exit with grace
You and I are the past, c'est la vie, much respect girl
But now you're my ex-girl, 'cause I'm on with the next girl
'Cause girls look so good, next
'Cause girls look so good, next
'Cause girls looks so, so, so good, next
'Cause girls look so good, next
'Cause girls look so good, next
'Cause girls look so, so good, next, next
She had much loot liked to buy me fresh-dipped gear
Liked to have me near 'cause of my savoir faire
The time we shared was brief 'cause I needed relief
From her high-classed antics and all her conceit
Now she's crying wolf and I like don't wanna hear that
I told her the bear facts when things started out
She wines and she pouts about how I did her bad yo
But she'd tried to buy me, even tempt me with the hiney
I fell for a sec 'cause the clothes were real fly
I could almost feel I would give into her whims
Her thoughts were erratic, sporadic, crazy in nature
I told her, hey look, yo I can no longer date ya
Tried to pimp me with bank and fell short, your ship sank
Many thanks for the time and the watch and the link
You and I are the past, c'est la vie, 'nuff respect girl
But now you're my ex-girl 'cuz I'm straight with the next girl
'Cause girls look so good, next
'Cause girls look so good, next
'Cause girls looks so, so, so good, next
Looks, looks, looks
Looks, looks, looks
Looks, looks, looks
So good
You saw my mom's in the supermarket and gave her your number
You asked how's my sister, then asked how's my brother
Didn't ask about my father 'cause you know he ain't like ya
Every time I left for your crib yo he'd really get hyper
The advice he used to give me makes much sense now
I can't believe I used to let you break my confidence down
You used to ask me why the hell did I wanna live in Brooklyn?
You messed up my flow although you were good-lookin'
Yes darlin', was fly and this was the problem
'Cause back in the day she had me scheming and robbin'
To get her things to wear so when she went to the club
All eyes were on her and oh me I just bugged
Caught in between felling proud or feeling more like a sucker
Had to go undercover, get away, find another
Been in Brooklyn nine years and been around the world too
I've seen so many fly girls and I knew just what to do
I went from ex to the next, took my time with each one
And you know they still love me so stop jellin' me hon
I went home to see my mom and I saw you at the bus stop
Must I stop? Nah I think not
You and I are the past c'est la vie, much respect girl
But now you're my ex-girl and I'm out with the next girl
'Cause girls looks so good, next
'Cause girls looks so good, next
'Cause girls looks so, so, so good, next
'Cause girls looks so good, next
'Cause girls looks so good, next
'Cause girls looks, looks, looks so",https://open.spotify.com/track/2gMWmiKdQpeNKXMOgZazDr,279
F.A.L.A.,Hard To Earn,https://open.spotify.com/album/67kl5m0df6Bn0aSe3g5Ea7,1994,1098638,"Fuck Around, Lay Around, do or die (3X)
""You figgedy fuck around, you lay around"" --> Das EFX
(Big Shug)
Word to Joe Frazier, got ta do what pays ya
Give a nigga pain, like displasure
But close your hips in, nigga you can't win
I walk around, with a scowl and a grin
Parties try to rock me, chicks try to clock me
Niggaz try to block me, but they can't stop me
I'm a bad man, understand where I come from
Treatin niggaz dumb, as I drink my rum
I'm a mad man, I get respect with the Tec
Put punks in check, Shug's on the set
I'm the one with the game, the twelve round
CRACK to the concrete, from the underground
I'm a bad nigga, how do you figure to take me
You cannot break me, so don't mistake me
For your brother, I'm not a punk motherfucker see
I did my time, and now I'm FREE
I'm a dope one, ready to rip and wreck shop
I will not stop, I won't be dropped by the cops
I'm bad, understand me with the game I kick
I got crazy bitches like a Trojan on my dick
(Guru)
Yo Hobb we got more rep than Lucky Luciano
Suckers we wet to the sound of the dope piano
This is something you can't handle, here's one example
I got your head as a trophy up on the mantle
Each and every sect we wreck, the crowd's electrified
Mystified, you get dissed, when you try, you die
Fish niggaz, they get fried upon my skillet
I kill it, fuck it, my shit is on hit
And hittin you blaow (BLAOW) so what you wanna do now?
You stepped up, I whacked ya, you crept up, I smacked ya
Got infinite length, with the strength of a real master
If you don't bow down now you'll get plowed down now
You know, like POW
Fuck Around, Lay Around, do or die (3X)
So Fuck Around, Lay Around, do or die
Fuck Around, Lay Around, do or die (2X)
""You figgedy fuck around, you lay around"" --> Das EFX
(Guru)
Word to Mike Tyson, hit you quick like lightnin
Swing my left jab first, and then come in with the right
Cold deck ya, nah I could never respect a
Punk like you, you get dropped like one two
And you're out son, just like a one round bout son
The outcome, is that you'll get that ass hung
Easily, swiftly, you'ew stupid you can't get with me
Fuck Around, Lay Around, do or die (2X)
I said Fuck Around, Lay Around, do or die
(Big Shug)
Fumin! HEAHHH, I'm boomin down on niggaz
I figure, how could they take out a big nigga
They don't know, so I don't never give em a clue
That's you and you and you, and oh yeah you
You can't get with this or take me down
I'm always laughin HA HA cause you punks are clowns
Since I'm passin emcees, with my skill
I'm up on the hill, and I force them dudes to chill
Rippin up shit as I do, because I'm violent
That's why when I walk in the room, punks are silent
My name is Shug, as if you didn't know
I'm pimpin hard, and punks are just a hoe
Fuck Around, Lay Around, do or die (2X)
I said you Fuck Around, Lay Around, do or die
Fuck Around, Lay Around, do or die
I said you Fuck Around, Lay Around, do or die
Fuck Around, Lay Around, do or die (2X)
""You figgedy fuck around, you lay around"" --> Das EFX
(Big Shug)
Yea yea that's Shug for ninety-three
I wanna say whattup to all my people, yaknowhatI'msayin?
We got the Guru in the house, and my man Lil' Dap
Showin motherfuckers where we're truly at
I wanna say whattup to my homegirl, my main girl and my kids
Whassup Kerry, Marie and Lisa how y'all chillin?
I know y'all in the motherfuckin house too, yea!
I like to say whattup also, to all the peoples back home
That know what time it is, and the niggaz tryin to get real
And on that note, right
I'ma get the fuck up out of here
""You figgedy fuck around, you lay around"" --> Das EFX
* DJ Premier cuts and scratchs this line to the end *",https://open.spotify.com/track/3f2Svn2Q1NcNMAdLMnOikM,257
Family and Loyalty,One Of The Best Yet,https://open.spotify.com/album/4VxyKgulAGSpJwhIJjgiJr,2019,46651170,"Like a freshly cut diamond
♪
Like a freshly cut diamond
Diamonds are forever like family and loyalty
Or real rap songs like ""C.R.E.A.M."" or ""My Melody""
Diamonds are forever like my infinite thought
Like respect in the hood that can't be bought
Diamonds are forever like family and loyalty
Or real rap songs like ""C.R.E.A.M."" or ""My Melody""
Diamonds are forever like my infinite thought
Like respect in the hood that can't be bought
Word up, diamonds
(Like a freshly cut diamond)
Diamonds are forever like friends that'll kill for you
Went up in a jewelry store, burglary, steal for you
Bill with you, split the diamond into ice blue
Thrice he tried to disrespect our kinship, I don't like you
And now you axed out the fam'
But I'm cashin' checks, with Premier on this jam
Robin Leach, interviews on the beach
When we shake hands, nothin' but ice on the reach,
And I teach Like the Rap Reverend Ike without the perm', I preach
There's more you need to learn, I return for my streets
Gainin' my wealth, trainin' myself
For corny confrontration with haters who be playin' themselves
Diamonds, I like my world of rap
Your rhymin', hah, it's like a world of crap
And a diamond is like a flyest girl that's strap
And you can't beat that with a bat
Diamonds are forever like family and loyalty
Or real rap songs like ""C.R.E.A.M."" or ""My Melody""
Diamonds are forever like my infinite thought
Like respect in the hood that can't be bought
Diamonds are forever like family and loyalty
Or real rap songs like ""C.R.E.A.M."" or ""My Melody""
Diamonds are forever like my infinite thought
Like respect in the hood that can't be bought (Word Up)
Diamonds (Diamonds)
Diamonds (Diamonds), yeah
Pick up the pen, write down a sin, let's cleanse
Lay that shit down, play it for friends
Make a few M's, then do it again
J. Cole, who da thought you woulda been rhymin' with Ghost
Guru flows forever like a diamond
The most could never afford the precious jewels
That's precisely why I'm blessin' you with clear-cut messages
I'm destined to invest in urban sections where depression rules
I hope to heal the destitute before I leave this vestibule
Between the heavens and the seven circles
Where some dead homies maybe rest, I plan to resurrect a few
I press the truth against the naked devils
Look at the youth just like a precious pebble
Meant to be protected, mentally we let this
Poison of Western philosophy make it sloppy
We forgot we are the chosen
From hip-hop to astronomy, they copy what we showed them
Niggas be talkin' slick, but only try me over modems
In person they starstruck, they hearts flutter
I'm like the realest one you ever met
If you don't feel this one, give it a sec'
Go live a little, let the years pass
Experience pain, watch the tears crash on to the floor
Hurt brings wisdom
Wisdom brings a whole 'nother sort of understandin'
Diamonds only worth what we demandin', uh, uh
And niggas payin' top-dollar
Once upon a time I paid a 100 for mine, now I'm a lot smarter
Diamonds are forever like family and loyalty
Or real rap songs like ""C.R.E.A.M."" or ""My Melody""
Diamonds are forever like my infinite thought
Like respect in the hood that can't be bought
Diamonds are forever like family and loyalty
Or real rap songs like ""C.R.E.A.M."" or ""My Melody""
Diamonds are forever like my infinite thought
Like respect in the hood that can't be bought
I rock diamonds that cut glass out of window panes
Baldhead Slick blazing tracks when the endoes flame
Rocks that bling, rocks that make them jock my team
Rocks that shine, rocks that keep my hand on my nine
Rocks that blind, make the high rocks drop down
One of a kind, niggas best jet from the spot when I cock mine
Diamonds are like your man you always call fam'
Diamonds are like your grandma you always call ma'am
Diamonds are like having the whole world in your hand
Diamonds are like the shows I ripped with no band
Rockin' your knot, stoppin' your plot
It's me, Baldhead Slick Duke, coppin' your block
For you it's only pain, for me it's only gain
Diamonds are like loyalty, iced out like royalty
Diamonds are like my wifey, so sweet the way she spoils me
Diamonds are forever like family and loyalty
Or real rap songs like C.R.E.A.M. or My Melody
Diamonds are forever like my infinite thought
Like respect in the hood that can't be bought
Diamonds are forever like family and loyalty
Or real rap songs like C.R.E.A.M. or My Melody
Diamonds are forever like my infinite thought
Like respect in the hood that can't be bought
Word up, diamonds
(Like a freshly cut diamond)",https://open.spotify.com/track/02NuJokX5OKcF7ksvkJbnd,274
Form Of Intellect,Step In The Arena,https://open.spotify.com/album/05wcY4zcfSawCyoutTTxda,1991,1104882,"(DJ Premier cuts ""Intelligent but not yet equivalent"" --> KRS-One)
(Guru)
Tell me, do you have a clue of what to do
Can you groove to this smooth tune, you must presume
it's important, for you to follow this creation
And hey Son, life is more than having fun
So run and get some help with the problems that you face
Take a taste of the bass put your perspective in place
Get real, deep, so you can keep involved
Revolve and solve, so you can make the calls
like a supervisor he who is wiser than the others
Cause they need someone to advise them to discover
things that they don't know so the papers I will check
Then they'll start to grow to this form of intellect
(DJ Premier cuts ""individual with intellect"" --> unknown)
(Guru)
When the road is too steep, do you have the stamina
First album took us two weeks, since then we have been plannin
an exclusive attraction, produce it to your satisfaction
Those of you lackin, we will put you back in your slime
so you can think and get a grip of
yourself by yourself, and then you'll get a sip of
a gift that's equipped with the script that shocks
You can take a walk? on God?
With your mouth wide open, hoping you can find a
way to display similar actions in a kind of mockery
Cause you don't realize the cost to be
creative genius please, I'm too clean to play
Glance per chance, watch GangStarr perfect
And dance your pants like champs, to this form of intellect
(DJ Premier cuts ""Man with intellect"" --> Lord Finesse)
Valuable solutions, we invent here
Break and remake the cupcakes to show we've been sent here
to serve you, so swallow this and bite it
And why bring, ignorance when we're inviting
you to get advancement, while you're on the dance tip
And don't you know the transcript will make you shake hips
Or chill at will, and with skill, you'll learn some etiquette
Better get the subject or be last at the predicate
And get a set, of headphones and speakers
As lyrical lessons manifest, I will keep you
abrest of the best, in this rap mess
Oversaturated market, full of wackness
I'm Gifted Unlimited, Rhymes Universal
The GURU, nursing you with a verse spilled
Don't choke, and don't turn blue in a frenzy
Premier's severe, on the steel wheels he lends me
spontaneous cuts, but not mainly just that
It's the scratching format, exact with maddening accuracy
Craftily, on the side or in back of me
Nastily, as if his name was Dick Dastardly
Original so get it yo the Gang gets respect
The chain and the star is a symbol, of this form of intellect
(DJ Premier cuts ""intelligent but not yet equivalent"" to the end)",https://open.spotify.com/track/3XYaIyRXzaa29EfgDa4TtA,220
From A Distance,One Of The Best Yet,https://open.spotify.com/album/4VxyKgulAGSpJwhIJjgiJr,2019,3176997,"It's King Equality with lines cocked back to add on
Word to everything, that's what I put that on
Yo, I sat on the sidelines, watched you foolish men
Fake hooligans, now it's time for us to duel again
Yeah, it's me, takin' you savages to school again
I rule again, women are preparin' my food again
I'm like the imperial bandit, stackin' my loot again
Ancient warrior, street fighter, contemporary
Intelligent comrade, enemies I've been sent to bury
You see me at seminars, clubs and bars
I own this shit, rollin' with gangsters, thugs with scars
You see me from a distance, tryin' to analyze the righteous
Caught a scandal and a crisis from this vandalous psychic
Government name Keith Elam, put in work per diem
Still a fly-ass nigga, a magnetic human being
B-A-L-D-head to the Slick, I'm wettin' 'em quick
You are now rockin' with the best
Gang Starr
The God Universal Ruler Universal
I came to give you exactly what you asked for here
You are now rockin' with the best
Gang Starr
The God Universal Ruler Universal
Doin' a whole lot up in these streets
Well, it's the Justice Equality Ruler Universal
Carefree, sun see, light speed react nuclear thermal
Three-hundred-sixty degrees, we comin' full circle
Open the portal, now you witness God's immortal verbals
Shinin' light infinitely like the cosmosis
Modern science would define this rhyme as osmosis
Go through your faction or sect, we're laser beam focused
You see, if rap was a crime, we'd be on Wanted posters
Keith, we kinda like the team that killed the White Lotus
My feet firm in the ground and Guru on my shoulders
Deep concentration is the formulation at begin
Poison pen, maestro chop the violin
I try to stop but my mind keep firin'
Try to advance, you hear them ambulance sirens
You ain't get it? Here's the summation
Nigga, fuck what you heard, it's Gang Starr Foundation
You are now rockin' with the best
Gang Starr
The God Universal Ruler Universal
I came to give you exactly what you asked for here
You are now rockin' with the best
Gang Starr
The God Universal Ruler Universal
Doin' a whole lot up in these streets",https://open.spotify.com/track/45vmAEBgbaDLRMzcUOgvVT,150
Get Together,One Of The Best Yet,https://open.spotify.com/album/4VxyKgulAGSpJwhIJjgiJr,2019,2891157,"Uh-uh-uh-uh-uh-uh-c'mon, uh-c'mon
Uh-uh-uh-uh-uh-uh-c'mon, uh-c'mon
Uh-cuh-cuh-cuh, cuh-cuh-c'mon, cuh-c'mon
C'mon, c'mon
All or nothing, while I'm in this
C'mon, c'mon
It's me El Grande, or call me Papi Chulito
Yo tengo mucho lovin' for you mamis if you legal
For honeys, nothing equal to the way I tap that spot
Get your cat hot, guess what? You hit the jackpot
Candle-light dinners for you winners, huh
See like I'm like Don Juan, hit me sweetie, I get in ya
Sugar, I'mma put y'a in a beautiful mood
Forget about that lame, he ain't a suitable dude
Word up, I'm the one you like to talk to
You'll find my conversation so enlightening that you sparkle
Hoy ya ven aquí, so I can hold you tight, mold you right
Listen girl, I got more game than Dolemite
It's only right, baby, that we blend together
You'll be wanting me to be your friend forever
And ain't it clever boo, how I got you sprung?
So when I holler yo, you know you gotta come
Dame little mami, ven aquí
(Dame, dame, dame, dame)
I'm sorry, that's as far as my Spanish goes
Several words, like ""si""
Because I like what I see (I like what I see, yeah)
I was thinkin' we should get together on the low
You and me
What that chulo? You lookin' at my kulo?
Said you got that prosciutto, but I won't call you my boo though
I'm too cool yo, they call me la negrita for real
And it's really nice to meet you, heard you like a big deal
So what it do? You checkin' for me twice in a blue
Shit I spit too, bet I'm probably nicer than you
I mean let's talk about it
Start with a G through the park and have a walk about it
Like what's your favorite color?
Why you wanna be my lover? Tell me, how's ya' mother?
Could you meet me up town when I'm thinkin' of ya'
No time for another sucker, let him ring the buzzer
I'm sippin' honey, dippin' sundress in the summer
Jiggy mami right, droppin' niggas like mics
Plus I've never been the type to fall in love with the hype
Eatin' my rice, hit 'em with the dímelo papi
Got a thing for baggin' bapis in my beef & broccoli, what
Dame little mami, ven aquí
(Dame, dame, dame, dame)
I'm sorry, that's as far as my Spanish goes
Several words, like ""si""
Because I like what I see (I like what I see, yeah)
I was thinkin' we should get together on the low
You and me
(Uh, uh-c'mon)
Let's get together baby, ah, ah
Let's get together baby, ah, ah
Let's get together baby, ah, ah, ah
Oh, ah, ah, yeah
Let's get together baby, ah, ah
Let's get together baby, ah-ah-ah-ah
Let's get together baby, ah, ah, ah, ah-ah-ah-ah-ah
(Uh, uh, uh-c'mon)
Ah-ah-ah-ah-ah
Ah-ah-ah-ah-ah
Oh, oh
(Uh, uh-c'mon, uh-c'mon)",https://open.spotify.com/track/3K0RiW1XNJ3fiDrNnDJDcs,208
