SongName,AlbumName,AlbumLink,Year,PlayCount,Lyrics,SongLink,Duration
JFK 2 LAX,Moment Of Truth,https://open.spotify.com/album/5f6Nz2v1DESbpu1NerEql2,1998,16663162,"Yo
Yo premier?
Yeah whassup g?
That trip to LA, may be delayed
Why whassup I'm on my way to the airport now
Yeah well your boy guru got knocked
What?
I don't know what this is about, sounds crazy man
Somethin about a gun
♪
The court calls keith elam to the stand
Please approach the bench
♪
Yo they got me handcuffed, I'm down in central booking
Things are fucked up, the way my future's looking
But I'm too fly, i'ma change this scenario
Make some power moves and tighten up my bankroll
Chumps are leary though, they see me as a threat
I'm like the black dutch schultz when you get me upset
Five-oh makes me wanna flip, larry davis style
Got a nigga depressed, while he's awaiting trial
It's ok though, cause from grey skies comes blue
Through darkness comes light and I be known as the guru
And this I certify we all should be alerted by
The traps within the system, our youth is getting murdered by
The DA says they got me on a felony
I'm tryin to live my life, so what the fuck is you tellin me?
The streets are war, that's what brothers carry weapons for
And I take the weight as I did before
The next thing you know, they got me on the radio
A rapper arrested, suckers showin me on video
Of course I know, that I'm a role model
But yo this rap life is real life sometimes it's full throttle
Right now I gotta think about me fuck the industry
You gets no love, except those who support me
What's the story, what happened when I went to LA?
Mixing shit up, no not there I got family
Nothing happened, mind your business yo step
You know we connect, JFK to LAX
They wanna lock us all up, and throw away the key
Don't wanna see us come up, don't wanna see us makin g's
Long as we know this is the key to our destruction
Let's make moves no discussion
Peace to my man hass, and orange man paying the cost
All the twenty-five to lifers all my brothers getting tossed
Into the system, supposed to rehabilitate
It's why you gotta regulate your own mindstate
Read, study lessons and build your inner power
The next level, doesn't tolerate cowards
For example, I know this rich nigerian
Powerful american that's proud to be an african
He asked me why do all us brothers be gettin trapped
I told him I'd explain it broke it down in a rap
Whether you got naps, braids waves or no hair
Without esteem for yourself nigga, you going nowhere
And you can swagger like you rule this josey wales
Unorganized revolt almost always mostly fails
Give up the savage ways, be effective soldiers
To elevate the mental is to be poor no more
There's war in the streets, prepared men know best
Our rhyme as live as it gets, JFK to LAX
They're always makin trouble yo, against the righteous
Killing us in cold blood, those beats those vipers
And as I sit feelin the pain in my wrist
I vow to myself that i'ma change this shit
Or at least I gotta try, or part of me will die
And only by action will any ideas solidify
So I inhale, exhale as I ponder
This grown man will make mistakes no longer
I've been there, I've seen how they make us fall victim
To their tricknowledgy, with no apology I diss em
And so I rip facts to dope tracks I caress
You're gonna hear about it, from JFK to LAX",https://open.spotify.com/track/0drHbXjNetXRrdcm81pxfw,214
Just To Get A Rep,Step In The Arena,https://open.spotify.com/album/05wcY4zcfSawCyoutTTxda,1991,5343541,"Stick up kids is out to tax
Stick up kids is out to tax
Stick up kids is out to tax
And this is how the story goes
Brothers are amused by others brother's reps
But the thing they know best is where the gun is kept
'Cause in the night, you'll feel fright
And at the sight of a four-fifth, I guess you just might
Wanna do a dance or two
'Cause they could maybe bust you for self or with a crew
No matter if you or your brother's a star
He could pop you and jet without a getaway car
And some might say that he's a dummy
But he's sticking you and taking all of your money
It's a daily operation
He might be loose in the park or lurking at the train station
Mad brothers know his name
So he thinks he got a little fame from the stick-up game
And while we're blaming society
He's at a party with his man
They got their eye on the gold chain that the next man's wearing
It looks big but they ain't staring
Just thinking of a way and when to get the brother
They'll be long gone before the kid recovers
And back around the way, he'll have the chain on his neck
Claiming respect, just to get a rep
Stick up kids is out to tax
Stick up kids is out to tax
Stick up kids is out to tax
And this is how the story goes
Ten brothers in a circle had the kid trapped
The one with the hoodie said, ""We'll hurt you""
If you don't run all your jewels and pay
Give up the Rolex watch or you won't see another day
See they were on the attack
And one said, ""Yo, you wanna make this to a homicide rap?
Make it fast so we can be on our way
Kick in the rings and everything, okay?""
The kid was nervous and flinching
And little shorty with the .38, yo, he was inching
Closer and closer, put the gun to his head
Shorty was down to catch a body instead
Money was scared so he panicked
Took off his link and his rings, and ran frantic
But shorty said, ""Nah"" pulled the trigger and stepped
It was nothing, he did it just to get a rep
Stick up kids is out to tax
Stick up kids is out to tax
Stick up kids is out to tax
And this is how the story goes
The rep grows bigger, now he's known for his trigger finger
Rolling with troops of his sons like a gangster figure
He's near the peak of his crazy career
His posse's a nightmare, macking jewels and crazy gear
But as we know, the things we do come back
And Shorty's not peeping, others are scheming to counteract
'Cause the kid that got shot didn't perish, so
He pulls up in a jeep with tinted windows
Too late, Shorty was caught in the midst
His time ran out, his number came up, and that's it
You know the rest, so don't front, the plan has been upset
Some brothers gotta go out just to get a rep",https://open.spotify.com/track/1jVdrIvODvfIowkGykEqfa,162
Keith Casim Elam (Interlude),One Of The Best Yet,https://open.spotify.com/album/4VxyKgulAGSpJwhIJjgiJr,2019,0,"My name is Keith Casim Elam
And Guru is my father
The late king who provided lyrical slaughter
And he's still here
Shinin' down upon us
One of the best yet",https://open.spotify.com/track/028bR1OJYEUpUMN698DVOf,16
Lights Out,One Of The Best Yet,https://open.spotify.com/album/4VxyKgulAGSpJwhIJjgiJr,2019,3790532,"Yeah
Gang Starr, M.O.P.
Either ride or be quiet
What we gonna do (Gonna do), motherfucker
Lights out, I told y'all, this is the one I owe y'all
When you see me, act like you know I know y'all
No one (No one) but Allah can hold y'all
Average motherfuckers can't even handle what I throw y'all
Lights out, I told y'all, this is the one I owe y'all
When you see me, act like you know I know y'all
No one (No one) but Allah can hold y'all
Average motherfuckers can't even handle what I throw y'all (Yo, yo)
Yo, ever since a shorty I was hard-headed and angry
And mad complex and wouldn't let nobody change me
I'm still the same me, gettin' pussy, stayin' weeded
These bitches are starstruck, so fuck the way they gettin' treated
I don't need it, if her head ain't right I pass on it
While you trick sucka niggas be wastin' cash on it
And you don't want it, when the fight starts, you always runnin'
Against me, son, you know the outcome, ya always done
Rhymes jog ya mental like ya pop dukes smacked ya
You need to join SAG (Why?
) 'cause you're a hell of an actor (Hahahaha)
After you notice what happened it'll be too late
Can't blame no one but yourself for mistakes you make
And some of y'all niggas are like circus monkeys
Livin' life like worthless junkies
Plottin' against your fellow man, helpin' out the devil's plan
Damn, why can't I trust my own people?
Fuck it, enemies must perish in the valley of their own evil
Lights out, I told y'all, this is the one I owe y'all
When you see me, act like you know I know y'all
No one (No one) but Allah can hold y'all
Average motherfuckers can't even handle what I throw y'all
Lights out, I told y'all, this is the one I owe y'all
When you see me, act like you know I know y'all
No one (No one) but Allah can hold y'all
Average motherfuckers can't even handle what I throw y'all (Yo)
Yo, a wise man once said, ""Fuck what a wise man said""
Bitch, gimme that bag otherwise y'all dead
Clap on (Blaow, blaow), I can ride right now
Leave you paralyzed from your eyebrows down
I got two parts of my brain, fuck your life on my right
Ain't nothin' left on my left, ain't nothin' right
(I pull up) The kid scope 'em out, I'll thrush ya
For the bread I'll leave ya head smokin' like a muffler
Sick bars, bitch, what up?
I spit SARS, you spit nut up
Bitch, shut up, it's in my bone marrow
Marked for death, I don't even trust my own shadow
When they can't touch who you become
They'll try to dig up who you used to be (Ahh)
Tell them niggas get used to me (Come on)
You can't go back and change the beginnin'
But I'ma start where I'm at and change the endin'
Lights out, I told y'all, this is the one I owe y'all
When you see me, act like you know I know y'all
No one (No one) but Allah can hold y'all
Average motherfuckers can't even handle what I throw y'all
Lights out, I told y'all, this is the one I owe y'all
When you see me, act like you know I know y'all
No one (No one) but Allah can hold y'all
Average motherfuckers can't even handle what I throw y'all
I do it like I do it 'cause it ain't about the music
Ain't about gettin' through it 'cause I'm already proven
You niggas see me cruisin', nigga, I will lose it
I get on my bully shit, fuck up a nigga movin'
Now fuck who ya crew is, fuck what the true is
Gang Starr forever, fuck what the new is
Lil' nigga turned diamonds to ruins
Ball with your RuPaul influence
Shorty askin', ""Who you is?""
Forgettin' I'm praised where a few is
Overlookin' OG engraved on the Buick
Before they let me out the cage for the music
I helped you niggas see exactly who John Woo is (Woo)
Now, nigga, who you is? You overpaid, bitch-made, glitch-made
You headin' for the roof when ya shit fade (Hahaha)
With no substance, ho shit by the abundance
Your catalog sound the same, you got one hit
Lights out (Lights out)",https://open.spotify.com/track/2QEJGDkyjWyghBWB0eV1LK,216
Make 'Em Pay,Moment Of Truth,https://open.spotify.com/album/5f6Nz2v1DESbpu1NerEql2,1998,3787969,"Yeah, you know them
They accuse the righteous people of crimes and claim that we're wicked
Stirring up controversy, making us fight each other
All these fake rappers make it worse, they gotta pay
Make them pay
Make them pay
MCs, beware
First and foremost, some rappers are sweet like fructose
When I cock back these lyrics, y'all punks best be ghost
I be the seven twenty-one, eighteen twenty-one
The illest one, I'm almost doper than anyone
Straight out the late nights of Bed-Stuy
Stepping up, y'all put your weapons up, I make heads fly
You're artificial like saccharin
You're crazy fake, it's more than skills you be lacking in
Concepts you bite, 'cause your identity ain't tight
Trying to be something you're not, like pulling a knife at a gunfight
I'm trooping on night air like flight number 106
And getting all up in your fucking mix
You got me upset, and I got you uptight
'Cause my committee's in your city tonight, a'ight?
We got 17 million of us plus, two million Indians
That makes 19 mil', lighting shit up like Wild Bill
I be the supreme father plus the ill kid with drama
My karma creates the Teflon to pierce your body armor
And make sure you check the shit before you walk to me, or talk to me
Stepping to me improperly, you just may catch the weaponry
My specialty is tearing tracks out the frame
You know my fucking name, I rule all game
I'm universal on all planes, what's your claim?
Make them pay
Make them pay
MCs, beware, some enemies freeze
Make them pay
MCs, beware
Yo, I be your highness, in slickness, you chumps bear witness
Tremendous trooper, verbal nigga with the fitness
Drop you for your spot with the blazer, then I blast you
Slice precise like Benihana's when I come to bring the dramas
Styles so swift, that you can't peep the god
As your lyrics get buried, six feet deep in my backyard
I laugh hard, while your mental I run through mazes
Dark stages of terror to shatter your dressing room mirror
Your whole era gets crushed, your whole show gets bum rushed
Too many dumb punks, want to enter this rap scene
Kicking Willie Bobo, but need to be slapped clean
Into oblivion, the true champion always rises
I bring surprises to the chief plus their advisers
Size me up, and you will find nothing's larger
Catch more wreck on your dome, than a deranged fucking barber
So what you made some dough, you best keep on scrambling
All your vanity, is instantly crushed, when I start handling
Demanding that you pay for your weak rhyme display
Coast to coast, I break the fakes everyday
Make them pay
Make them pay
MCs, beware, some enemies freeze
Make them pay
MCs beware, some enemies freeze
I see myself like the black rap messiah
Colossal spreading my gospel through electrical wires
Spit fire through speech, so I can reach each and every
Tom, dick and jerry slippin' like petroleum jelly
Too busy in the limelight, can't rhyme tight
I got divine right to bring y'all to light
Something ain't right, to be an MC, you gotta thug
Or to thug, you gotta be an MC, this shit is bugged
Show love to few; deal with crew and crew only
And think universal like Sony
Phony pounds and fake hugs is usually avoided
Give a fuck like Pizza Hut, I got to stay noid-ed
Cause that same nigga you trust, could be that same cat
Behind that gat that bust, quiet ya, with the silencer
Keep it hush, ashes to dust, then dust to ashes
Nowadays, it's who pull out the fastest, imagine this
Rap shit without this gat shit, or the phony cat
In black talking 'bout how much his MAC spit
But this year, Gang Starr got changes being made
No wack shit being played, no fake macks getting paid
No Versace MCs, with a mouth full of Mo'
Soundin' like a ho spittin' at a fashion show flow
I bombshell that pastel Chanel rap through a maxwell
Ever since young Krumb, was taught to rap well
Going deep, process of thought, when my eyes closes
Awaken with turban, robe and sandals like Moses
Travelling high sands and eastern lands for the answers
Ignorance is spreading through the streets like it was cancer
Too many drinking not thinking, when behind that trigger
A 38 escalate the murder rate, for us niggas
It's like, microphone roulette 'cause nowadays MCs is getting wet
Over someone else's fake gangsta rep",https://open.spotify.com/track/3Tp97HWpgbVOqcgAEwsBka,261
Mass Appeal,Hard To Earn,https://open.spotify.com/album/67kl5m0df6Bn0aSe3g5Ea7,1994,99795329,"No way you'll never make it
Come with the weak shit, I break kids
Step into my zone, mad rhymes will stifle ya
Lines like rifles go blast when I kick some ass
A lot of rappers be like one time wonders
Couldn't say a fly rhyme if there was one right under
Their noses, I hate those motherfkin posers
But I'm so real to them it's scary
And with my unique skills nag you can't compare me
And no we don't make wack tracks
And all the suckers get pushed back when I'm kickin real facts
I represent set up shit like a tent boy
You're paranoid cause you're my son like elroy
And you'd be happy as hell to get a record deal
Maybe your soul you'd sell to have mass appeal
Oh yes I'm greater than all mc's when I breeeze give me room please
I be like fascinatin when I be updatin
Cuttin off wack kids, pullin their trump cards
I thump hard, and mak eem say that I'm god
Niggaz be pretendin they hardcore
Never know the meaning of But I get props like a slogan and no man
Could ever try to diss when I kicks my jam
Lyrically def and connecting complete mic wrecking
No double checking vocals kill like weapons
But if I have to I go all out with no mic
Yeah that's right cause I survived mad fights
And for my peeps I truly care
Cause without some of them I wouldn't be here
And they all know how I feel
Cause suckers be like playin themselves to have mass appeal
♪
I know I'm dope but don't wet that
I've suffered setbacks but now I'm makin greenbacks
Just like baggy slacks I'm crazy hip-hop
Check one two and you don't stop
Your head'll bop when I drop my crop
Of pure bomb, just like the seashore I'm calm
But wild, with my monotone style
Because I don't need gimmicks
Gimme a fly beat and I'm all in it
Word is bond I go on and on
For you it's tragic I got magic like wands
So i'ma end this lecture and I betcha
Those who kick dirt and do time I'm gonna get cha
Cause I be kickin the real
While they be losin the race tryin to chase mass appeal",https://open.spotify.com/track/3lGBvPUgO7MJltUnBlOpe9,221
Moment Of Truth,Moment Of Truth,https://open.spotify.com/album/5f6Nz2v1DESbpu1NerEql2,1998,65507273,"No matter what we face
We must face the moment of truth, baby
♪
They say it's lonely at the top in whatever you do
You always gotta watch motherfuckers around you
Nobody's invincible, no plan is foolproof
We all must meet our moment of truth
The same sheisty cats that you hang with and do your thang with
Could set you up and wet you up nigga, peep the language
It's universal, you play with fire, it may hurt you
Or burn you, lessons are blessings you should learn through
Let's face facts, although emcees lace tracks
It doesn't mean behind the scenes there ain't no dirt to trace back
That goes for all of us, there ain't nobody to trust
It's like sabotage, it's got me ready to bust
But I can't jeopardize what I have done up to this point
So I'ma get more guys to help me run the whole joint
Cultivate, multiply, motivate or else we'll die
You know I be the master of the who, what, where and why
See when you're shinin', some chumps'll wanna dull ya
Always selfish jealous punks will wanna pull ya
Down, just like some shellfish in a bucket
'Cause they love it to see your ass squirm like a worm
But just as you'll receive what is comin' to you
Everybody else is gonna get theirs too
I ain't no saint, therefore I cannot dispute
That everyone must meet their moment of truth
Actions have reactions, don't be quick to judge
You may not know the hardships people don't speak of
It's best to step back, and observe with couth
For we all must meet our moment of truth
Sometimes you gotta dig deep when problems come near
Don't fear, things get severe for everybody everywhere
Why do bad things happen to good people?
Seems that life is just a constant war between good and evil
The situation that I'm facin' is mad amazin'
To think such problems can arise from minor confrontations
Now I'm contemplatin' in my bedroom pacin'
Dark clouds over my head, my heart's racin'
Suicide? Nah, I'm not a foolish guy
Don't even feel like drinkin' or even gettin' high
'Cause all that's gonna do really is accelerate
The anxieties that I wish I could alleviate
But wait, I've been through a whole lot of other shit before
So I oughta be able to withstand some more
But I'm sweatin' though, my eyes are turnin' red and yo
I'm ready to lose my mind, but instead I use my mind
I put down the knife and take the bullets out my nine
My only crime was that I'm too damn kind
And now some scandalous motherfuckers wanna take what's mine
But they can't take the respect that I've earned in my lifetime
And you know they'll never stop the furious force of my rhymes
So like they say, every dog has its day
And like they say, God works in a mysterious way
So I pray, rememberin' the days of my youth
As I prepare to meet my moment of truth
""You shall know the truth and the truth shall set you free!""
Yo, I got one lyric pointed at your head for start
Another one is pointed at your weak-ass heart
Now if I pull the trigger on these fully-loaded lines
You're gonna wish I would've pulled a black nine
I mack dimes, crack the spines of the fake gangsters
Yeah the bitin' triflin' niggas and the studio pranksters
Yo, lookin' at the situation plainly, will you remain, G?
Or will you be looked upon strangely?
I reign as the articulator with the greater data
Revolvin' on the TASCAM much doper than my last jam
While others struggle to juggle tricky metaphors
I explore more to expose the core
A lot of emcees act stupid to me
And we have yet to see if they can match our longevity
But anyway, it's just another day
Another fake jack I slay with my spectac' rap display
Style's smooth but rugged, you can't push or shove it
You dig it and you dug it 'cause like money you love it
The king of monotone, with my own throne
Righteously violent prone, my words bring winds like cyclones
Stormin' your hideout, blockin' out your sunlight
Your image and your business were truly not done right
Throw up your He Allah Now Divine Saviours
You got no hand skills, there's no security to save ya
No pager, no celly, no drop top Benz-y
I came to bring your phony hip-hop to an ending
My art of war will leave you sore from the abuse
'Cause you must meet your moment of truth
They say it's lonely at the top in whatever you do
You always gotta watch motherfuckers around you
No one is untouchable, no man is bulletproof
We all must meet our moment of truth",https://open.spotify.com/track/1fotoYONO343JjbC8XvPSl,247
Mostly Tha Voice,Hard To Earn,https://open.spotify.com/album/67kl5m0df6Bn0aSe3g5Ea7,1994,1502427,"Refrain:
It's mostly tha voice, that gets you up
It's mostly tha voice, that makes you buck
A lot of rappers got flavor, and some got skills
But if your voice ain't dope then you need to (chill... chill...)
Up steps one, and he gets done
Then up steps another, he gets smothered
That's word to mother, or should I say moms
I drop bombs, scorchin niggaz like napalm
Sucka, boy, get off my shit
Get off my dick so what I make butter hits
You better change your behavior, battling gangstarr
No religion could save ya
My religion is rap, r-a-p
R-e-a-l-i-t-y, g
Cause when I rock street kids rejoice
I got mad rhymes, still
Refrain
So when you think you know the whole you don't even know the half
You're not a threat to myself, and neither to my staff
Not the type to really dance too much, although I used to
Rather bust a fresh line, and get loose to
The blunted ill types of beats premier makes
Makes your girl's rear shake, let me set it straight
Refrain
Some rappers use hooks to this shit
But if you took that shit out
And you took all the music out
What would remain? the voice no doubt
Bless my soul I control
When in pimp mode
My bank roll expands
I invest in my man
I plan, to keep rap real
So if your shit ain't fat then kneel
You squeal, feeling pain from my oral flex
What about oral sex, which chick's next
To open wide and get a chunk from a real brother
Yeah, some real funk from a real brother
They get sprung and most of them don't recover
But I don't diss em I just talk to em
Cause the sound, of my voice, it does a lot to em
So you and, the niggaz right there
Be aware, like swv, I'm right here
Waitin to correct your ass
And if you don't follow now I'll disrespect your ass
More vicious than sid, do a crime with no bid
I tell a bitch that I didn't when you know that I did
Take a trip to a land a-far
Then come back, and people still know gangstarr
See I'm the ladies choice
Cause I got crazy styles, still
Refrain
Outro: guru, shug
Oh shit shug, whattup
(whassup money?)
Just loungin, about to go do this shit in the studio
(oh yeah, you just let me get on that shit
You always said I could get on, you need to let me get on that)
Word?
(for real man)
Yo man
(don't front on that shit)
I'm sayin yo, if I let you get busy, youknowhati'msayin
You can't be dissapointin me
(i flip shit, i'ma flip shit on this)
Aight man, let's go",https://open.spotify.com/track/5fTEAlbus94isuRuQqQts2,218
