SongName,AlbumName,AlbumLink,Year,Runtime,PlayCount,Lyrics,SongLink
Made In America,Watch The Throne (Deluxe),https://open.spotify.com/album/2if1gb3t6IkhiKzrtS9Glc,2011,4:52,"41,086,235","And He'll bring you out the, out the darkness
Sweet King Martin, sweet Queen Coretta
Sweet Brother Malcolm, sweet Queen Betty
Sweet Mother Mary, sweet Father Joseph
Sweet Jesus, we made it in America
Sweet baby Jesus (ooh, ooh-ooh-ooh)
Oh, sweet baby Jesus, we made it in America
Sweet baby Jesus (ooh)
Oh, sweet baby Jesus, we made it in America
I told my mama I was on the come up
She said, ""You going to school, I'll give you a summer""
Then she met No I.D. and gave me his number
Ten years later she driving a Hummer
Niggas hustle every day for a beat from Ye
What I do? Turn around gave them beats to Jay
And I'm rapping on the beat they was supposed to buy
I guess I'm getting high off my own supply
Downtown mixing fabrics tryna find the magic
Started a little blog just to get some traffic
Old folks'll tell you not to play in traffic
A million hits and the web crashes, damn!
South Park had them all laughing
Now all my niggas designing and we all swaggin', uh
Ignore the critics just to say we did it
This ain't no fashion show motherfucker, we live it
Sweet King Martin, sweet Queen Coretta
Sweet Brother Malcolm, sweet Queen Betty
Sweet Mother Mary, sweet Father Joseph
Sweet Jesus, we made it in America
Sweet baby Jesus (ooh, ooh-ooh-ooh)
Oh, sweet baby Jesus, we made it in America
Sweet baby Jesus (ooh)
Oh, sweet baby Jesus, we made it in America
I pledge allegiance to my grandma
For that banana pudding, our piece of Americana
Our apple pie was supplied through Arm and Hammer
Straight out the kitchen, shh, don't wake Nana
Built a republic that still stands
I'm tryna lead a nation, to leave to my little man's
Or my daughter, so I'm boiling this water
The scales was lopsided, I'm just restoring order
Hold up, here comes grandma, what's up Yiayia?
What's that smell? Oh I'm just boiling some agua
No papa, bad Santa
The streets raised me, pardon my bad manners
I got my liberty chopping grams up
Street justice, I pray God understand us
I pledge allegiance to all the scramblers
This is the Star Spangled Banner
Sweet King Martin, sweet Queen Coretta
Sweet Brother Malcolm, sweet Queen Betty
Sweet Mother Mary, sweet Father Joseph
Sweet Jesus, we made it in America
Sweet baby Jesus (ooh, ooh-ooh-ooh)
Oh, sweet baby Jesus, we made it in America
Sweet baby Jesus (ooh)
Oh, sweet baby Jesus, we made it in America
Yes, we did
♪
Sweet baby Jesus (ooh, ooh-ooh-ooh)
Oh, sweet baby Jesus, we made it in America
Sweet baby Jesus (ooh)
Oh, sweet baby Jesus, we made it in America
Yes, we did",https://open.spotify.com/track/57CdogxwhzdHhqjj0115He
Welcome To The Jungle,Watch The Throne,https://open.spotify.com/album/0OcMap99vLEeGkBCfCwRwS,2011,2:54,"36,265,188","Welcome to the jungle, welcome to the jungle well
Welcome to the jungle, welcome to the jungle well
I asked her where she wanna be when she 25
She turned around and looked at me and said ""alive""
Welcome to the jungle, welcome to the jungle well
Black Axl Rose
Move halfs and wholes
Come down to the jungle
Just ask for Hov
Move blocks and squares
Move apples and pears
Work pots and pans
Just to cop me some Airs
My uncle died
My Daddy did too
Paralyzed by the pain
I can barely move
My nephew gone
My heart is torn
Sometimes I look to the sky
Ask why I was born
My faith in God
Every day is hard
Every night is worse
That's why I pray so hard
Why I pray so hard
This is crazy God
Just when I thought I had everything
I lost it all
So que sera
Get a case of Syrah
Let it chase the pain
Before it goes too far
My dreams is big
Reality set in
Let off a clip from a automatic weapon
Through shots in the door
It died in Vegas
Though it fought so hard
I knew it wouldn't make it
I'm a tortured soul
I live in disguise
Rest in peace to the leader of the Jackson 5
I died in my sleep
I'm still Big Pimpin
I ball at the mall
Beginning of the ending
Where the fuck is the sun?
It's been a while
Momma, look at ya son
What happened to my smile?
My tears is tatted
My rag in my pocket
I'm just looking for love
I know somebody got it
Champagne for the pain
Weed for the low
God damn I'm so high
Where the fuck did I go?
I'm losing myself
I'm stuck in the moment
I look in the mirror
My only opponent
Where the fuck is the press?
Where the fuck is the Pres?
Either they know or don't care
I'm fucking depressed
No crying in public
Just lying to judges
Risking my life
I'm already dying, so fuck it well
Welcome to the jungle, welcome to the jungle well
Goddammit!",https://open.spotify.com/track/0y0imMk6KsO90MaHG4MVAl
Hell Of A Life,My Beautiful Dark Twisted Fantasy,https://open.spotify.com/album/20r762YmB5HeofjMCiPMLv,2010,5:27,"124,700,955","I think I just fell in love with a pornstar
Turn the camera on, she a born star
Turn the corners in a foreign car
Call the coroners, do the CPR
She gave that old nigga a ulcer
Her bittersweet taste made his gold teeth ache, uh
Make her knees shake, make a priest faint, uh
Make a nun cum, make her cremate, uh
Move downtown, cop a sweet space, uh
Livin' life like we won the sweepstakes, what?
We headed to hell for Heaven's sakes, huh
Well, I'ma levitate, make the devil wait, yeah
Have you lost your mind?
Tell me when you think we crossed the line
No more drugs for me, pussy and religion is all I need
Grab my hand and baby, we'll live a hell of a life
♪
Never in your wildest dreams
Never in your wildest dreams, in your wildest
You could hear the loudest screams
Comin' from inside the screen, you a wild bitch
Tell me what I gotta do to be that guy
Said her price go down, she ever fuck a black guy
Or do anal, or do a gangbang
It's kinda crazy that's all considered the same thing
Well, I guess a lotta niggas do gangbang
And if we run trains, we all in the same gang
Runaway slaves all on a chain gang
Bang, bang, bang, bang, bang
Have you lost your mind?
Tell me when you think we crossed the line
No more drugs for me, pussy and religion is all I need
Grab my hand and baby, we'll live a hell of a life
♪
One day, I'm gon' marry a pornstar
We'll have a big-ass crib and a long yard
We'll have a mansion and some fly maids
Nothin' to hide, we both screwed the bridesmaids
She wanna roleplay 'til I roll over
I'ma need a whole day, at least roll doja
What party is we goin' to on Oscar day?
'Specially if she can't get that dress from Oscar de
La Renta, they wouldn't rent her, they couldn't take the shame
Snatched the dress off her back and told her, ""Get away""
How could you say they live they life wrong
When you never fuck with the lights on?
Fuck with the lights
Fuck with the, with the lights on
Fuck with the lights
Fuck with the, with the lights on
Fuck with the lights on
With the, with the lights on
Fuck with the lights
Fuck with the, with the lights on
Fuck, fuck with the lights
Fuck with the, with the lights on
Fuck with the lights
Fuck with the, with the lights on
Have you lost your mind?
Tell me when you think we crossed the line
No more drugs for me, pussy and religion is all I need
Grab my hand and baby, we'll live a hell of a life
♪
I think I fell in love with a pornstar
And got married in the bathroom
Honeymoon on the dance floor
And got divorced by the end of the night
That's one hell of a life
♪
(Mmm, mmm, mmm)
(Mmm, mmm, mmm)
(Mmm, mmm, mmm)
(Mmm, mmm, mmm, mmm, mmm, mmm)
(Mmm, mmm, mmm, mmm, mmm, mmm)",https://open.spotify.com/track/3rCNmRonlHN1TXQLcG3dSk
Why I Love You,Watch The Throne,https://open.spotify.com/album/0OcMap99vLEeGkBCfCwRwS,2011,3:21,"223,362,710","Ohh I love you so
But why I love you, I'll never know
Ohh I love you so
But why I love you, I'll never know
Ohh I love you so
But why I love you, I'll never know
Ohh I love you so
But why I love you, I'll never know
Picture if you will that the throne is burning
Rome's burning and I'm sitting in the corner all alone burning
Why does it always end up like this?
Something that we don't determine
Same people that I fought for, that I fight for, that I ride for
That I live for, that I die for be the reason that these niggas is alive for
And they want me dead but I'm so sorry but I just can't die for you
But I can make 'em put their hands in the sky for you
We waiting for the fireworks like July 4th
Get fly more, get high more, cry boy, why for?
When the grief is over, beef is over
I'll be fly when Easter's over
I tried to teach niggas how to be kings
And all they ever wanted to be was soldiers
So the love is gone 'til blood is drawn
So we no longer wear the same uniform
Fuck you squares, the circle got smaller
The castle got bigger, the walls got taller
And truth be told after all that said
Niggas still got love for you
Ohh I love you so
But why I love you, I'll never know
Ohh I love you so
But why I love you, I'll never know
Ohh I love you so
But why I love you, I'll never know
Ohh I love you so
But why I love you, I'll never know
Showed love to you niggas, you ripped out my heart
And you stepped on it, I picked up the pieces before you swept on it
Goddamn this shit leaves a mess, don't it?
Shit feelin' like death, don't it?
Charge it to the game, whatever's left on it
I spent about a minute, maybe less on it
Fly pelican fly, turn the jets on it but first I shall digress on it
Wasn't I a good king? (Maybe too much of a good thing, huh?)
Didn't I spoil you? Me or the money, what you loyal to?
(Huh, I gave you my loyalty) Made you royalty and royalties
(Took care of these niggas' lawyer fees) and this is how niggas rewardin' me, damn
Ohh I love you so
But why I love you, I'll never know
Ohh I love you so
But why I love you, I'll never know
Bussin' at me, b-b-b-bussin' at me
But I'm bullet proof, bitch you can't get nothin' past me
Got body armor (A nigga gotta watch the throne)
And I'm bussin' back so niggas in a glass house should not throw stones
What do you do when the love turns the hate?
(Gotta separate from these fuckin fakes)
Caesar didn't see it so he ceased to exist
So the nigga that killed him had keys to his shit
Am I my brother's keeper? (Only if that nigga don't creep up)
Got a pistol under my pillow (I've never been a deep sleeper)
P-p-p-paranoia
(Cause the nigga that said he'll) blast for ya (is now) blastin for ya
That's an assassin for ya (These niggas got a shot they'll shoot)
Please Lord (forgive him) for these niggas (not know) what they do, ooh",https://open.spotify.com/track/4bDPr2VAjcfgUDmN9dGOC3
Bound 2,Yeezus,https://open.spotify.com/album/7D2NdGvBHIavgLhmcwhluK,2013,3:49,"1,249,425,913","B-B-B-Bound to fall in love
Bound to fall in love
(Uh-huh, honey)
All them other niggas lame, and you know it now
When a real nigga hold you down, you supposed to drown
Bound (bound) to fall in love
B-B-B-Bound (bound) to fall in love
(Uh-huh, honey)
What you doing in the club on a Thursday?
She say she only here for her girl birthday
They ordered champagne but still look thirsty
Rock Forever 21 but just turned 30
I know I got a bad reputation
Walk-around-always-mad reputation
Leave-a-pretty-girl-sad reputation
Start a Fight Club, Brad reputation
I turnt the nightclub out of the basement
I'll turn the plane around, your ass keep complaining
How you gon' be mad on vacation?
Dutty wining 'round all these Jamaicans
Uh, this that prom shit
This that what we do, don't tell your mom shit
This that red cup, all on the lawn shit
Got a fresh cut, straight out the salon, bitch
I know you're tired of loving, of loving
With nobody to love, nobody, nobody (uh-huh, honey)
Close your eyes and let the word paint a thousand pictures
One good girl is worth a thousand bitches
Bound (bound) to fall in love
Bound (bound) to fall in love (uh-huh, honey)
I wanna fuck you hard on the sink
After that, give you something to drink
Step back, can't get spunk on the mink
I mean damn, what would Jeromey Romey Romey Rome think?
Hey, you remember where we first met?
Okay, I don't remember where we first met
But hey, admitting is the first step
And hey, you know ain't nobody perfect
And I know, with the hoes I got the worst rep
But hey, their backstroke I'm tryna perfect
And hey, ayo, we made it, Thanksgiving
So hey, maybe we can make it to Christmas
She asked me what I wished for on the wishlist
Have you ever asked your bitch for other bitches?
Maybe we could still make it to the church steps
But first, you gon' remember how to forget
After all these long-ass verses
I'm tired, you tired, Jesus wept
I know you're tired of loving, of loving
With nobody to love, nobody, nobody
So just grab somebody, no leaving this party
With nobody to love, nobody, nobody
♪
Uh-huh, honey
Jerome's in the house, watch your mouth
Jerome's in the house, watch your mouth
Bound (bound) to fall in love
Bound (bound) to fall in love
(Uh-huh, honey)",https://open.spotify.com/track/3sNVsP50132BTNlImLx70i
Low Lights,The Life Of Pablo,https://open.spotify.com/album/7gsWAHLeT0w7es6FofOXk1,2016,2:11,"71,791,981",No Lyrics,https://open.spotify.com/track/36o4taPyOdnOMf01ERmn9a
No More Parties In LA,The Life Of Pablo,https://open.spotify.com/album/7gsWAHLeT0w7es6FofOXk1,2016,6:14,"305,582,952","La-di-da-da, da (I'd like to play)
La-da-da-da-di-da-da, la
Let me tell you, I'm out here from a very faraway place
All for the chance to be a star, nowhere seems to be too far
No more parties in LA
Please, baby, no more parties in LA, uh
No more parties in LA
Please, baby, no more parties in LA, uh
No more (Los Angeles)
Please (shake that body, party that body)
Please (shake that body, party that body)
Please (shake that body, party that body)
Hey baby, you forgot your Ray-Bans
And my sheets still orange from your spray tan
It was more than soft porn for the caveman
She remember my Sprinter, said, ""I was in the grape van""
Uh, lil cutie, I like your bougie booty
Come Erykah Badu me, well, let's make a movie
Hell, you know my repertoire is like a wrestler (shake that body, party that body)
I show you the ropes, connect the dots (shake that body, party that body)
A country girl that love Hollywood
Mama used to cook red beans and rice (Los Angeles)
Now it's Denny's, 4:00 in the morning, spoil your appetite
Liquor pourin' and niggas swarmin' your section with erection
Smoke in every direction, middle finger pedestrians
R 'n' B singers and lesbians, rappers and managers
Music and iPhone cameras
This shit unanimous for you, it's damagin' for you, I think
That pussy should only be holding exclusive rights to me
I mean, he flew you in this motherfucker on first class (Los Angeles)
Even went out his way so you could check in an extra bag
Now you wanna divide the yam like it equate the math?
That shit don't add up, you're makin' him mad as fuck
She said she came out here to find an A-list rapper (Los Angeles)
I said, ""Baby, spin that round and say the alphabet backwards
You're dealin' with malpractice, don't kill a good nigga's confidence (shake that body, party-)
Just 'cause he a nerd, and you don't know what a condom is"" (shake that body, party that-)
The head still good though, the head still good though
Make me say, ""Nam-myoho-renge-kyo""
Make a nigga say big words and act lyrical
Make me get spiritual, make me believe in miracles (let me tell you)
Buddhist monks and Cap'n Crunch cereal (I'm out here, from a very)
Lord, have mercy, thou will not hurt me (faraway place)
Five buddies all herded up on a Thursday
Bottle service, head service, I came in first place
The opportunity, the proper top of breast and booty cheek
The pop community, I mean these bitches come with union fee
And I want two of these, movin' units through consumer streets
Then my shoe released, she was kickin' in gratuity
And yeah G, I was all for it (Los Angeles)
She said, ""K. Lamar, you kind of dumb to be a poet (shake that body, party that body)
I'ma put you on game for the lames that don't know they're a rookie"" (shake that body)
Instagram is the best way to promote some pussy (pussy)
Scary
Scary
No more parties in LA
Please, baby, no more parties in LA
Friday night tryna make it into the city (Los Angeles)
Breakneck speeds, passenger seat somethin' pretty
Thinkin' back to how I got here in the first place (shake that body, party that body)
Second class bitches wouldn't let me on first base (shake that body, party that body)
A backpack nigga with luxury taste buds (Los Angeles)
And the Louis Vuitton store, got all of my pay stubs
Get pussy from beats I did for niggas more famous
When did I become A list? I wasn't even on a list
Strippers get invited to where they only get hired
When I get on my Steve Jobs, somebody gon' get fired
I was uninspired since Lauryn Hill retired
Earned three stacks man, you preacher it to the choir
Any rumour you ever heard about me was true and legendary (Los Angeles)
I done got Lewinsky and paid secretaries
For all my niggas with babies by bitches
That use they kids as meal tickets
Not knowin' the disconnect from the father (shake that body, party that body)
The next generation will be the real victims (shake that body, party that body)
I can't fault 'em really (Los Angeles)
I remember Amber told my boy no matter what happen
She ain't going back to Philly
Back to our regularly scheduled programmin'
Of weak content and slow jammin' (let me tell you)
But don't worry, this one's so jammin' (I'm out here from a very far-)
You know it, LA, it's so jammin'
I be thinkin' every day, Mulholland Drive (the chance to be a star)
Need to put up some god-damn barricades, I be paranoid every time
The pressure, the problem ain't I be drivin', the problem is, I be textin'
My psychiatrist got kids that I inspired
First song they played for me was 'bout their friend that just died
Textin' and drivin' down Mulholland Drive (Los Angeles)
That's why I'd rather take the 405 (shake that body, body that party)
I be worried 'bout my daughter, I be worried 'bout Kim (shake that body, body that party)
But Saint is baby Ye, I ain't worried 'bout him
I had my life threatened by best friends who had selfish intents
What I'm supposed to do? Ride around with a bulletproof car and some tints?
Every agent I know, know I hate agents
I'm too black, I'm too vocal, I'm too flagrant
Somethin' smellin' like shit, that's the new fragrance (Los Angeles)
It's just me, I do it my way, bitch
Some days I'm in my Yeezy's, some days I'm in my Vans (shake that body, body that party)
If I knew y'all made plans, I wouldn't have popped the Xanax (shake that body, body that party)
I know some fans who thought I wouldn't rap like this again (Los Angeles)
But the writer's block is over, Emcees cancel your plans
A 38-year-old, eight-year-old with rich nigga problems
Tell my wife that I hate the Rolls, so I don't never drive it
It took six months to get the Maybach all matted out
And my assistant crashed it soon as they backed it out
God-damn, got a bald fade, I might slam
Pink fur, got Nori dressin' like Cam, thank God for me (Los Angeles)
Whole family gettin' money, thank God for E!
I love rockin' jewellery, a whole neck full
Bitches say he funny and disrespectful
I feel like Pablo when I'm workin' on my shoes (Los Angeles)
I feel like Pablo when I see me on the news
I feel like Pablo when I'm workin' on my house (shake that body, body that party)
Tell 'em party's in here, we don't need to go out (shake that body, body that party)
We need the turbo thoughts, high speed, turbo thoughts
Drop-dro-dro-dro-drop it like Robocop
She brace herself and hold my stomach, good dick'll do that
She keep pushin' me back, good dick'll do that
She push me back when the dick go too deep (I'm out here from a)
This good dick'll put your ass to sleep (very faraway place)
Get money, money, money, money (all for the chance)
Big, big money, money, money, money (to be a star, nowhere seems to be too far)
And as far as real friends, tell all my cousins I love 'em
Even the one that stole the laptop, you dirty motherfucker
I just keep on lovin' you, baby
And there's no one else I know who can take your place
Please, no more parties in LA (shake that body, body that party)
Please, baby, no more parties in LA, uh (shake that body, body that party)
No more parties in LA (Los Angeles)
Please, baby, no more parties in LA, uh
No more parties in LA
Please, baby, no more parties in LA, uh
Let me tell you, I'm out here, from a very faraway place
All for a chance to be a star, nowhere seems to be too far",https://open.spotify.com/track/0zLClc0emc6qUeV1p5nc99
Guilt Trip,Yeezus,https://open.spotify.com/album/7D2NdGvBHIavgLhmcwhluK,2013,4:03,"62,648,381","I need to call it off
I need to, I need to make it known
'Nother one, something gone, Capricorn
Dancing out on the lawn
Fancy like the things she likes
I'm losing my, I'm living mine
All dem a gwaan, dem a, dem a, dem a gwaan
Dem a gwaan, gwaan, gwa-gwa-gwaan, soft-soft-soft, soft-soft
All dem a gwaan, dem a, dem a, dem a gwaan, gwaan, gwaan, gwa-gwaan softer than clay
Maybe it's 'cause
She into Leos and I was into trios
Plus all the trips to Rio couldn't have helped
It's getting cold, better bring your ski clothes
Peekin' through the keyhole, the door locked by myself
And I'm feelin' it right now
'Cause it's the time when my heart got shot down
Blocka, blocka, blocka-blocka, blocka
Pour a little champagne, cranberry vodka
Feelin' lied to like parents never said you adopted
Your feelings like Zulu, then nothing is a Shaka
I hit her with Jamaican dick, I'm the new Shabba
She lookin' for her daddy, call me Big Poppa
On to the next saga
Focus on the future and let the crew knock her
Star Wars fur, yeah, I'm rockin' Chewbacca
The one Chief Rocka, number one Chief Rocka, oh
All dem a gwaan, dem a, dem a, dem a gwaan
Dem a gwaan, gwaan, gwa-gwa-gwaan, soft-soft-soft, soft-soft
All dem a gwaan, dem a, dem a, dem a gwaan, gwaan, gwaan, gwa-gwaan softer than clay
All dem a gwaan, dem a, dem a, dem a gwaan
Dem a gwaan, gwaan, gwa-gwa-gwaan, soft-soft-soft, soft-soft
Nun a dem have di guts to rise it and spray
Nun a dem have di guts to bust the SK
♪
Oh, oh, oh
If you love me so much, then why'd you let me go?
If you love me so much, then why'd you let me go?
If you love me so much, then why'd you let me go, who-whoa?
Let me go, who-whoa
Let me go, who-whoa
Let me go, who-whoa, who-whoa, hmmm
If you love me so much, then why'd you let me go, who-whoa?
Let me go, who-whoa, who-whoa, hmmm
All dem a gwaan, dem a, dem a, dem a gwaan
Dem a gwaan, gwaan, gwa-gwa-gwaan, soft-soft-soft, soft-soft
All dem a gwaan, dem a, dem a, dem a gwaan, gwaan, gwaan, gwa-gwaan softer than clay
All dem a gwaan, dem a, dem a, dem a gwaan
Dem a gwaan, gwaan, gwa-gwa-gwaan, soft-soft-soft, soft-soft
Nun a dem have di guts to rise it and spray
Nun a dem have di guts to bust the SK",https://open.spotify.com/track/5nPOM0nFRAJ3XI8xCxNAzO
I Thought About Killing You,ye,https://open.spotify.com/album/2Ek1q2haOnxVqhvVKqMvJe,2018,4:34,"119,772,061","I know, I know, I know, I know, know
I know, I know, I know, I know, know
I, I know it, I know it
The most beautiful thoughts are always besides the darkest
♪
Today I seriously thought about killing you
I contemplated, premeditated murder
And I think about killing myself
And I love myself way more than I love you, so
Today I thought about killing you
Premeditated murder
You'd only care enough to kill somebody you love
The most beautiful thoughts are always inside the darkest
(Mhm-mhm-mhm-mhm-mhmm)
Just say it out loud to see how it feels
People say ""don't say this, don't say that""
Just say it out loud, just to see how it feels
Weigh all the options, nothing's off the table
Today I thought about killing you
Premeditated murder
I think about killing myself
And I, I love myself way more than I love you
The most beautiful thoughts are always besides the darkest
(Mhm-mhm-mhm-mhm-mhm-mhm-mhm-mhm-mhmm)
I think this is the part where I'm supposed to say somethin' good
To compensate it so it doesn't come off, bad
But sometimes I think really bad things
Really, really
Really bad things
And I love myself way more than I love you
♪
See, if I was trying to relate it to more people
I'd probably say I'm struggling with loving myself
Because that seems like a common theme
But that's not the case here
I love myself way more than I love you
And I think about killing myself
So, best believe, I thought about killing you today
Premeditated murder
I called up my loved ones, I called up my cousins
I called up the Muslims, said I'm 'bout to go dumb
Get so bright it's no sun, get so loud I hear none
Screamed so loud got no lungs, hurt so bad I go numb
Time to bring in the drums, that prrt-pum-pum-pum
Set the NewTone on 'em, set the nuke off on 'em
I need Coke with no rum, I taste coke on her tongue
I don't joke with no one, they'll say he die so young
I done had a bad case of too many bad days
Got too many bad traits
Used the floor for ashtrays
I don't do shit halfway, I'ma clear the cache
I'ma make my name last, put that on my last name
It's a different type of rules that we obey
Ye, Ye, Ye season, nigga, we obey
We was all born to die, nigga DOA
Niggas say they hero, mhm
I don't see no cape
Mhm, I don't see no, mhm, yeah
I don't see no, mhm, mhm
If I wasn't shinin' so hard, wouldn't be no shade
Buckwheat-ass nigga, it's 'gon be o-tay
♪
Young nigga shit, nigga, we don't age
I thought I was past my Deebo ways
Even when I went broke, I ain't break
How you gon' hate? Nigga, we go way back
To when I had the braids and you had the wave cap
Drop a pin for the fade and I'm on my way ASAP
Don't get socked in the mouth
You know homie don't play that
Pay the fire marshal bill
'Cause this shit done got way packed
They wanna see me go ape (Ape, ape)
All you gotta do is speak on Ye
All you gotta do is speak on Ye
Don't get your tooth chipped like Frito-Lay",https://open.spotify.com/track/0yhxBvedRdGxsPZHJNI4VA
