SongName,AlbumName,AlbumLink,Year,Runtime,PlayCount,Lyrics,SongLink
BEG FORGIVENESS,VULTURES 1,https://open.spotify.com/album/4DOsPwJtokv6HEifZ6t5j6,2024,6:08,"51,739,024","You've gone too far
You've gone too far, and you should hang your head in shame
For these wounds, I cannot stay, you've gone too far
You've gone too far
Wide awake and I can't hear my heartbeat
Hope it cradles me and rocks my heart to sleep
Protector in the light and a stranger in the dark, you don't say anything more
Bound by suffocatin' secrets, I must keep
You've gone too far
You've gone too far, and you should hang your head in shame
For these wounds, I cannot stay, you've gone too far
You've gone too far
Sum of all the parts that you have taken
Are a fraction of the parts that make me whole
For he was stronger than I was, but it's strength you can't sustain
Do not come to give me counsel, you should beg forgiveness of me
You should beg forgiveness
You should beg forgiveness
You should beg forgiveness
You should beg forgiveness of me
Wide awake and I can't hear my heartbeat
Hope it cradles me and rocks my heart to sleep
Protector in the light and a stranger in the dark, he don't say anything more
Bound by suffocatin' secrets, I must keep
You've gone too far
You've gone too far, and you should hang your head in shame
For these wounds, I cannot stay, you've gone too far
You've gone too far
Sum of all the parts that you have taken
Are a fraction of the parts that make me whole
For he was stronger than I was, but it's strength you can't sustain
Do not come to give me counsel, you should beg forgiveness of me
You should beg forgiveness
You should beg forgiveness
You should beg forgiveness
You should beg forgiveness of me
Fuck it up one time
I know what you want, I'm readin' the signs
Don't let your moment pass you by
Don't let your moment pass you by
Had to go in my whole life
A hunnid percent covered in ice
Put down your phone, cut off the lights, lights
Cut off the lights, covered in ice
And if I go tonight, know that I lived a lovely life
Just make sure my kids are right and it is alright
And if I go tonight, just know I lived a lovely life
Tell my kids to live they life how they wanna live they life
♪
Forgiveness, beg forgiveness
Beg forgiveness, beg forgiveness
Beg forgiveness, beg forgiveness
Beg forgiveness, beg forgiveness
Beg forgiveness, beg forgiveness
Beg forgiveness, beg forgiveness
Beg forgiveness, beg forgiveness
Beg forgiveness
Say you wanna make amends before I go (beg forgiveness, beg forgiveness)
Now you wanna put your heart on the line (beg forgiveness, beg forgiveness)
God knows the way you are, I will wait (beg forgiveness)
I will wait, I will wait, I will wait, I will wait
I will wait, I will wait
I will wait, I will wait
I will wait, don't wait, I will wait (forgiveness, beg forgiveness)
I will wait, I will wait (beg forgiveness, beg forgiveness, beg forgiveness)
I will wait
Now you wanna be so sad
Wanna be with me so bad after drivin' me so mad
Yeah, you know, I'm still suffocatin' on your every lie (forgiveness, beg forgiveness)
Yeah, you know, I'm still wakin' up with murder on my mind (beg forgiveness, beg forgiveness, beg forgiveness)
Yeah, you know, I'm still suffocatin' on your every lie
Yeah, you know, I'm still wakin' up with murder on my mind (beg forgiveness, beg forgiveness)
And you know
Beg forgiveness, beg forgiveness (oh-ah-ah)
Beg forgiveness, beg forgiveness (oh-ah-ah)
Beg forgiveness, beg forgiveness (oh-ah-ah)
Beg forgiveness (oh-ah-ah)
Beg forgiveness",https://open.spotify.com/track/2anbsZVE7y9yhI4KD7QYI0
Hurricane,Donda,https://open.spotify.com/album/5CnpZV3q5BcESefcB3WJmz,2021,4:03,"461,581,125","See this in 3D, all lights out for me
All lights out for me, lightning strikes the beach
80 degrees, warm it up for me
Finally free, found the God in me
And I want you to see, I can walk on water
Thousand miles from shore, I can float on the water
Father, hold me close, don't let me drown
I know you won't
Yeah, walking on the bridge, I threw my sins over the deep end
Sipping 'til my stomach hurt, this month I done lost three friends
Early morning, brainstorming, normally I can't sleep in
Sometimes I just wanna restart it, but it all depends
If I'ma be the same young hungry - from West End
Wrote my hardest wrongs and the crazy part, I ain't have no pen
Maybach interior came with sheepskin
Still remember when I just had three bands
Now I'm the one everyone calling on 'cause I got deep pants
Bro' told me to wait to beat the game, it's all in defense
And never fazed by names that they might call me, but they gon' respect it
And I feel like you better off tryin' to call, I might not get the message
And she just tried to run off with my heart, but I blocked off the exit, yeah
Oh-oh, I know You won't, I know You won't, I know You won't
♪
I know You won't, I know that You look over us
So we silently sleep
Bring down the rain, yeah, oh-oh
♪
Mm-mm-mm, mm-mm, I was out for self
Mm-mm-mm, mm-mm, I was up for sale
But I couldn't tell
God made it rain, the devil made it hell
Dropped out of school, but I'm that one at Yale
Made the best tracks and still went off the rail
Hat go down, down, down, this the new town, town, town
This the new ten, ten, ten, I'm going in, in, in
Here I go on a new trip, here I go acting too lit
Here I go acting too rich, here I go with a new chick
And I know what the truth is, still playing after two kids
It's a lot to digest when your life always moving
Architectural Digest, but I needed home improvement
60 million dollar home, never went home to it
Genius gone clueless, it's a whole lot to risk
Alcohol Anonymous, who's the busiest loser?
Heated by the rumors, read into it too much
Fiending for some true love, ask Kim, ""What did you love?""
Hard to find what the truth is, but the truth was that the truth suck
Always seem to do stuff, but this time it was too much
Mm-mm-mm, mm-mm, everybody so judgmental
Everybody so judgmental
Everybody hurts, but I don't judge rentals
Mm-mm-mm, mm-mm, it was all so simple
I see you in 3D, the dawn is bright for me
No more dark for me, I know you're watching me
80 degrees, burning up the leaves
Finally, I'm free, finally, I'm free
As I go out to sea, I can walk on water
Won't you shine Your light? Demons stuck on my shoulder
Father, hold me close, don't let me drown
I know you won't",https://open.spotify.com/track/6Hfu9sc7jvv6coyy2LlzBF
Every Hour,JESUS IS KING,https://open.spotify.com/album/0FgZKfoU2Br5sHOfvZKTI9,2019,1:52,"63,062,842","Every hour (every hour)
Every minute (every minute)
Every second (every second)
Each and every millisecond
We need you (we need you)
We need you (we need you)
We need you
Oh, we need you
Sing 'til the power of the Lord comes down
Sing 'til the power of the Lord comes down
Let everything that have breath praise God
'Cause when we sing the Glory of the Lord comes down
Praising the Lord, praise God in the Sanctuary
For His mighty works and His excellent grace and His mighty power
Sing 'til the power of the Lord falls down
We oughta sing 'til the power of the Lord comes down
Let us sing, let us sing, oh, sing
Let us sing, let us sing, oh, sing
Every hour (every hour)
Every minute (every minute)
Every second (every second)
Each and every millisecond
We need you (we need you)
We need you (we need you)
We need you
Oh, we need you
Sing 'til the power of the Lord comes down
Sing 'til the power of the Lord comes down
Every hour (every hour)
Every minute (every minute)
Every second (every second)
Each and every millisecond
We need you (we need you)
We need you (we need you)
We need you
Oh, we need you",https://open.spotify.com/track/1WnqWQcWcuQbVzgE7ecfCY
FRIED,VULTURES 2,https://open.spotify.com/album/5RV2TNyjylqWJNxQyHBTeJ,2024,2:46,"27,796,095","Oh-whoa, oh-whoa
Oh-whoa, oh-whoa
Oh-whoa
I done had too many friends that died
Sometimes, I can't believe I'm still alive
She told you I ain't had it, but she lied
Boy, don't play with me, you know I'm fried
Boy, don't play with me, you know I'm fried
She givin' blowjobs and I applied
She said she starvin', order her some fries
Then I ate the breast, then the thighs
Then I gave the rest to the guys
You was typin' crazy, out your mind
This is not a typo, we reply
Now you spillin' Type-O, out your side
Boy, don't play with me, you know I'm-
Boy, don't play with me, you know I'm fried
Pray on our enemies when we dine
We just hope the feds take a bribe
Only one gon' walk away when we collide
20 dollars, now that's fuckin' mine
Ten bitches came with Dolla, they all dimes
They offerin' blowjobs and I applied
They all starvin', order them some fries
Then I lick the breast, then the thighs
Bitch, don't play with me, you know I'm-
♪
Boy, don't play with me, you know I'm fried
Ooh, swervin' in the Lamb' off the lot
Five percent the tint with no top
They love me in my city like I'm Pac
Remember when we used to window-shop?
Now, I just whipped the Porsche to the mosque
Ye copped me the chain with the cross
Had to throw some hundos in the wash
Baby, take a seat and take it off
So much ice on me, I can't defrost
Where them that was sayin' I fell off?
Boy, don't play with me, you know I-
Boy, don't play with me, you know I'm fried
Oh-whoa, oh-whoa
Oh-whoa, oh-whoa
Oh-whoa, oh-whoa
Oh-whoa, oh-whoa
Oh-whoa, oh-whoa
Oh-whoa, oh-whoa",https://open.spotify.com/track/4Qay2jEWJYjXmJ8eNOGtaD
FUK SUMN,VULTURES 1,https://open.spotify.com/album/4DOsPwJtokv6HEifZ6t5j6,2024,3:29,"218,047,956","Smokin' on a junt with my niggas drinkin' O.E
Stop off, stop off at the liquor store
Get your 'Gnac, then we headed for the Indo
Smokin' on a junt with my niggas drinkin' O.E
Stop off, stop off at the liquor store
Get your 'Gnac, then we headed for the Indo
I'm tryna fuck somethin' right now
That lil' ho, she tryna fuck somethin' right now
I'm-, I'm tryna fuck somethin' right now
That lil' ho, she tryna fuck somethin' right now
Shawty wanna fuck? Whoa
I'ma let her hop on somethin'
Shawty wanna fuck? Whoa
I'ma let her hop on somethin'
Shawty wanna fuck? Whoa
I'ma let her hop on somethin'
Shawty wanna fuck? Whoa
I'ma let her hop on somethin'
Ooh, ooh, right, uh, now (hol' up)
Shawty wanna fuck on me, I told her, ""Let's go, uh, now"" (hol' up)
She asked me to nut on her face, she tryna show me, uh, ah
Miami, Bal Harbour, before I tote, uh, ah
I'm on the G6 brackin' shit with my pole, ha
All-black Brabus truck, lookin' like my soldier with that, mm
All of my vices team, gotta keep them close, they might jump out, uh
You not gon' stand a chance, we're clearin' that ho before we cool out
I'm tryna fuck somethin' right now
That lil' ho, she tryna fuck somethin' right now
I'm-, I'm tryna fuck somethin' right now
That lil' ho, she tryna fuck somethin' right now
Baby, don't keep me up, yeah, keep me up
Don't wanna beat me up, yeah, beat me up
Baby, don't keep me up, yeah, keep me up
Don't wanna beat me up, yeah, beat me up
We comin' down swervin', mmm
This the real, not a version
Even Jesus ain't marry a virgin
No weapon formed against us will win
We comin' down swervin'
This the real, not a version
I don't care who you fucked, you a virgin to me
You a perve and to me, baby perfect to me
Hold my coat, hold my drink
On my own, come with me
Shawty wanna fuck on somethin'
Fuck on me, suck on me publicly (yeah)
La Flame, baby, you on fire (La Flame)
La Flame, baby, you on fire
La Flame, baby, you on fire (La Flame)
La Flame, baby, you on fire
Yeah, she feelin' herself (ooh-ooh), yeah, she feelin' on me (yeah)
Only sign I can give you is that one plus two is three (oh)
Blocked her number and that shit started with three-somethin'
Meetin' at the threesome, we 'bout to have a mean one
I'm tryna fuck somethin' right now (whoo!)
Brown skin, but you know I had her creamin'
Janet Jackson by the way I had her screamin'
She hit the group chat, say, ""That nigga had me fiendin'""
I'm tryna fuck somethin' right now
That lil' ho, she tryna fuck somethin' right now
I'm-, I'm tryna fuck somethin' right now
That lil' ho, she tryna fuck somethin' right now
Shawty wanna fuck? Whoa
I'ma let her hop on somethin'
Shawty wanna fuck? Whoa
I'ma let her hop on somethin'
Shawty wanna fuck? Whoa
I'ma let her hop on somethin'
Shawty wanna fuck? Whoa
I'ma let her hop on somethin'
Beat me up (ooh)",https://open.spotify.com/track/0cbVD7WpHVdHUKwoolzhCZ
BOMB,VULTURES 2,https://open.spotify.com/album/5RV2TNyjylqWJNxQyHBTeJ,2024,2:31,"13,463,706","Bomb, bomb, bomb, bomb
Bomb, bomb, bomb, bomb
Bomb, bomb, bomb, bomb
Bomb, bomb, bomb, bomb
Bomb, bomb, bomb
Bomb, bomb, bomb, bomb
Bomb, bomb, bomb
Bomb, bomb, bomb, bomb
Put some hot sauce on my Doritos, baby
Put some hot sauce on my Cheetos, baby
Why my feet smell like Fritos, baby?
Do you want some tacos, baby?
I'm not superman, I cannot save you
Crossed my dad, I just took his ankles
My grandma fat, she ain't got no ankles
They say I'm goin' up like a bomb
I'm 'bout to blow up just like a bomb
Bomb, bomb, bomb, bomb
Bomb, bomb, bomb, bomb
Bomb, bomb, bomb, bomb
Bomb, bomb, bomb
Bomb, bomb, bomb, bomb
Bomb, bomb, bomb
Bomb, bomb, bomb, bomb
Bomb, bomb, bomb
And you know me, I'm the bomb, bomb, bomb, bomb
I'm the I'm the I'm the I'm the bomb
And you know me, I'm the bomb, bomb, bomb, bomb
I'm the I'm the I'm the I'm the bomb
おはようございます, こんにちは
おはようございます, こんにちは
私の名前はノースちゃん
私の名前はノースちゃん
♪
(It's Chicago)
It's Chicago, you know I'm the one
I like to have fun
I like to go to the beach
I like the sun
You know it's Chi
I only wave when I'm telling them bye, by-by-by-by-bye
Bye, bye, bye, I said
Bye, bye, bye, bye
Goodbye
Chi-Chi, what are you about?
Because Chi-Chi out
Chi-Chi out
Chi-Chi out
I like to have fun all day, day, d-d-day-day-day
There's only one thing to do, it is pray
Pra-pra-pray",https://open.spotify.com/track/2kgxyflhiicDbF8SDrBxqy
New Slaves,Yeezus,https://open.spotify.com/album/7D2NdGvBHIavgLhmcwhluK,2013,4:16,"166,169,725",No Lyrics,https://open.spotify.com/track/4cAgkb0ifwn0FSHGXnr4F6
Gotta Have It,Watch The Throne (Deluxe),https://open.spotify.com/album/2if1gb3t6IkhiKzrtS9Glc,2011,2:20,"269,209,731","Turn my headphones up
Louder
Uh-huh, uh-huh (bring it up, bring it up)
What you need? What-, what you need?
(I got) what you need? What-, what you need?
(Bring it up) what you need? What-, what you need? (Uh)
(I got) what you need-
Hello, hello, hello, hello, white America
Assassinate my character (tryna hurt me name, huh?)
Money matrimony, yeah
They tryna break the marriage up (bring it up)
Who gon' act phony or who gon' try to embarrass ya?
I'ma need a day off, I think I'll call Ferris up
Bueller had a Muller, but I switched it for a Mille
'Cause I'm richer, and prior to this shit, was movin' free base (huh?)
Had a conference with the DJs (Yeah?), Puerto Rico, three days
Poli with the PDs, now they got our shit on replay (uh)
Sorry I'm in pajamas, but I just got off the PJ
And last party we had, they shut down Prive
Ain't that where the Heat play? (Yup)
Niggas hate ballers these days (Yup)
Ain't that like LeBron James?
Ain't that just like D-Wade? Wait
What you need? What-, what you need?
(I got) what you need? What-, what you need?
(Bring it up) what you need? What-, what you need?
(I got) what you need-, bring it up, bring it up
What's up, what's up, what's up, what's up
What's up, motherfucker? Where my money at? (What you need?)
You gon' make me come down to your house
Where your mommy at? (What you need?)
Mummy wrap the kids, have 'em cryin' for they mommy back
Tell me that your daddy is, tell him I just want my racks
Racks on racks on racks (racks)
Maybachs on 'Bachs on 'Bachs on 'Bachs on 'Bachs
(Who in that?) Oh shit, it's just Blacks on Blacks on Blacks (uh)
Hundred stack (how you get it?) Nigga, layin' raps on tracks
I wish I could give you this feeling, I'm planking on a million
I'm riding through your hood, you can bank I ain't got no ceiling
Made a left on Nostrand Ave (right), we in Bed-Stuy
Made a right on 79th, I'm coming down South Shore Drive
(I remain Chi-Town) Brooklyn 'til I die
Take 'em on home (take 'em on home)
(I got) what you need? What-, what you need?
(Take 'em on home) what you need? What-, what you need?
(I got) what you need? What-, what you need?
Take 'em on home (take 'em on home)
Tryna hurt my name, huh?",https://open.spotify.com/track/36mTP2gYrZ13YzytQ5p0QW
LOUIE BAGS,DONDA 2,https://open.spotify.com/album/1ZkGNUz1un0b3Z7EsJl3ci,2025,5:05,"2,083,305","We did it
We did it, Joe
I stopped buying Louis bags after Virgil passed
I stopped buying Louis bags after Virgil passed
I stopped buying Louis bags after Virgil passed
I stopped buying Louis bags after Virgil passed
I'm in the Louis store with a Gucci mask
I'm in the Louis store with a Gucci mask
I'm in the Louis store with a Gucci mask
I stopped buying Louis bags after Virgil passed
If we ain't doin' business, it won't be no business
If we ain't doin' business, it won't be no business
If we ain't doin' business, it won't be no business
If we ain't doin' business, it won't be no business
Ain't no limit with this paper, mm
Master P, I'll have you sayin', ""Mm""
Keep it unless Virgil made it, mm
Just thinkin' 'bout it make me hate it, mm
I'm not gonna lie, I couldn't move
Couldn't even if I wanted to
Imagine if the same thing haunted you
I lost my twin and my mother too
What you look like in that nasty Louis bag?
Virgil ain't even make that color, fool
What you look like in that nasty Louis bag?
We stopped buying Louis bags after Virgil passed
I stopped buying Louis bags after Virgil passed
I stopped buying Louis bags after Virgil passed
I stopped buying Louis bags after Virgil passed
I stopped buying Louis bags after Virgil passed
I stopped buying Louis bags after Virgil passed
I stopped buying Louis bags after Virgil passed
What you look like in that nasty Louis bag?
We stopped buying Louis bags after Virgil passed
I stopped buying Louis bags after Virgil passed
I stopped buying Louis bags after Virgil passed
What you look like in that nasty Louis bag?
We stopped buying Louis bags after Virgil passed
We did it
We did it, Joe
I'm my lil' cousin's favorite cousin
I gave 'em all my number and my phone ain't stopped buzzin'
They listen to my songs and say their parents hate the cussin'
They asked if I was nervous on TV or if I wasn't
They asked me if it's true that I don't go to church
""My daddy said you don't"", well, then I guess you know
I been thinkin' about goin', though, I might let you know
One day, I'll bring you to my concert if they let you go
Pumpin' gas alone at Texaco, hopin' I don't get approached
Don't know if it's clear until I check the coast
All these rappers dyin', I don't wan' be one that's next to go
Paranoia tickin' in my head just like a metronome
I can't walk around like Jack that wore the spectacles
I shook the hands, took the pictures, made myself accessible
Threw the parties, showed love, kept it all respectable
Tried to give you something you ain't had before, but
It's all over, they got the drop on my life, it's all over
All this pressure on me, they'd wish I'd fall over
Too bad I'm a winner like fall over
I dropped, uh, heat in February, cocky tweets in February
All-Star weekend with the court-side seats in February
I'm the champ', you come second like the E in February
All that humble sh- was fake, now, can we keep it legendary, please
I stopped buying Louis bags after Virgil passed
I stopped buying Louis bags after Virgil passed
It's funny how they ain't believe the hymn
Actin' like they never needed Him
Squares in your circle, out of shape, they need a gym
They pollutin' the airwaves, I'm not tryin' to breathe it in
I need fresh air
I'm in Cuba, ain't no press here, yeah
And she won't have to second-guess here
If I'm here, you gon' always be the second best here
And she gon' fit me like fresh Airs, yeah
Why you worried 'bout the next pair?
She gon' use the Nair, what hair?
Niggas fresh as him, what? Where?
If it's up, then it's stuck there
If it's up, then it's stuck there
How I'ma get this money plus care?
How I'ma get this money plus care?
I can't do them two things at once
I just dropped two singles once
I was just too single once
And I hit two singles once, yeah
On my mic, two sing at once, yeah
Coffee cup, two cream at once
Got a new bitch on the balcony
I only had two single months
I stopped buying Louis bags after Virgil passed
I stopped buying Louis bags after Virgil passed
I stopped buying Louis bags after Virgil passed
I stopped buying Louis bags after Virgil passed
I'm in the Louis store with a Gucci mask
I'm in the Louis store with a Gucci mask
I'm in the Louis store with a Gucci mask
I stopped buying Louis bags after Virgil passed
If we ain't doin' business, it won't be no business
If we ain't doin' business, it won't be no business
If we ain't doin' business, it won't be no business
If we ain't doin' business, it won't be no business",https://open.spotify.com/track/5bu1Sbx3E2nNHzQUYXeAAj
Otis,Watch The Throne,https://open.spotify.com/album/0OcMap99vLEeGkBCfCwRwS,2011,2:58,"306,347,842","It makes it easier, easier to bear
You won't regret it, no, no
Some girls they don't forget it
Love is their only happiness, yeah
Squee-, squee-, squee- (sounds so soulful, don't you agree?)
Squeeze her, don't tease her (ow!) Never leave her
Uh, I invented swag
Poppin' bottles, puttin' supermodels in the cab
Proof
I guess I got my swagger back, truth
New watch alert, Hublot's
Or the big-face Rollie, I got two of those
Arm out the window, through the city I maneuver slow
Cock back, snap back, see my cut through the holes, Hov
Damn, Yeezy and Hov, where the hell you been?
Niggas talkin' real reckless, stuntmen
I adopted these niggas, Phillip Drummond 'em
Now I'm 'bout to make 'em tuck they whole summer in
They say I'm crazy, well, I'm 'bout to go dumb again
They ain't see me 'cause I pulled up in my other Benz
Last week I was in my other, other Benz
Throw your diamonds up 'cause we in this bitch another 'gain (yea)
Photoshoot fresh, lookin' like wealth
I'm 'bout to call the paparazzi on myself
Uh, live from the Mercer
Run up on Yeezy the wrong way, I might murk ya
Flee in the G450, I might surface
Political refugee, asylum can be purchased
Uh, everything's for sale, I got five passports
I'm never goin' to jail
I made Jesus walk, so I'm never goin' to hell
Couture-level flow, it's never goin' on sale
Luxury rap, the Hermès of verses
Sophisticated ignorance, write my curses in cursive
I get it custom, you a customer
You ain't 'customed to goin' through customs
You ain't been nowhere, hah?
And all the ladies in the house, got 'em showin' off
I'm done, I'll hit you up maña-, nah
Welcome to Havana
Smokin' cubanos with Castro in cabanas
Viva México, Cubano
Dominicano, all the plugs that I know
Drivin' Benzes, wit' no benefits
Not bad, huh? For some immigrants
Build your fences, we diggin' tunnels
Can't you see? We gettin' money up under you
Can't you see the private jets flyin' over you?
Maybach bumper sticker read, ""What would Hova do?""
Jay is chillin'(uh), 'Ye is chillin' (uh)
What more can I say? We killin' 'em
Hold up, before we end this campaign
As you can see, we done bodied the damn lames
Lord, please let them accept the things they can't change
And pray that all of their pain be champagne
(Woah, ha-ah) squeeze her, don't tease her, never leave her (scream it)
(Woah, ha-ah) squeeze her, don't tease her, never leave her (give it)
(Woah, ha-ah) squeeze her, don't tease her, never leave her (scream it)",https://open.spotify.com/track/14I61w6cyYUHiV2n28IYdP
Blood On The Leaves,Yeezus,https://open.spotify.com/album/7D2NdGvBHIavgLhmcwhluK,2013,5:59,"218,120,704",No Lyrics,https://open.spotify.com/track/42GcjriRK6srwHkfbkBqVl
