SongName,AlbumName,AlbumLink,Year,Runtime,PlayCount,Lyrics,SongLink
Tenerife Sea,x (10th Anniversary Edition),https://open.spotify.com/album/1upLfaShcnjVjey0FdY7aO,2024,4:01,"663,841,877","You look so wonderful in your dress
I love your hair like that
The way it falls on the side of your neck
Down your shoulders and back
We are surrounded by all of these lies
And people that talk too much
You got the kind of look in your eyes
As if no one knows anything but us
Should this be the last thing I see
I want you to know it's enough for me
'Cause all that you are is all that I'll ever need
I'm so in love, so in love
So in love, so in love
You look so beautiful in this light
Your silhouette over me
The way it brings out the blue in your eyes
Is the Tenerife sea
And all of the voices surrounding us here
They just fade out when you take a breath
Just say the word and I will disappear
Into the wilderness
Should this be the last thing I see
I want you to know it's enough for me
'Cause all that you are is all that I'll ever need
I'm so in love, so in love
So in love, so in love
Lumiere, darling
Lumiere over me
♪
Lumiere, darling
Lumiere over me
♪
Lumiere, darling
Lumiere over me
Should this be the last thing I see
I want you to know it's enough for me
'Cause all that you are is all that I'll ever need
So in love, so in love
So in love, love, love, love
So in love
You look so wonderful in your dress
I love your hair like that
And in the moment, I knew you, Beth",https://open.spotify.com/track/3fRYOJ8rrFUpwOnstP5MyZ
Take It Back,x (10th Anniversary Edition),https://open.spotify.com/album/1upLfaShcnjVjey0FdY7aO,2024,3:28,"120,200,593","I'm not a rapper, I'm a singer with a flow
I've got a habit for spitting quicker lyrics you know
You'll find me ripping the written out of the pages they sit in
I never want to get bitten 'cause plagiarism is hidden
Watch how I sit on the rhythm, prisoner with a vision
Signed to a label but didn't listen to any criticism
Thought you knew, but you didn't, so perk your ears up and listen
Studio is a system, and you could say that I'm driven
And now it's onto the next saga, we drink the best lager
I'll never try to win you over like your stepfather
I do my own thing now and get respect after
And I'm avoiding the 'cain like it was Get Carter
For four years, I never had a place to stay
But it's safe to say that it kept me grounded like a paper weight
At 16 years old, yeah, I moved out of my home
I was Macy Gray, I tried to say goodbye and I choked
And went from sleeping at a subway station
To sleeping with a movie star and adding to the population
Not my imagination, I don't wanna relax
Would it hurt your reputation if I put it on wax?
I take it back now
Mmm, come on and take it back, love
Come on and take it back for us
Don't you fade into the back, love
No
I take it back with the rhythm and blues
With my rap pack, I'll be singing the news
Tryna act like Jack Black when I bring it to school
I make a beat with my feet by just hitting the loop
Bringing the lyrics to prove that I can fit in these shoes
I give you the truth through the vocal booth
And stars burst out on the scene like an Opal Fruit
They try to take aim like Beckham when he goes to shoot
But then again, that's what they're supposed to do
And I'm supposed to be calm, I tattooed the lyrics onto my arm
Whispering, ""Everything that happens is from now on""
I'll be ready to start again by the end of the song
And still they're claiming that I handle it wrong
But then I've never had an enemy except the NME
But I'll be selling twice as many copies as their magazines'll ever be
With only spectacles ahead of me
And festival fees are healthier than a Dalmatian on pedigree
Singing for the masses, rubber dinghy rapids
I keep this rapping a habit and keep on fashioning magic
I'm battling for respect and I don't know if I have it
This song's from the heart, cover the planet
I'll take it back now
Mmm, come on and take it back, love
Come on and take it back for us
Don't you fade into the back, love
No
And take it back now
Now, I don't ever wanna be perfect
'Cause I'm a singer that you never wanna see shirtless
And I accept the fact that someone's got to win worst-dressed
Taken my first steps into the scene giving me focus
Putting on a brave face like Timothy Dalton
Considering a name change, thinking it was hopeless
Rhyming over recordings, avoiding tradition
'Cause every day some lyrics and a melody can be written
Now, absence can make your heart ache
But drinking Absinthe can change your mind state
Vividly, need to let my liver be
And I'll say it again, living life on the edge with a close handful of friends
Is good advice from the man that took his life on the road with me
And I hope to see him blowing up globally
'Cause that how it's supposed to be
I'm screaming out vocally
It might seem totally impossible achieving life's dreams
But, but I just write schemes
I'm never having a stylist giving me tight jeans
Madison Square Garden is where I might be, but more likely
You'll find me in the back room of a dive bar with my mates
Having a pint with McDaid, discussing records we made
And every single second knowing that we'll never betray
The way we were raised, remembering our background, sat down
That's how we plan it out, it's time to take it back now
Mmm, come on and take it back, love
Come on and take it back for us
Don't you fade into the back, love
No
Mmm, come on and take it back, love
Come on and take it back for us
Don't you fade into the back, love
No",https://open.spotify.com/track/1klkYEghsyMBLhIyOtCQOL
Photograph,x (10th Anniversary Edition),https://open.spotify.com/album/1upLfaShcnjVjey0FdY7aO,2024,4:18,"3,185,258,509","Loving can hurt
Loving can hurt sometimes
But it's the only thing
That I know
♪
And when it gets hard
You know it can get hard sometimes
It is the only thing that makes us feel alive
♪
We keep this love in a photograph
We make these memories for ourselves
Where our eyes are never closing
Hearts are never broken
And time's forever frozen still
So you can keep me
Inside the pocket of your ripped jeans
Holdin' me closer 'til our eyes meet
You won't ever be alone
Wait for me to come home
Loving can heal
Loving can mend your soul
And is the only thing
That I know, know
I swear it will get easier
Remember that with every piece of ya, mmm
And it's the only thing we take with us when we die, mmm
♪
We keep this love in a photograph
We make these memories for ourselves
Where our eyes are never closing
Hearts were never broken
And time's forever frozen still
So you can keep me
Inside the pocket of your ripped jeans
Holdin' me closer 'til our eyes meet
You won't ever be alone
And if you hurt me
Well, that's okay, baby, only words bleed
Inside these pages you just hold me
And I won't ever let you go
Wait for me to come home
Wait for me to come home
Wait for me to come home
Wait for me to come home
Oh, you can fit me
Inside the necklace you got when you were 16
Next to your heartbeat where I should be
Keep it deep within your soul
And if you hurt me
Well, that's okay, baby, only words bleed
Inside these pages you just hold me
And I won't ever let you go
When I'm away
I will remember how you kissed me
Under the lamppost back on 6th street
Hearing you whisper through the phone
Wait for me to come home",https://open.spotify.com/track/1uswaYRxN8f1Qp6hQRF7yL
That’s On Me,Autumn Variations (Fan Living Room Sessions),https://open.spotify.com/album/5bLE2kmkZWlzAYeb6To6LA,2023,3:47,"9,380,155","Is this just getting older?
I can't get away from this rain
I'm starting to think that it's me, and
I wanna just create things
But the longer it takes, I feel drained
Can't remember a day I've been sober
Not in a place to take blame
Any more weight, I might break
Tell me, do you feel the same?
Guess we all go the same way
I'm in a bit of a mess here
Count to ten and hope to disappear
I never did my homework
Could I have been more than this?
Finding a way to exist
Within a world with no risk
Forcing a shoe that won't fit
I spend most the day stoned and
Making excuses for it
Saying it helped to write this
But, on the real, I'm tight-lipped
Shooting a shot that I'll miss
And it's so far from near
Why the hell am I still here?
This is not the end of our lives
This is just a bump in the ride
And I know that it will be alright
And if it's not, then we're fucked, aren't we?
I can't help myself but cry
Every time that I realise
Maybe I'll never find my smile
But who's to blame? Well, that's on me
Well, that's on me
Well, that's on me
Now that the weather is colder
Nothing is masking this pain
The summer was here, but won't stay, and
We are inside, like, all day
Regretting the things that we say
And it takes a toll, yeah
The conversation won't end
Being a rock for your friends
Cracks in the surface don't mend
We only break, we don't bend
And you'd think it was so clear
But I can't see nothing but the fear
I'm feeling so bloated
Thinking a salad won't do
Might as well open up two
Locking myself in my room
Hoping that this all ends soon
And no one will notice
What I will put myself through
'Cause they will hate themselves too
Isn't it mad what we do?
Pretending to win, but just lose
And it's so far from near
Why the hell am I still here?
This is not the end of our lives
This is just a bump in the ride
And I know that it will be alright
If it's not, then we're fucked, aren't we?
I can't help myself but cry
Every time that I realise
Maybe I'll never find my smile
But who's to blame? Well, that's on me
Well, that's on me
Well, that's on me
Too many things on my mind
To process moments of life
That some days I lose my drive
And some can't control the fire
I'm aware that things take time
But I'm not a patient guy
Maybe if I wait, I'll find
Resemblance of peace of mind
But this is just getting older
Running away from our past
Knowing the calm, it won't last
Being a mouse in this grass
Feeling the snakes behind us, and
I'm searching for closure
But nothing is healing these scars
When I open up, they just laugh
Saying if they had just half
Then nothing would ever be dark
Is it ""new me, new year""
Or just the same old blue sphere?
This is not the end of our lives
This is just a bump in the ride
And I know that it will be alright
If it's not, then we're fucked, aren't we?
I can't help myself but cry
Every time that I realise
Maybe I'll never find my smile
But who's to blame? Well, that's on me
Well, that's on me
Well, that's on me
Well, that's on me",https://open.spotify.com/track/4W8EmeDnNxqRXEeVSpHDn7
Peru,= (Tour Edition),https://open.spotify.com/album/2CIOGAByaHyjQ1EO55JSzC,2022,3:07,"389,898,238","Peru, para
Peru, para
Peru, para (aaahh)
Peru, para
Peru, para
Peru, para (sheesh)
Omoge, no be so
Girl, you wan capture my soul
Omoge, no be so
Make me wan wombolombo
Peru, para
Peru peru, para
I'm loo'
Even Peru don dey para
Tonight in Jozi, I'm in Jozi
Mo n k'orin fun won, won jo si
I'm not playin' with you, I'm not jokin'
My third album is loadin'
Mi o kin fa'gbo but I'm on molly
I'm on duty, but I'm on low-key
They wan do me, they wan do mi
They wan do me gan, they wan do mi
Won ni won wa mi, won ni won wa mi
I'm in San Francisco jamming
Won ni won wa mi, won ni won wa mi
I just flew in from Miami
Peru, para
Peru Peru, para
I'm loo-
Even Peru don dey para
Pour out the bottle, I wanna level up
When I'm with you, I never get еnough
Slow whine, I'm not in a rush
I can hear music when you'rе here
Tonight we rolling, party 'til closing
Since I put the ring on her finger, it's still frozen
Love in slow motion
I wanna feel you over me, yeah
Somethin' magic in your eyes, yeah
Girl, I love the way you ride it
And it happens every time you arrive, that's right
Girl, I want you in my life, yeah
If there's a heaven, then it's right here
I will never leave your side, stay tonight
When you wan' see me, when you wan' see me?
I'm in West London this evening
Givin' me the feelings, no I'm not leavin'
Until I fly LA next weekend
Peru, nah, girl, I'd rather go find somewhere quiet
You'll glow, and I'll get lost here in your eyes
Omoge, no be so
Girl, you just capture my soul
Omoge, no be so
Make me wanna just take you home
Peru, para
Peru Peru, para
I'm loo'
Even Peru don dey para
Peru, para
Peru Peru, para
I'm loo'
Even Peru don dey para
Peru, para
Peru Peru, para
I'm loo'
Even Peru don dey para",https://open.spotify.com/track/1PvSHEmS4wNXTft6I0ugOZ
Shivers,=,https://open.spotify.com/album/32iAEBstCjauDhyKpGjTuq,2021,3:27,"1,949,017,582","I took an arrow to the heart
I never kissed a mouth that taste like yours
Strawberries and something more
Ooh, yeah, I want it all
Lipstick on my guitar (ooh)
Fill up the engine, we can drive real far
Go dancing underneath the stars
Ooh, yeah, I want it all
Hmm, you got me feeling like
I wanna be that guy
I wanna kiss your eyes
I wanna drink that smile
I wanna feel like I'm -
Like my soul's on fire
I wanna stay up all day and all night
Yeah, you got me singing like
Ooh, I love it when you do it like that
And when you're close up, give me the shivers
Oh, baby, you wanna dance 'til the sunlight cracks
And when they say the party's over, then we bring it right back
And we'll say
Ooh, I love it when you do it like that
And when you're close up, give me the shivers
Oh, baby, you wanna dance 'til the sunlight cracks?
And when they say the party's over, then we bring it right back
Into the car
On the back seat in the moonlit dark
Wrap me up between your legs and arms
Ooh, I can't get enough
You know you could tear me apart (ooh)
Put me back together, and take my heart
I never thought that I could love this hard
Ooh, I can't get enough
Hmm, you got me feeling like
I wanna be that guy
I wanna kiss your eyes
I wanna drink that smile
I wanna feel like I'm -
Like my soul's on fire
I wanna stay up all day and all night
Yeah, you got me singing like
Ooh, I love it when you do it like that
And when you're close up, give me the shivers
Oh, baby, you wanna dance 'til the sunlight cracks?
And when they say the party's over, then we'll bring it right back
And we'll say
Ooh, I love it when you do it like that
And when you're close up, give me the shivers
Oh, baby, you wanna dance 'til the sunlight cracks
And when they say the party's over, then we'll bring it right back
Baby, you burn so hot, you make me shiver
With the fire you got, this thing we started
I don't want it to stop, you know you make me shiver, ah, ah-ah
Baby, you burn so hot, you make me shiver
With the fire you got, this thing we started
I don't want it to stop, you know you make me shiver
Yeah, you got me singing like
Ooh, I love it when you do it like that
And when you're close up, give me the shivers
Oh, baby, you wanna dance 'til the sunlight cracks
And when they say the party's over, then we'll bring it right back
And we'll say
Ooh, I love it when you do it like that
And when you're close up, give me the shivers
Oh, baby, you wanna dance 'til sunlight cracks
And when they say the party's over, then we'll bring it right back
Hey",https://open.spotify.com/track/50nfwKoDiSYg8zOCREWAm5
England - Live from Maynard’s Living Room,Autumn Variations (Fan Living Room Sessions),https://open.spotify.com/album/5bLE2kmkZWlzAYeb6To6LA,2023,3:21,"1,191,235","It is opening day, and a brand-new start
The stones have been cleared around the fishermen's hut
And the air bites, then leaves, almost invisible cuts on the skin
A lighthouse retired, but a new one was hired
About 20 foots taller, painted in black and white
20 million steps with a computer inside instead of him
Only one road sign tellin' cars to slow down
And a long drop in the ocean
Beware of the riptide, broken glass and train lines
It's a new day, and this is England
Next to the pub with the flag that's workin' flexible hours
There's a mismatch of carriages soil in a boat for some flowers
Fairy lights on a building that's supplyin' us power from the sea
Electricity lines flow like veins to the town
In-between, there is nothin' but grass and pebbles on the ground
Do not enter the wild here if you want to be found for the free
View the flame of sunrise, cut in half by the sky
And the empty of the desert
Team of birds that swerve by, and then land on the wire
It's a new day, and this is England
When it's time to escape from the heavy of this
There is nothin' like washin' away
I find this country of mine gets a bad reputation
Of bein' cold and gray
From the Coast of the South to the East followed 'round
I find serenity I've never felt
There's a peace and a quiet in this island of ours
Can't be mirrored by anywhere else
Homes protruding from stones with their wood-coloured black
Scattered cars in a line, steam risin' out the shaft
One door at the front, and then just glass out the back for the view
And the blue is so bright, you'll need shades for your eyes
And a cable to pull over
Take a walk and feel like everything will be fine
It's a new day, and this is England",https://open.spotify.com/track/26vVj2jF7opp0pTFTSNtZS
I Will Remember You,= (Tour Edition),https://open.spotify.com/album/2CIOGAByaHyjQ1EO55JSzC,2022,3:34,"7,806,986","I will remember you in the way you'd want me to
But it's hard to come to terms right now
♪
Sunset looked today as if it knew you'd gone away
Now it's night, I hear the rain crash down
Oh, I'd cry, but this is more than just my pain
Oh, I should be a shoulder, not a burden
And it's time for me to call your son again
And say
She was the starlight in darkness
She was the first bloom in spring
An angel with a smile like electric light
All the time hid her wings
She was the birdsong in morning
But now everything here has changed
All the world's less beautiful
Since you've been away
I will remember you with white wine by the barbecue
On New York, at the birthday do, downtown
All that comes to mind when I think about that time
Is a memory of laughin' out loud
Oh, I wish that I could take the pain away
And just talk to him in person
But it's time for me to call your son again
And say
She was the starlight in darkness
She was the first bloom in spring
An angel with a smile like electric light
All the time hid her wings
She was the birdsong in morning
But now everything here has changed
All the world's less beautiful
Since you've been away
This doesn't make sense
I wish I could change it, but I can't do anything
♪
My heart is racing
And my soul is aching, lover
♪
Well, she was the starlight in darkness
She was the first bloom in spring
An angel with a smile like electric light
All the time hid her wings
She was the birdsong in morning
But now everything here has changed
All the world's less beautiful
Since you've been away
The world's less beautiful
Since you've been away",https://open.spotify.com/track/4yVsZALRYQ2cBJCViCTTp0
2step (feat. Lil Baby),= (Tour Edition),https://open.spotify.com/album/2CIOGAByaHyjQ1EO55JSzC,2022,2:43,"192,259,445","I had a bad week
Spent the evening pretending it wasn't that deep
You could see in my eyes that it was taking over
I guess I was just blind and caught up in the moment
You know you take all of my stress right down
Help me get it off my chest and out
Into the ether with the rest of this mess that just keeps us depressed
We forget that we're here right now
'Cause we're livin' life at a different pace, stuck in a constant race
Keep the pressure on, you're bound to break, something's got to change
We should just be cancelling all our plans and not give a damn
If we're missin' out on what the people think is right
Seein' through a picture behind the screen and forget to be
Lose the conversation for the message that you'll never read
I think maybe you and me
Oh, we should head out to the place where the music plays
And then
We'll go all night
Two-steppin' with the woman I love
All my troubles turn to nothin' when I'm in your eyes, electrified
We'll keep turnin' up and go all night
Oh, we had dips and falls in our time
But we know what it feels to be low, then up, alone, then loved
And all we need is us to go all
Night, night
Two-steppin' with the woman I love
Night, yeah
All we need is us
Baby
Sun comin' up when we walk out, we lost the track of time
Everything that I been dealin' with ain't even crossed my mind
I don't see nobody in here but us, for real, for you I'm blind
We go anywhere, it don't take much for us to catch a vibe
Come here, I need to tell you something let me whisper in your ear
Do whatever to get you there, I'll put you on a Lear, yeah
Private island for a month straight, they'll think you disappeared
Lamb truck'll look good on you, I'm coppin' you that Urus
I think I'm 'bout ready to make love in this club
Only thing I need is my drink and my drugs
I done got on ten and forgot where I was
Some part I don't like, but this part I love
Only me and my guys
I been havin' me a good time, you can see it all in my eyes
Two-steppin' with shawty, got her rockin' side to side
You should let me know when you ready to ride 'cause
We'll go all night
Two-steppin' with the woman I love (I love)
All my troubles turn to nothin' when I'm in your eyes, electrified
We'll keep turnin' up and go all night
Oh, we had dips and falls in our time
But we know what it feels to be low, then up, alone, then loved
And all we need is us to go all (night)
Night, night
Two-steppin' with the woman I love
Night, yeah
All we need is us to go all night
Night, night
Two-steppin' with the woman I love
Night, yeah
All we need is us to go all night",https://open.spotify.com/track/3vRMNhtsTzM25UbTeuKGrx
Sandman,=,https://open.spotify.com/album/32iAEBstCjauDhyKpGjTuq,2021,4:19,"46,150,671","You were loved before you had arrived
And every day that love just multiplies
Daddy made your bed and your lullaby
And momma made the mobile in the sky
And loving you is easy, but life will not always be
Fall into the world of your song
Whatever you feel can never be wrong
Come along for the ride
And in a shake of the lamb's tail, we'll go
Be still now and close your eyes
And dream
Hanging out with the sandman
You look so sweet, my child
Hanging out with the sandman
And though there's rain outside, you'll be warm and dry
The thunder and the lightning won't hurt you now
So go to sleep, my love
Hanging out with the sandman
♪
Chocolate-covered roof and candy cars
Rainbow sugar river we can sail upon
Marshmallow books and strawberries
Snowmen made of ice cream
Over the flower fields, we'll fly
We'll count the fish in the sky
Honeybees and birds sing your song
Whatever you feel can never be wrong
Come along for the ride
And in a shake of the lamb's tail, we'll go
Be still now and close your eyes
And dream
Hanging out with the sandman
You look so sweet, my child
Hanging out with the sandman
And though there's rain outside, you'll be warm and dry
The thunder and the lightning won't hurt you now
So go to sleep, my love
Hanging out with the sandman
♪
Come along for the ride
And in a shake of the lamb's tail, we'll go
Be still now, and close your eyes
And dream
Hanging out with the sandman
You look so sweet, my child
Hanging out with the sandman
And though there's rain outside, you'll be warm and dry
The thunder and the lightning won't hurt you now
So go to sleep, my love
Hanging out with the sandman
Hanging out with the sandman
Hanging out with the sandman
Hanging out with the sandman",https://open.spotify.com/track/2Ldb2ytuC9AxhpAkVEJBI6
New York,x (10th Anniversary Edition),https://open.spotify.com/album/1upLfaShcnjVjey0FdY7aO,2024,3:55,"34,982,680","Five drinks in on Friday night
We only came to dry your eyes
And get you out of your room
Now this bar has closed its doors
I found my hand is holding yours
Do you wanna go home so soon?
Or maybe we should take a ride through the night
And sing along to every song that's on the radio
In the back of a taxi cab in Brooklyn
Oh no, no, the sun could rise
Burning all the street lamps out at 3 a.m.
So DJ, play it again
Until the night turns into morning, you'll be in my arms
We'll just keep driving along the boulevard
And if I kissed you, darling, please don't be alarmed
It's just the start of everything
If you want a new love in New York
♪
Yesterday, you gave me a call
Stressing out about it all
You said the world is moving too fast
And you don't know where to begin
'Cause you've spent a lifetime fitting in
Only to end up on the other side by yourself
And every day you're screaming out
To all the people that you used to know
From a window that looks upon Manhattan's skyline
It's just the way that life goes
And you hear it in every song you know
So DJ, play it again
Until the night turns into morning, you'll be in my arms
We'll just keep driving along the boulevard
And if I kissed you, darling, please don't be alarmed
It's just the start of everything
If you want new life in New York
And every song that plays
Is just like the day you had
And it's okay to cry
But I'm saying maybe that's a waste of water
You know I'm here for you
In the back of the taxi cab tonight in New York
It's just reached the morning, and you're still in my arms
And we've stopped driving down the boulevard
And I just kissed you, darling, I hope you weren't alarmed
It's just the start if everything that you want
A new love in New York",https://open.spotify.com/track/6oIAnrP9p0skYanutdJyHl
