SongName,AlbumName,AlbumLink,Year,PlayCount,Lyrics,SongLink,Duration
So Far...,The Marshall Mathers LP2 (Expanded Edition),https://open.spotify.com/album/5EUgcfO5OWxnniHR3QYFcK,2023,56856247,"I own a mansion
But live in a house
A king-size bed, but
I sleep on the couch
I'm Mr. Brightside
Glass is half full
But my tank's half empty
Gasket just blew
This always happens
Thirty minutes from home
Gotta lay a log cabin
Only option I have is McDonald's bathroom
In a public stall droppin' a football
So every time someone walks in the john, I get Madden
""Shady, what up?""
What? Come on, man, I'm crappin'
And you're askin' for my goddamn autograph on a napkin?
Oh, that's odd, I just happened to run out of tissue
Yeah, hand me that, on second thought, I'd be glad then
""Thanks, dawg! Name's Todd, a big fan""
I wiped my ass with it, crumbled it up in a wad, threw it back and
Told him, ""Todd, you're the shit""
When's all of this crap end?
Can't pump my gas without causin' an accident
Pump my gas, cut my grass
I can't take out the fuckin' trash without
Someone passin' through my sub, harassin'
I'd count my blessin's, but I suck at math
I'd rather wallow then bask, sufferin' from succotash
But the antacid
Gives my stomach gas
When I mix my corn with my fuckin' mash
Potato, so what, ho, kiss my country bumpkin ass
Missouri southern roots
What the fuck is upper-class?
Call lunch dinner, call dinner supper
Tupperware in a covered plastic wear up the ass
Stuck in the past, iPod, what the fuck is that?
B-Boy to the core, mule, I'm a stubborn ass
Maybe that's why I feel so strange
Got it all, but I still won't change
Maybe that's why I can't leave Detroit
It's the motivation that keeps me going
This is the inspiration I need
I can never turn my back on a city that made me
And (life's been good to me so far)
They call me classless, I heard that
I second and third that
Don't know what the fuck I'd be doin' if it weren't rap
Probably be a giant turd-sack
But I blew, never turned back
Turned forty and still sag
Teenagers act more fuckin' mature, Jack
Fuck you gonna say to me?
I leave on my own terms, asshole, I'm goin' berserk
My nerves are bad, but I love the perks my work has
I get to meet famous people
Look at her, dag
Her nylons are ran, her skirt's snagged
And I heard she drag-races *burp* swag
Tuck in my Hanes shirt tag
You're Danica Patrick
(Yeah?) word, skag
We'd be the perfect match
'Cause you're a vacuum
I'm a dirtbag
My apologies
No disrespect to technology
But what the heck is all of these buttons?
You expect me to sit here and learn that?
Fuck I gotta do to hear this new song from Luda?
Be an expert at computers?
I'd rather be an Encyclopedia Britannica
Hell with PlayStation
I'm still on my first man on some Zelda
Nintendo, bitch!
Run, jump, punch, stab and I melt the
Mozzarella on my spaghetti, put in on bread
Make a sandwich with Welch's and belch
They say this spray butter's bad for my health, but
I think there's more white trash from the trailer
Jed Clampett, Redd Sanford, and welfare
Mentality helps to
Keep me grounded
That's why I never take full advantage of wealth, I
Managed to dwell within these parameters
Still crammin' the shelves full of Hamburger Helper
I can't even help it
This is the hand I was dealt, a
Creature of habit
Feel like I'm trapped in an animal shelter
With all these pet peeves
Goddammit to hell
I can't stand
All these kids
With their camera cellphones
I can't go anywhere
I get so mad I could yell, the
Other day, someone got all elaborate
And stuck a head from a fuckin' dead cat in my mailbox
Went to Burger King
They spit on my onion rings
I think my karma's catchin' up with me
Maybe that's why I feel so strange
Got it all, but I still won't change
Maybe that's why I can't leave Detroit
It's the motivation that keeps me going
This is the inspiration I need
I can never turn my back on a city that made me
And (life's been good to me so far)
Got friends on Facebook
All over the world
Not sure what that means
They tell me it's good
So I'm artist of the decade
I even got a plaque
I'd hang it up, but
The frame is all cracked
I'm tryna be low-key
Hopefully nobody notices me
In produce, hunched over, giant nosebleed, ogre
Style as I mosey over to the frozen aisle
By the frozen yogurt this guy approached me
Embarrassed, I just did Comerica
With Hova, the show's over
I'm hidin' in Kroger buyin' groceries
He just had front row seats
Told me to sign this poster, then insults me
""Wow, up close, didn't know you had crow's feet!""
I'm at a crossroad, lost, still shoppin' at Costco
Sloppy Joe's, bulk waffles
Got caught pickin' my nose, ah!
Look over, see these two hot hoes
Finger's still up in one of my nostrils
Right next to 'em
Stuck at the light
The fuckin' shit's takin' forever to change, It's stuck
These bitches are lovin' it, rubbin' it in, chucklin'
Couldn't do nothin', play it off
""What you bumpin'? Trunk Muzik?""
""Yelawolf's better,"" fuckin' bitch
They want me to flip at the label
But I won't succumb to it
The pressure, they want me to follow up with another one
After Recovery was so highly coveted
But what good is a fuckin' recovery if I fumble it?
'Cause I'ma drop the ball if I don't get a grip
Hoppin' out shrubbery on you sons of bitches
Wrong subdivision to fuck with, bitch
Quit snappin' fuckin' pictures of my kids
I love my city, but you push me to my limit, what a pity
The shit I complain about
It's like there ain't a cloud in the sky, and it's rainin' out
Kool-Aid stain on the couch
I'll never get it out
Bitch, I got an elevator in my house
Ants and a mouse, I'm livin' the dream
Maybe that's why I feel so strange
Got it all, but I still won't change
Maybe that's why I can't leave Detroit
It's the motivation that keeps me going
This is the inspiration I need
I can never turn my back on a city that made me
And (life's been good to me so far)",https://open.spotify.com/track/6npBv8PhiZH8l6g4YPclhh?uid=b3b13bf390995668&uri=spotify:track:65kWtHIqg2IACNR9KP4KOS,317
NO BYSTANDERS,ASTROWORLD,https://open.spotify.com/album/41GuZcammIkupMPKH2OJ6I,2018,449597662,"The party never ends
In a motel, laying with my sins, yeah
I'm tryna get revenge
You'll be all out of love in the end
Spent ten hours on this flight, man
Told the pilot ain't no flight plans
Can't believe whatever I'm saying
And they know whenever I land
Yeah, yeah, yeah, yeah
Fuck the club up, fuck the club up (bitch)
Fuck the club up, fuck the club up (bitch)
Fuck the club up, fuck the club up
Fuck the club up, fuck the club up (yeah)
The party never ends
In a motel, laying with my sins, yeah
I'm tryna get revenge
You'll be all out of love in the end
Bicentennial man
Put the city on the slam
She get trippy off Xans
Lost 21 grams
And she did it on cam
Wasn't no video dance
Make my own rules
I really don't pick, I just choose
I don't set pics, I just shoot
Chopper gettin' screwed
I told her it's BYOB, that mean buy your own boobs
Put it on God
He the one that put me on top
Can't be put in a box, gotta move on the opps
Never got the move on the drop
Niggas tryna move on the Scott and move that deep
Tryna run down, shit's deep
Gotta act a fool with the squad
Next city, no sleep
Back to the 713
Spent ten hours on this flight, man
Told the pilot ain't no flight plans
Can't believe whatever I'm saying
And they know whenever I land
Yeah, yeah, yeah, yeah
Fuck the club up, fuck the club up (bitch)
Fuck the club up, fuck the club up (bitch)
Fuck the club up, fuck the club up
Fuck the club up, fuck the club up (yeah)
Heartbreak hotel
Bet you can't take no L's
Plug like AOL
Who say that I ain't gon' sell?
Hand me the H, it sell
She said, I got a nigga
I said, I ain't gon' tell
Buy by the pound so it ain't no scale
I'm sick of the drank (the drankin')
The flippin' of paint (paint, yeah)
Grippin' the grain (wood grain, yeah)
Whipping the tank (whip tank, yeah)
My niggas gon' flame (bang, yeah)
Bitch, I'm with gang (gang, yeah)
Got your bitch on the plane
Spent ten hours on this flight, man
Told the pilot ain't no flight plans
Can't believe whatever I'm saying
And they know whenever I land
Yeah, yeah, yeah, yeah
Fuck the club up, fuck the club up (bitch)
Fuck the club up, fuck the club up (bitch)
Fuck the club up, fuck the club up
Fuck the club up, fuck the club up (yeah)
The party never ends
Fuck the club up, fuck the club up (bitch)
Fuck the club up, fuck the club up (bitch)
Fuck the club up, fuck the club up
Fuck the club up, fuck the club up (yeah)
The party never ends
Family function, I ain't no friends
Had a line around my ends
Turned 'em into M's
Why you tryna make amends?
What's that smell? It's heaven-scent
Like I drop shit out the wind
Dodgin' hella sins
I can't go back there again
Now the dogs ain't civilized
Take the one, feel vilified
You can't see my suns
Like the light don't hit this eye
In the function and I'm fried
This strive is not a drive
When they open wide
It's a riot, riot
Fuck the club up, fuck the club up (Bitch!) (nah, nigga, nah, nigga, for real)
Fuck the club up, fuck the club up (Bitch!) (we walkin' in this bitch heavy)
Fuck the club up, fuck the club up (they know me when they see me, nigga)
Fuck the club up, fuck the club up (ahh) (yeah)",https://open.spotify.com/track/6OaVWaGfhXn70ZJfdVcabn,218
Pray 4 Love (feat. The Weeknd),Rodeo,https://open.spotify.com/album/4PWBTB6NYSKQwfo79I3prg,2015,140622982,"Oh, oh, don't pray for love
Oh, oh, say it loud
Just ask the lonely, oh-oh
Just ask the lonely, oh-oh
Pray for who lost they fate and died too young
Pray for the ones I hate, the ones I love
Pray for my liver when I'm off in this club
I pray that the demons go away, they hauntin' us
Man, I can't take no more of this lifestyle we been living
Man, I can't take no more of the white powers in position
Gotta grab up J-Will, gotta scoop up J-Rich
Told Chase we ain't going back, you know we gotta hitch
I mean, I'm aggravated, agitated, I admit
Intoxicated, animated, got me feeling kinda lit
Contemplating fornicating, might as well fuck up some shit
They looking at me way too crazy, got me feeling communist
But I'm just trying to save the throne, pray for Bones, pray for Stix (just ask the lonely)
If my album never sell, then we gon' hit that lick
Tell Lamar, call up Cash, tell him buzz me at the Ritz (just ask the lonely)
It's the weekend, we off the deep end, you need to pray for us
Oh, oh, don't pray for love
Oh, oh, say it loud
Just ask the lonely, oh-oh
Just ask the lonely, oh-oh
Pills (pills, pills), have you ever been through life's (through life's), challenges?
Promises? Promises? (Challenges? Promises? Promises?)
Get down (get down), I'm prayin' (I'm prayin')
♪
Let me tell the lost tale about Jacques
Let me tell you how I turned Scott
How I went down on the block
Waterfall around ten o'clock
And how we came up getting all the knots, dodging cops, yeah
'Fore a nigga had the locks (just ask the lonely)
'Fore a nigga had the chain, 'fore I had the bops
Always kept my city on me like it was a swatch (just ask the lonely)
Every time we in the party, took it up a notch
Now I'm thinking 'bout this new girl, and she doing pop (oh-oh)
Wanna know my dick longer than a Pringle box (don't pray for love)
Tired of seein' these black kids on the face of FOX (oh-oh)
And fuck CNN, they don't wanna see us win (say it loud)
Mama, don't you worry no, no more, worry no, no more (just ask the lonely)
I'ma take you from the first to the ninetieth floor
You always told me what I plant, that shit gotta grow (just ask the lonely)
And anything I detonate, that shit gotta blow
Pray for y'all
No, oh, oh (woah)
We don't pray for love, no more, no more (woah, woah, woah)
We don't wanna see you on the cover of a carton (you don't wanna see no more)
We don't wanna see you on the news (no more, no more, no more, no more), all alone
♪
Hm, no, no, no, no, no, no, hm, no, no, no, no, no, no (just ask the lonely)
Hm, no, no, no, no, no, no (just ask the lonely)
Hm, no, no, no, no, yeah
Underrated is an understatement
They tryna test greatness, a nigga tryna get paid
These niggas fiends watching all of my moves
'Cause the music like crack, got me cooking all day
I'm right here, you know where I stay
And if you don't, then ask your girl, she probably know the way
She like my show lights, she wanna be wifey
She know that if she got me then she gon' be good for life
So I pull out for the climax, faster than a hi-hat
Sorry, baby, I don't play
And if I did, you know my kids would be ballin'
And my daughter gon' never meet a nigga like me
My niggas pull up in that Rolls-Royce
Like they sell that coke, boy, shout out to the Coke Boys
They never pray for us, nobody pray for us
Nobody pray, no, no, no, no, no
Oh, oh, don't pray for love (oh, oh)
Oh, oh, say it loud (oh, oh)
(Just ask the lonely)
Just ask the lonely, oh-oh (just ask the lonely)",https://open.spotify.com/track/2dJ4rGtsOHOgvTQawsCRtg,307
Never Catch Me,Rodeo,https://open.spotify.com/album/4PWBTB6NYSKQwfo79I3prg,2015,50353628,"She take a shot of Hennessy
I take a shot of Pimp C and slow up
I do this shit for him and me
I'm the next lone star to blow-up
Picture being locked in a box
Selling beats 'cause you need dollars
They say I can make to the league, mama
500 dollars all we need, mama
Then we gon' be on
Tired of seeing the lights off
Pops heatin' up the stove
Was close to stealing and killing, now just to get 'em on
Couple drinks down of Rosé
I'm tipsy, y'all faces look like an emoji
The RAV4 turned into a Rover
'Til it took flight and ended up on the shoulder
Now my money a little longer
Lookin' back how we finnesin', we ain't know shit
They gave me three, got twenty five on the low
Who knew that lump sum will get me on?
My fiftteen seconds last a little longer, longer
I can shit all day, diaper
Call that eating all day, itis
Will I ever fall off? I doubt it
No, no, no, no
All these diamonds shinin'
All this gold on me, all these foes on us
How do I dodge these zombies?
They want my soul from me
Know that I'm gone, but one thing
They will never catch me
Falling off, falling off
Never catch me falling off
Falling off, never catch me
Falling off, falling off
Never catch me falling off, falling off
(Ooh-ooh-ooh-ooh)
Right
(Ooh-ooh-ooh-ooh)
Right
(Ooh-ooh-ooh-ooh)",https://open.spotify.com/track/3jg8bevUzKYONDLBBQquif,176
COFFEE BEAN,ASTROWORLD,https://open.spotify.com/album/41GuZcammIkupMPKH2OJ6I,2018,264160077,"Bad, bad news
I'm just bad, bad news
Good thing, the two, Bonnie and Clyde
The money and who?
It's bad news
Bad, bad for you
But I'm back on the coffee bean
Anything in between, yeah (This is all, this is all)
Back of the coffee line
Back, back, back in the bathroom line (This is all)
How would you feel if I had you? (This is all)
Trust me, you would be mad too (This is all)
Shawty, we can be mad cool
Just hit me if anything past due
Your family told you I'm a bad move (This is all)
Plus I'm already a black dude
Leavin' the bathroom, my hands is half-rinsed
If only a nigga just had sense
Speaking in past tense (This is all)
It's been a week and a half since
We ain't been speaking and that meant
You feeling free in my absence
I've been going through a lot behind
Behind this glass tint, yeah (This is all, this is all)
Back of the coffee line
Back, back, yeah, back in the bathroom line (This is)
I know they told you I'd be bad for you (This is all)
Don't worry I'll be back for you
All the money and cars
Stripper hoes and the tattoos
Bad news
Back off a coffee bean
Reflecting on all you see (This is all, this is all)
Stressing the over award shows
She's stressin' over her wardrobe (This is all)
Bought the mansion on foreclose
No matter how many tickets your tour sold
You feel this deep in your torso
Feel like someone's readin' your horoscope (Ooh)
Some shit only me and Lord knows (Ooh)
SOS, for those who hear this in morse code (Ooh)
Too many doors closed cul-de-sacs and fork roads
Still ended up at the North Pole
This is where remorse goes (This is all)
This shit'll have you in divorce court
Fighting over your seeds
Fighting over your deeds, sliding over your keys (Ooh)
Alimony and fees (Ooh)
As your lawyer proceeds
To give out bad news
I'm just bad, bad news
Good thing, the two, Bonnie and Clyde
The money and who?
It's bad news
Bad, bad for you
But I'm back on the coffee bean
Anything in between (This is all, this is all)
Back of the coffee line
Back, back, back in the bathroom line (This is all)",https://open.spotify.com/track/6vnfObZ4Ys70SBAtti1xZ9,209
ASTROTHUNDER,ASTROWORLD,https://open.spotify.com/album/41GuZcammIkupMPKH2OJ6I,2018,528819308,"Yeah
♪
Seem like the life I fiend
Seem like the life I fiend's a little distant, yeah
Seems like the life I need
Seems like the life I need's a little distant, yeah
Light the remedy, yeah
Sit back while I ride the deep
Do it on repeat, repeat
Sins controlling me, yeah
Angels, halos over me
I need blessings and my peace
You been off the streets, yeah
Wildin' on me, know my G's, we been going for a week
Now you wanna peek, yeah
Hands up, why they tryna reach?
I can't even get that deep
Told you I don't teach, yeah
Practice, oh, no, never preach
Practice, oh, no, never preach
Infiltrate the enemy, moving on them randomly
Feels like the life I need's a little distant, yeah, yeah
Feels like the life I need, yeah
Feels like the life I need's a little distant, yeah
Yeah, yeah
Yeah",https://open.spotify.com/track/4MXhiYIRDMGAuvZc5IFTwC,142
NC-17,ASTROWORLD,https://open.spotify.com/album/41GuZcammIkupMPKH2OJ6I,2018,188292162,"Me and my bitch, I swear we like the same sex (Ooh)
Fuck with all my chains on, let's have chain sex (Serve, yeah)
Hangin' with the gang, you get your fangs wet (Wet)
Wanna kick with the gang, you gotta bang it (It's lit)
If you gon' throw ice on, gotta swang it (Ice)
Holes in the wall, I cannot hang it (Nah)
Pour different colors, sippin' tainted (Ooh)
Woah, think the vibe just start vibratin' (Vibe)
Don't do playgrounds, we do not swing sets (Swing)
Shawty got the K, don't entertain threats
Shawty came my way, she brought the same sex
Bust it down, she talkin' body language (It's lit)
Eating that punane, got my bangs wet (Eat it up)
We gon' have to change for the banquet (Drippin')
Solo with Mulsanne, it's not the same specs (Skrrt, skrrt)
Pull up, left with something I ain't came with (Alright)
Woah, woah, woah, woah
Woah, woah, woah, woah, woah
Ice, froze, glow
Get, glow, get, glow (Yah, yah)
Three main bitches thinkin' they my main bitch (21, 21)
Hit the club and swap the hoes I came with (Straight up, straight up)
Don't you come outside
We on that gang shit (Straight up, straight up)
Had to switch my t-shirt 'cause she stained it (On God)
Had to buy a visa, she from Moscow (21)
Fuckin' 'round with Travis, you get crossed out (Crossed out)
He used to be on that nigga off now (He off now)
I done got so rich
I Saint Laurent my dogs now (Straight up, straight up)
Earrings cost a quarter certified by GIA (21)
If it's 'bout my bae or 'bout some smoke I'm on my way (Skrrt, skrrt)
Your bitch dated Kid Cudi but I'm not signed to Ye (On God)
I nutted on her cheek, her new nickname is Babyface (21)
Me and my bitch, I swear we like the same sex (Ooh)
Fuck with all my chains on, let's have chain sex (Serve, yeah)
Hangin' with the gang, you get your fangs wet
Wanna kick with the gang, you gotta bang it (It's lit)
If you gon' throw ice on, gotta swang it (Ice)
Holes in the wall, I can not hang it (Nah)
Pour different colors, sippin', tainted (Ooh)
Woah, think the vibe just start vibratin' (Vibe)",https://open.spotify.com/track/6BJbOXDlgVAXSaq6wYFYT2,156
GANG GANG,JACKBOYS,https://open.spotify.com/album/1Sf8GsXG32t0jNrX11xqWx,2019,221114526,"What the fuck is we doin'?
Yeah
♪
Yeah
Yeah, yeah, yeah
Gang back in the stu' (Gang, gang...)
Uh, yeah, gang back in the stu' (Gang)
Young nigga win, win, win, win (Bitch), how can I lose? (How, bitch?)
Uh, how can I lose? (How, bitch?), uh, how can I lose? (Yeah)
I ain't with the gang, gang, gang, gang (Bitch), fifty gon' shoot, uh (Squad)
Me and Trav' in a coupe (Scoop), paparazzi, we switch the route (Yeah)
Yeah, see your bitch gettin' loose, huh
I'm in L.A. with the views, huh (Yeah), I'm in L.A. with your boo (Yeah, it's lit)
We on the quest with the tribe (I bought it)
It's way too late, pick a side (Feng shui)
Jack make them boys come alive (They what?)
Better not fuck up the vibe (It's Travis)
Runnin' this shit with a stride
You know my gang the flyest
I'm with the gang, gang, gang, gang, BOYS hoppin' out of coupes (Gang)
I'm switching' lanes tryna maintain, duckin' boys in the blue (Zoo)
I see you holdin' out on my change, I'm needin' all of the loot (Ching-ching)
When I'm ridin' off on my side, best believe I got the scoop (Scoop)
I could make a hundred right now, give it all to the troops (Troops)
Whole squad got the juice (Yeah), send a stain like a flu' (Yeah)
Whole squad goin' up, JACKBOYS on the loose (Yeah, yeah, bitch)
In the H, reppin' Screw (Screw)
Flamin' Harlem with the goons (It's lit, yeah)
We was wildin', skippin' school (Wildin')
Now we can go make the (Ching ching)
Now we can go make the millions, Trinidad my crew
Cactus Jack on my shoe, any shit
I came from the mud, straight to the top (Yeah)
Shooters outside double parked
I'm from New York, she like how I talk
She need an ass, it's bought
Came to my chambers, we went wild
Drove the bitch crazy, gave 'em all miles
I'm with young Jacques, know it's goin' down
Smokin' that Jack, get it by the pound (Straight up)
Don't need the pussy, I'm in and I'm out (I'm out)
But I'm still smokin' that loud
Hit my hoes when I'm in town (Yeah)
They know who got the Scouts (Bitch)
I'm with the gang, gang, gang, gang, BOYS hoppin' out of coupes (Gang)
I'm switching' lanes tryna maintain, duckin' boys in the blue (Bitch)
I see you holdin' out on my change, I'm needin' all of the loot (Ching-ching)
When I'm ridin' off on my side, best believe I got the scoop (My side)
I could make a hundred right now, give it all to the troops
Whole squad got the juice, send a stain like a flu' (Ooh)
Whole squad goin' up, JACKBOYS on the loose
I'm from the North where they robbin' and killin' (Woo, woo)
Young nigga rich, but I'm still from the trenches (Woo)
Luxury Tax, my water by G
P-I-R-U, bitch, I bang what I bleed
I'm passin' out pills, I'm a geek at the VIP (Yeah)
One shot to the head and make sure he don't miss
I fuck on the bitch, have her stalkin' on Fifth
Still pourin' up Act', they say it don't exist (At all)
Fifth got some vibes at the crib
Like, ""I wanna fuck right now""
Keep hundred on hundreds for real
Bitch, I'm goin' up right now
Bitch rollin' some weed, you know gang in the stu'
Bottles on bottles, 1942
Models on models, this shit nothin' new
You might catch some shots takin' shots at the crew
I like my hoes by the two
Blew 800K on a coupe (Uh-huh, racks)
We fucked, there wasn't nothin' else to do (Ooh)
You play with La Flame, I'ma shoot (Racks)
This a hundred round drum, I got mob ties
This a double M truck, ain't no broke vibes
Now we only take jets for the hard times
Know I call up them killers, they gon' slide
Bitch, I'm with the gang
I'm with the gang, gang, gang, gang, BOYS hoppin' out of coupes (Gang)
I'm switching' lanes tryna maintain, duckin' boys in the blue (Bitch)
I see you holdin' out on my change, I'm needin' all of the loot (Ching-ching)
When I'm ridin' off on my side, best believe I got the scoop (My side)
I could make a hundred right now, give it all to the troops
Whole squad got the juice (Ooh), send a stain like a flu' (Ooh)
Whole squad goin' up, JACKBOYS on the loose (Yeah)",https://open.spotify.com/track/6uJONCdr2rC65BNmCnTBWK,244
