SongName,AlbumName,AlbumLink,Year,PlayCount,Lyrics,SongLink,Duration
Saint Laurent Mask,"Huncho Jack, Jack Huncho",https://open.spotify.com/album/6FED8aeieEnUWwQqAO9zT1,2017,53470418,"Yeah, yeah
It's like a whole different world, ooh
(Buddah Bless this beat)
Yeah (yeah), yeah
Yeah (yeah), yeah
Saint Laurent Mask, yeah (YSL)
Yeah, yeah (yeah)
Yeah, yeah (yeah)
Yeah
Pull up with a broom, do a street-sweep (sweep, sweep)
She addicted to CC (coco)
Swag on repeat (drip, drip)
Day by the day (day by the day)
Countin' that bag on the low (bag)
Count that bag on the floor (bag)
Stack it up 'til you get more (stack it up)
Stack it up 'til it get mold (stack it up)
Stack it up 'til it get mold
Stack it up 'til it get mold
Ain't givin' out no freebies
Swipe with the digital CC
Come get high in my tipi
Take them bars, no 3G, yeah
Live fast, live life easy
Pour a lil' drop in my sweet tea
X-rated, no PG
Your ex-nigga on creepy, uh
She don't wanna keep 'em (yeah)
She fuck 'em then leave 'em (yeah, smash)
She hope I hit her (brrt, brrt)
She hope I beep her (hope I beep her)
She want me to get her a bag, a house or maybe a Bimmer (skrr-skrr)
I might say some shit out of my mouth, but still won't leave her (still, still)
I might say some shit out of my mouth, call my paralegal, uh
I done did some shit in my life ridin' in that Regal, uh
Go Mel Gibson, Danny Glover, that shit lethal, uh
Can't live backwards, live life, that shit evil
Mask and grab the safe (mask)
I bet you niggas can't re-up (no)
Bulletproof Wraith, safe (bulletproof)
Recline it, I let my seat up (dope)
Huncho Jack, we the robbers (brrt)
Huncho Jack got a chopper (Huncho)
You might want to keep this film rollin'
Huncho Jack won an Oscar (hey)
Yeah (yeah), yeah
Yeah (yeah), yeah
Saint Laurent Mask, yeah (YSL)
Yeah, yeah (yeah)
Yeah, yeah (yeah)
Yeah
Pull up with a broom, do a street-sweep (sweep, sweep)
She addicted to CC (coco)
Swag on repeat (drip, drip)
Day by the day (day by the day)
Countin' that bag on the low (bag)
Count that bag on the floor (bag)
Stack it up 'til you get more (stack it up)
Stack it up 'til it get mold (stack it up)
Stack it up 'til it get mold (yeah)
Stack it up 'til it get mold
Stack it, stack it, stack it (yeah)
Stack it, stack it, stack it (oh yeah)
Wrap it up, put it in the plastic (oh yeah)
Wrap it up, wrap it up, put it in the plastic (yeah, yeah, yeah)
(Stack it, stack it, stack it) she don't wanna keep 'em
She fuck and then leave 'em
(Stack it, stack it, stack it) she hope I hit her
She hope I beep her
(Wrap it up, put it in the plastic) she want me to get her a bag
A house or maybe a Bimmer
(Wrap it up, wrap it up, put it in the plastic) I might say some shit out of my mouth
But still won't leave her (yeah)",https://open.spotify.com/track/7JGyxh8G8QZnu4AMJuCqlj,190
I Can Tell,Rodeo,https://open.spotify.com/album/4PWBTB6NYSKQwfo79I3prg,2015,65124460,"I can tell
I can tell, baby, I can tell
Ooh, I can tell, baby, I can tell
You ain't told no tales, you ain't told no tales
Yeah, gone out of your way, you know we can tell
Yeah, I can tell, baby, I can tell
I can tell, baby, I can tell
I can tell, baby, I can tell
I can tell
I can tell by the night tales and the dry spells
All the wrong ones and the right things to stay away from
And how we took off and how we on top
And how we won't fall, how we going up
Or how we came up, or how we came up
It all started in the basement
Was an attic, but we called that shit the basement
Bass used to break all my mommas vases
Unc' shot my first 8 then nigga I probably wasn't eight then
Always had the gas like I broke wind
They said my way of making dollars never made sense
Come take a dive, a waterfall in the deep end
I can tell you 'bout the nights out in Fort Bend
I can tell, baby, I can tell
I can tell, baby, I can tell, yeah
You ain't told no tales, you don't-, mhm
I can tell, baby, I can tell
I can tell, baby, I can tell
I can tell, baby, I can tell
I can tell, baby, I can tell (yeah)
No, you don't tell, yeah-ah-ah (yeah)
Yeah, I can tell 'bout the night tales
And all the dry wells, and all the long roads
And all my ideas before the cornrows (straight up)
How we came up and how we came down
Going donuts, coffee couldn't help now (La Flame)
How we zoned out, made it out the wood now
And what it do when they wanna be your friend now (oh, no)
How to get it, how to live and get it in now
How to go from scraping pockets, making his demands now
I been impulsive, non-emotional, staying humble 'bout it
Tilt the posture, sick, pass the bottle
Five-o-four hot boys, minus the bad rap like Silkk the Shocker (yeah)
But I'ma pull up the silk, to shock her with the silk
Nigga you know I been a rocker, dripping milk and knockers
Take it up another notcher, take it up another notcher
I top a, pop a pill, pop a seal to forget about you
I'll bumbaclot you, bumba bumba blocka shot you
Bling and bang, a bang a rapper
Bangarang, I brought my money back
Orangutan diamonds hanging on my neng-a-lang
Bitches hanging on my dang-a-lang
I can tell, baby, I can tell
I can tell, baby, I can tell, yeah
You got no tales, you ain't-, mhm
I can tell, baby, I can tell (hoo, hoo)
I can tell, baby, I can tell (how 'bout I come over there)
I can tell, baby, I can tell (all of them bitches can tell)
I can tell baby, I can tell (all of them bitches can tell)
No, you don't tell",https://open.spotify.com/track/2hiuiI3ac0I5kJWtkeGHEL,235
outside,Birds In The Trap Sing McKnight,https://open.spotify.com/album/42WVQWuf1teDysXiOupIZt,2016,103637654,"All my niggas outside
Ain't goin' in, yeah
We been hangin' outside
Ain't goin' in, yeah, yeah, yeah
Yeah, yeah, automatic
Yeah, always got it on me, baby, automatic, yeah
Where I'm at is static, but it ain't got traffic, yeah
Push up on me, them boys make you do a backflip
Balance on the beam, yeah, balance on the beam, yeah
Do some shit I've never seen, won't you come out with the team? Yeah
Yeah, you might just win a ring, yeah, why they home on they home screens?
And all my niggas outside
Ain't goin' in, yeah
We been hangin' outside
Ain't goin' in
We been hangin' outside, goin' in
Outside, not goin' in
Pull up in a Lambo or just with the Benz
Checkin' out, never checkin' in
We been outside, not goin' in
Hope you had a mattress when you sleepin' on me
Hope you got some backup if you creepin' on me
'Cause just last week I Rest-In-Peace'd a homie
Why you do it? Why you switch up? (Ooh)
Was it for the image or for the pictures? (Ooh)
You always seem to show up when I'm at the mixes
'Cause you know I'm not myself when I'm off the liquor
Off the lean, it's always better off the lean
All my niggas outside
Ain't goin' in, yeah
We been hangin' outside
Ain't goin' in
All my niggas outside (21, 21, 21, 21)
All my niggas outside, pillow talkin', sneak dissin'
Get a nigga jaw wide, beat your baby mama throat so long
She say her jaw's tired, Young Savage get a nigga whacked
'Cause I got mob ties, I'm a wise guy
All my niggas in the field
I'm draped in that Biani, I ain't got a deal
Slaughter Gang and PDE, we killin' shit for real (21, 21)
Ten bad bitches, suckin' dick and eatin' pills (what?)
And I keep that Tommy, nigga, and I ain't talkin' Hil' (21)
And I be on mud, I get mad if it spill (spill)
Bitch, I know your baby daddy prolly wanna kill (kill)
I'm a real nigga, fuck, niggas can't feel (21)
Plus I get inside that bowl and skrrt, skrrt, skrrt, skrrt
Hit it from the back, pull up her skirt (21)
I just copped that Bentley truck I skrrt, skrrt, skrrt
Bitch, I'm outside on the percs, percs, percs (21, 21, 21)
All my niggas outside
Ain't goin' in, yeah
We been hangin' outside
Ain't goin' in
All my niggas outside",https://open.spotify.com/track/177WEvlLsCc0FzCTWslawr,176
Motorcycle Patches,"Huncho Jack, Jack Huncho",https://open.spotify.com/album/6FED8aeieEnUWwQqAO9zT1,2017,129612782,"Motorcycle patches on my jacket
Rip all the money out the plastic
Put it on her tongue and now she dancin'
Gave her everything, now what you asking
Flip, make it flip, do gymnastics
Popped up a bean like a talent
Eat up all the green, taste just like salad
40 on my hand like it's new fashion
Blastin'
Huncho, yeah yeah
She gon' make that a dribble, playin' basket (ball)
Don't call it cuffin', nigga, I ain't passin' (woo)
Niggas pourin' fours, poppin' seals like caskets (drip it)
Nawfside hot, boy I bought a dragon (yeah)
I get it, you grill (he)
VIP spread the bills (spread)
M's the deal (deal), spinnin' the fortune wheel (spinnin')
Four by four (wooh), skrrting all the wheels (skrrt)
Eskimo (brr), icy necks and grills (wooh)
Watch out, watch out
Big Baller Brand, watch out (watch out)
This for the fam', watch out (watch out)
It's my time, don't clock out (time)
Three way pack, we knock out (knock out)
Molly make her bite down (bite down)
42 Pistons, Stackhouse (boss)
Nigga we winnin', racks out (cash racks)
Motorcycle patches on my jacket (yeah)
Rip all the money out the plastic (it's lit)
Put it on her tongue and now she dancin' (pop it, pop it)
Gave her everything, now whatch you asking (alright)
Flip, make it flip, do gymnastics
Popped up a bean like a talent
Eat up all the green, taste just like salad (yeah)
40 on my hand like it's new fashion (yeah yeah)
Blastin'
Fuck shit up, we fuck shit up
We got, we stuck, drugs got me stuck
Diamonds untucked, diamonds untucked
(Ice, ice, yeah)
We gon' rope
I can't stop no more on my time
I can go, yeah (oh oh)
If I send these flicks to your phone, you can't leave (nah)
Motorcycle patches is earned on the streets (ah, ah)
Fuck shit up, we done fucked shit up
It got me stuck, it done got me stuck
Drugs got me stuck, drugs got me stuck
Diamonds are tucked, diamonds are tucked, (ahh) yeah
Jacket got stripes (alright), I been blessed in with the knights (blessed)
Just turned 25 yeah (five)
Goin' in like I'm doin' 25 to life (ahh)
I am alone, out of sight
At they crib, come take a hike
And it feel not the Hills
I been eatin' like it's ice (straight up)
No more grills, they like wheels make me ill at the sight
Even still scroll through the reals
Missed a time zone, we here
Don't even age, yeah she know (yeah)
You was tried, never hope (yeah yeah)
You was real, Jack and Jill
Like the pill had a woke, uh (it's lit), yeah
Motorcycle patches on my jacket (yeah)
Rip all the money out the plastic (yeah yeah)
Put it on her tongue and now she dancin' (pop it, pop it)
Gave her everything, now whatch you asking (don't)
Flip, make it flip, do gymnastics (oh)
Popped up a bean like a talent (yeah yeah)
Eat up all the green, taste just like salad (it's lit)
40 on my hand like it's new fashion
Blastin' (pew, pew, pew, pew, pew)",https://open.spotify.com/track/7g7raxdQpiLZT7aOlib4S1,191
5% TINT,ASTROWORLD,https://open.spotify.com/album/41GuZcammIkupMPKH2OJ6I,2018,651794124,"Who's that creeping through my window?
Before you come outside I got the info
Took her to the endzone from the the endzo
Know I love to smoke, you love to lick more
Want to interject on you call for
All that out your new shit that ain't called for
Who that creepin' on the tennis guard 5%
All that fall in love shit she got it Kevin Hart (Kev)
All that speed and flash shit, we might teleport (skrr)
All that cop arrest shit I might might clip a sarge (twelve)
Keep bouncin' that ass you just might get a wart (yeah)
If she bad, she get a pass into the tour (passes yeah)
I've been through the family got a bad sister like Janey
I'm south-side don't panic
Got a switch, got a change no transit
Still jumpin' 'round move antsy
And I still don't like shit fancy
I been feelin' real trancy
They're outside they really tryin' to end me
Who's that creeping through my window?
Before you come outside I got the info
Took her to the endzone from the the endzo
Know I love to smoke, you love to lick more
Want to interject on what you call for
All that out your new shit that ain't called for
Who the fuck is this?
That's somebody baby mama inside of the Benz
While I'm tryna tip
Shawty said she holding got a razor in her lip
Mix my cup and twist one up, I love that ratchet shit
She like ""Iced out wrist, iced out, iced out wrist"" (iced out wrist)
Fuck don't kiss, fuck she fuck don't kiss (muwah)
Look like friends, but she say they twins (twins)
Jump right in, there's leg room in this Benz (leg room in this Benz)
Ten miles to the crib you know that's deep (yeah)
I think there's someone out there that's watching me
Who's that creeping through my window?
Before you come outside I got the info
Took her to the end zone from the the endzo
Know I love to smoke, you love to lick more
Want to interject on you call for
All that out your new shit that ain't called for",https://open.spotify.com/track/11kDth1aKUEUMq9r1pqyds,196
R.I.P. SCREW,ASTROWORLD,https://open.spotify.com/album/41GuZcammIkupMPKH2OJ6I,2018,252552231,"Ya' know?
(South Side)
♪
Rest in peace to Screw, tonight we take it slowly
(I gotta let you know, the way)
(I gotta let you know, the way)
(I'm gonna take it all and clean it)
(I'm gonna take it all and spend it)
♪
(South Side)
And that's all I've been sayin'
(South Side)
If you fall for the games, then you're the one playin'
Because it's too much money out here
And there's too many honeys out here
Feel like a trip off the drank, that's weird
Feel like a trip off the drank, that's weird
♪
Rest in peace to Screw, tonight we take it slowly
Oh, my God, I just can feel the love
Drop top with the windows up
Jump inside, oh, won't you roll with us?
Make the devil bite the angel dust
Shawty, shawty, please
Shawty would you go?
Shawty what you like?
Tell me what you want
♪
Rest in peace to Screw, tonight we take it slowly, yeah
I just took a four to the head like Mane
Drop the top on the slab, like Mane
Off the top of the dome like Mane
Nothin' beatin' home like Mane
And the Screw tapes on like Mane
I go Pimp C on the phone like Mane
Flip side platinum don't do chrome like Mane
Had the south side fade, now let the braids hang
This shit S.U.C smooth like Mane
Rest in peace, Screw, like Mane
Rest in peace to Screw, tonight we take it slowly
Oh, my God, I just can feel the love
Drop top with the windows up
Screw found international sound because—
Throughout the South, and it's new to, um...
Shawty got a thing for us",https://open.spotify.com/track/4SZepBIPDRwPaHIjAKwRDb,185
LOOOVE (feat. Kid Cudi),UTOPIA,https://open.spotify.com/album/18NOKLkZETa4sWwLMIm0UZ,2023,101883065,"I get it, I get it, I get it, love
They love me, they love me, love me long time
I get it, I get it, I get it, love
They love me, they love me, love me long time
I get it, I get it, I get it, love
They love me, they love me, love me long time (long time, long time)
I get it, I get it, I get it, love
They love me, they love me, love me long time (long time, long time)
Y'all feel, y'all feel like that?
Y'all feel, y'all feel like that?
They give me, they give me love, they love the scott
They love how the disc rock, they lovin' the Jac'
No wi fi, we hot spottin', connected the block
Rollin' through the club, we feelin' the love
Iller than my trees, they jockin' my steeze, please
Five hundred degrees, nigga, who hotter than me? (Bitches, yeah)
Y'all feel, y'all feel like that?
Y'all feel, y'all feel like that?
They love me, love me, love me, yeah, they love me long time
They love me, they love me, love to show me love (love)
They love me, love me, love me, yeah, they love me long time
They love me, they love me, love to show me love (love)
Y'all feel, y'all feel like that?
Y'all feel, y'all feel like that?
♪
Come and kick back with us
This a new religion, come and have mass with us
Tell me, have you made love to a bachelor?
Turnin' bad city, used to grow up in the backwoods
Come take a ride with the real, it's the last of us
We gon' make them vogue bitches turn racheter
First task, now look, you used to laugh at us
Pass the actavis 'cause a nigga past passivist
Imagine my world of misogyny
Nigga, fuck a, fuck a monogamy
Got her head tipped over the driver's seat
Meet me, don't go tell my mama 'bout this, baby, hold up
We gon' own the summer
Never, never stressin', no, we always hit the numbers
'Cause always stressin', always cuffin' different numbers
Know we tired of makin' shit, you know the streets don't make diplomas
Drunk somethin', tryna find my keys
I find myself lookin' down at the stars, the bees
The stars align, remember when it was Ramadan
I try a line, might try some crime, might try to dime
But now it's time, baby, now it's time
Na na na na na, na na na na na
Na na na na na, get the love and they givin' it up, like
I get it, I get it, I get it, love
They love me, they love me, love me long time
I get it, I get it, I get it, love
They love me, they love me, love me long time (time, time)
I get it, I get it, I get it, love
They love me, they love me, love me long time (long time, long time)
I get it, I get it, I get it, love
They love me, they love me, love me long time (long time, long time)
Y'all feel, y'all feel like that?
Y'all feel, y'all feel like that?
♪
It's on fire toni–
♪
The night is too young and the love in the air hit me
Follow all the vibes up in every city
Gamble with your life, thinkin' 'bout it
Home with you tonight, you don't want it with him
We raise our glasses, the madness
The tiny waist, the asses, dance in the trances
Baby said she ready and we 'bout to find out
Don't be mad that your girl a fine dime, we get it
Livin' live, Richard Pryor on a mission
And they lookin' like they know, but they didn't
Let me slip into my mode, little
Smokin' plenty with tequila, baby
Members of the rage run 'way with it
Fashion week in Paris, front row with it
Diamonds always dancin', no bullshit
They see a black god on the job, yeah, I'm so winnin'",https://open.spotify.com/track/0a4SMs889NwP8oWI7Vemle,226
GOD'S COUNTRY,UTOPIA,https://open.spotify.com/album/18NOKLkZETa4sWwLMIm0UZ,2023,132186190,"(La, la, la, la, la, la, la, la)
(La, la, la, la) (watchin' in) (la, la, la, la)
Only one they watching in, yeah (la, la, la, la, la, la, la, la)
It ain't up to you no more (la, la, la, la, la, la, la, la)
God Country, this is war
♪
Wakin' up, I see the light
I been drunk and it's alright
I took the drive to clear my mental
Would tint the whip, but it's a bike
It's demon time, I got it on me (on me)
Might earn a teardrop overnight
Wear Louis shades to block my psyche (psyche)
It's hot as hell, but where the ice?
You in God's Country, not in Montgomery
Go Ted Bundy, then go home and play Al Bundy
The card black and you know it got a sky limit
I make a mill every—, you decide, choice is yours (yeah) (la, la, la)
The butterfly reflect the doors (yeah) (la, la, la)
I hit the gas it metamorph (la, la, la)
Couldn't get this shit off credit score (la, la, la)
Hunnid thousand pack the fans (la, la, la)
Got 'em jumpin' with no hands (la, la, la)
Need more spaces where we jam (la, la, la)
In God's Country with the fam (la, la, la)
Yeah, woah
(La, la, la, la, la, la)
Ooh-ooh (la, la, la, la, la, la, la, la)
Ooh-ooh (la, la, la, la, la, la, la, la)
Ooh-ooh (la, la, la, la, la, la, la, la)",https://open.spotify.com/track/04WxWo7XeVyx22xEsrWRUb,127
CANT STOP,JACKBOYS 2,https://open.spotify.com/album/32lGAqeVkdJxEj2iv2Q01B,2025,13752369,"Yeah, yeah
I just dropped my top, yeah (yeah)
I can't stop (cannot stop this shit)
Don't ask 'bout my fit, it cost a lot, yeah
I cannot stand out, I'm standing in, you know where I'm at (I can not stand)
Ever since I came in, I just put my top down
Okay, gettin' jaded, but I can't feel my face now (Pluto)
Opp ridin' in Lamb' (yeah), in the suicide, I can't see 'em (yeah)
I'll be fine, baby, I don't need you
No lie, baby, you a freak too, yeah
All in it (ooh), all in it (ooh)
I'm just '42 sippin' (yeah, ooh)
I can drown in it (ooh, know I can)
All in (ooh), all in (ooh)
I'm just '42 sippin' (ooh, you know how we comin')
I can't drown in it (ooh)
Drankin' on codeine and went to the top (oh yeah)
It's diamonds in my watch and I can't see the clock (oh yeah)
Pull up in foreigns, I'm droppin' the top (oh yeah)
Turn up my savages, word to Allah
Turn up my shooters, it ain't no more robbin' (turn up my shooters, oh yeah)
Lil' bitty poodle niggas ain't no problem (oh yeah)
She wanted a poodle, it cost me 20 thousand (oh yeah)
Fresh in the photo, but didn't need a stylist
I'm Wallie the Sensei (oh, oh)
Took his bitch on the weekend, he ain't get her back 'til Wednesday
And I got a problem with spendin' too much money, that's what my friends say (Freebandz, that's what my friends say)
Pulled up in a '23 drop-top, whoa
Bad bitch, ass out in a crop-top, yeah
I ain't even ate and I'm still shittin'
I won't make her my bitch, but I'm still hittin'
Fuckin' on queens, but I ain't from Great Britain
I'm all in her stomach, I ain't fittin'
That bitch told me, ""Slow down,"" but I ain't listen
They be like, ""You a king, you need to slow down,"" I'm drinkin' that lean, I'm still sippin'
Drankin' on codeine and went to the top (I drop my top)
It's diamonds in my watch and I can't see the clock (oh yeah)
Pull up in foreigns, I'm droppin' the top (oh yeah)
Turn up my savages, word to Allah (oh yeah)
Turn up my shooters, it ain't no more robbin' (oh yeah)
Lil' bitty poodle niggas ain't no problem (oh yeah)
She wanted a poodle, it cost me 20 thousand (oh yeah)
Fresh in the photo, but didn't need a stylist
(Ooh) all in (ooh)
I'm just '42 sippin' (ooh)
I can drown in it (ooh)
All in (ooh), all in (ooh)
I'm just '42 sippin' (ooh)
I can drown in it (ooh)",https://open.spotify.com/track/7HFdogJVrkXSm0qBf1JlOB,132
LOST FOREVER (feat. Westside Gunn),UTOPIA,https://open.spotify.com/album/18NOKLkZETa4sWwLMIm0UZ,2023,93576616,"Have you ever been lost?
Have you ever been lost?
Forever
Lost on islands, driven in boat cars
Just bring your girl, feel like she both ours
Young black nigga work at the Auchans (Auchans)
So how we here trapped on the ocean?
'Bout to go up a level of disrespectful
I'm just one chain away from goin' heavy metal
I'm just one angel away from blockin' out the devil
Just one mountain away from meetin' all my rebels
Too much power, too many hours all in a day
I sent her flowers, ain't talkin roses, I'm talkin' maoda
Ask if she ""Ha-ha-ha"", I really doubt it (ha-ha-ha)
Took her through the Hills at noon, she felt the-
(And how wonderful, how wonderful)
Baby girl think she in Honolu' (wonderful)
Don't you know you in the I-5 loop? (How wonderful)
How many chickens fit in the coupe?
(Fit in the coupe, fit in the coupe) (how wonderful, wonderful)
Wonderful, she don't wanna leave
She jump up, bounce back like trampoline (have you ever been lost?)
(Like trampoline, like trampoline, like trampoline, like trampoline)
Ayo, whip the cocaine 'til the pot bust ('til the pot bust, ah)
You was on the porch, I was locked up (I was locked up, ah)
Two-tone Maybach truck with the Maxwells (skrrt, Maxwells)
Think a nigga shot somethin' (ah)
Put it to your face, watch a motherfucker blow (boo-boo-boo-boo-boom)
Daytona, different color face on the road (ah)
Ten on his head, he be dead by the mornin' (by the mornin')
I can get dirty for the stove (ah)
Dior trench shit hang to the floor (ah)
Dior goggles, I ain't playin' with you hoes (uh-uh)
Out in South Beach with the poles in the Rolls (skrrt, boo-boo-boo-boo-boom)
Good to see ya dudes, alligators on the toes (ah)
(On the toes, on the toes, on the toes)
Fashion week, I'ma strut too, bitches (ah)
Hundred-round drum, make a nigga go get it (make a nigga go get it, grrt)
Tribe go to sell a fifth, bucket while we drillin' (boo-boo-boo-boo-boom)
Had to sneak my new Glock up in Lenox (ah)
Free Sly Green, he got Wayne Perry digits
Socks Burberry, dick sucks on the visit (ah, brrrt)
First one to pop, first to earn the stripes (stripes)
Three strikes in, 25 to life (uh-uh)
Hyping up the building, hyping up the sights (sights)
Whips got the wings of angel kit
I been wanting this shit my whole life, I didn't pray for it
She want me to come into his house, but I can't kick it
She want the whole dub-dub E, but I ain't convinced
Never met her she, but she met Sheck, she don't need a prince
Took her off the O into the D, she ain't take offense
Way we got it bouncin' off the boards we making prints
Wait until I step into the floor and then they commence",https://open.spotify.com/track/7EiUtdeoWcKqLi5ELZCjYf,163
