SongName,AlbumName,AlbumLink,Year,PlayCount,Lyrics,SongLink,Duration
WHERE WAS YOU,JACKBOYS 2,https://open.spotify.com/album/32lGAqeVkdJxEj2iv2Q01B,2025,41858957,"You should have-, you should've been there (yeah)
You should've been there, my nigga (right)
You should, you should've been there
'Cause if you who you say you, you are, then should've been there
(Wake up, F1LTHY)
♪
Ooh, I started from the bottom, huh, I stretched the note, uh
Put a chain on my buddy 'cause he never told, ooh
Switch up on my ho, drive Aventador
I been fuckin' this ho all week, she damn near gave me her code
Flexin', took a jet to Mexico
Stop textin' 'cause I'm not tryna check my phone
I'm in L.A., and I got ten hoes in a model home
Yeah, killin' all these hoes, they wanna eat my bone, huh
Yeah, killin' all these hoes, they wanna eat my bone, huh
Yeah, killin' all these hoes, they wanna eat my bone, huh
Cactus, Double-0, it's deeper than Air Force or Navy
All this brown and black around the bitch but nothin' shady
Can you spin for me, baby? Talkin' 'bout 180
Put her on a jet 'cause ain't no peace in that Mercedes
Shawty off the raw, in that game, she gon' have a ball
Fuck me good, you won't get a check, but you can meet the squad
Flight is booked, we gon' get in first, when we takin' off?
When you shoppin', they call you the mall 'cause you get 'em all
Where was you when we was on the floor and the rent was low?
Where was you when we was in the Mo and we had no more?
Where was you when I had to get low after shit got gold?
Got outta lock, went to Zona house, he was there for sure
18 meetings in New York when I didn't have the dough
Where was you when Dozie took it for me? He was there for sure
Where was you when I needed the hard drives when I met with Hov?
Ask Bizzy, that nigga was busy even on parole
But came through, put it on Greyhound like he designed the road
Phase two, ten years later, he put Rovers on the road
Phase two, his lil' bro done topped it, now he the big bro
Out the bottom, really out the mud, really out the cold
Ooh, I started from the bottom, huh, I stretched the note, uh
Put a chain on my buddy 'cause he never told, ooh
Switch up on my ho, drive Aventador
I been fuckin' this ho all week, she damn near gave me her code
Flexin', took a jet to Mexico
Stop textin' 'cause I'm not tryna check my phone
I'm in L.A., and I got ten hoes in a model home
Yeah, killin' all these hoes, they wanna eat my bone, huh
Yeah, killin' all these hoes, they wanna eat my bone, huh
Yeah, killin' all these hoes, they wanna eat my bone, huh
(Whoo, Pluto)
Bunch of rich niggas, ho chose up (whoa)
Flexin', space cadet, Jetson (yeah, yeah)
I swapped her and her sister, I don't miss it (whoa)
She lesbian, her best friend, they textin' (yeah)
I'll still fuck that ho if she catch me (whoa, whoa)
Baguetties, give shorty a wedding (yeah)
Finessin', long live Jugg King (whoa)
Started from the mud, started from the mud
Goin' to the club, I'ma make the money flood
Pourin' up the Tuss', pink lemon Crush
Drinkin' on the Texas, I done fell back in love
South of Francis (whoo), we go Monaco, on another planet (buh)
Fly her niece on a jet, we go Greece with the free
I got ten vibes with Trav, I got ten vibes with me
Ain't no regular car, this Bugatti a low-key
Party just like a rock star in the middle of the sea
Party like a rock star when we way overseas
Party like a rock star when we out in European
Ooh, I started from the bottom, huh, I stretched the note, uh
Put a chain on my buddy 'cause he never told, ooh
Switch up on my ho, drive Aventador
I been fuckin' this ho all week, she damn near gave me her code
Flexin', took a jet to Mexico
Stop textin' 'cause I'm not tryna check my phone
I'm in L.A., and I got ten hoes in a model home
Yeah, killin' all these hoes, they wanna eat my bone, huh
Yeah, killin' all these hoes, they wanna eat my bone, huh
Yeah, killin' all these hoes, they wanna eat my bone, huh",https://open.spotify.com/track/26N5kAVhlqFOWAkuMQ5Kwe,272
KICK OUT,JACKBOYS 2,https://open.spotify.com/album/32lGAqeVkdJxEj2iv2Q01B,2025,74599276,"Yeah, yeah, yeah (yeah)
JACKBOYS 2 (yeah)
Come up out that watch (yee)
Come up out that bracelet (yee, yee)
Don't buck, nigga (yee)
Gon' be ketchup all on the walls
Pussy
If this shit get complicated, you get kicked out
Like I ain't got no place to stay, yeah, I circ' out (yeah, I circ' out)
Ay, that red Malibu, Roberta packed it like a Shelby
Cuzzo ten, bustin' stains, swappin' stereos
I oblige, bumpin' Mary (bumpin' Mary)
Merry Christmas 'round this bitch, wasn't really merry (shit was scary)
Halloween, like, every day, more ordinary, okay
Platinum slugs and princess cuts for the tooth fairy, okay
Only time we seen results was watchin' Jerry (Jеrry, Jerry)
Only time I seen a lake was watchin' Ricki (on God), okay
Bronеm sleepin' with them sticks 'cause it get sticky (brr, brr, it get sticky)
We brought magic to the stu' 'cause it get tricky (I get tricky)
Had to violate the strip, yeah, come and get me (it's litty)
They done ran out of George, we throwin' Benjis (throwin' hunchos, it's lit)
All this sauce, I'm makin' cheese like Jon and Vinny's (21), cousin Vinny
All these gold flakes on my couch, I think I'm Lenny (the Roc)
Now we bus 'em to the lake, I think I'm Jenny (down the block)
Seen the wrist, turned to results from pushin' pennies (that's on Jacques)
Only book that's in my crib is the Guinness (straight up, straight up, not a lie)
How long can these records spin? 'Til infinity (on God)
Whoo, whoo, whoo, whoo (21, 21)
If this shit get complicated, you get kicked out (whoa, whoa, whoa, whoa, whoa, whoa)
Go, go, go
Like I ain't got no place to stay, yeah, I circ' out (go, go, whoa, whoa, whoa, whoa)
Whoa, whoa, yeah, yeah, yeah, yeah, go
Whoo, whoo, whoo, whoo
Whoo, whoo, whoo, whoo (on the)
Whoo, whoo, whoo, whoo (like a bouncer)
Whoo, whoo, whoo, whoo (like a)
Whoo, whoo, whoo, whoo (think I drowned it)
Whoo, whoo, whoo, whoo (bring it)
Whoo, whoo, whoo, whoo (make an announcement)
Whoo, whoo, whoo, whoo (yeah, she)
Fuck that bitch, leave that ho where I found her (I did)
Whole lot of paraphernalia on the counter (yeah)
Kickin' game, kickin' niggas out like a bouncer (yeah)
Caught him slippin', threw him in the water like a flounder (pussy)
All this water on my wrist, I think I drowned it (think I drowned it)
Out the country, yeah, I got the smoke, I'm bringin' ounces (bring it)
Got niggas that'll kill for me if I make an announcement (make an announcement)
High as a kite, she just popped a pill, yeah, she downed it (yeah)
Do what I like, she appeal to me 'cause how she bounce it (21, how she bounce)
Flew her out, turn her out, she was an out-of-towner (21)
Tan bitch, put her in the V, now she browner (now she brown)
Turn her up, now she turnt up off of downers
(Vybz Kartel)",https://open.spotify.com/track/5P03xImM2uFukzoty7NDw7,170
beibs in the trap,Birds In The Trap Sing McKnight,https://open.spotify.com/album/42WVQWuf1teDysXiOupIZt,2016,458190491,"That coca
♪
I just poured a 8 in a liter
Throw some jolly ranchers in make it sweeter
Versace my clothes I'm with a white hoe
And she snortin' three lines like Adidas
Got a black girl rolling off molly
Got a white bitch snortin' up snow
Say she want real niggas in the party
Parents gon' leave the keys to the condo
Bitch close the door, there's shit on your nose (That coca)
She said she want more, she said she want more
So I'ma get more
Yeah, I'ma get more
Bitch close the door, there's shit on your nose
She said she want more, she said she want more
So I'ma get more
Yeah I'ma get more
I just poured a 8 in a liter
With a white bitch sniffin' on Bieber
Are you sure you want to party with the demons?
Bitch, lookin' for a phone I ain't seen it
Told Frost bring the water no Fiji
Free Stix, I'm poured up and I'm leanin'
I got a couple pussy niggas in their feelings
'Cause their main bitch wanna come see me
She said she want more
Your girl is a hoe, you need to let go
She fucked all my bros, she's snortin' the snow (That coca)
Now she's touchin' her toes
She got Anna Nicole all in her nose
If they kick down the door, we gon' get locked for sure
She said she want more
Fuck it, I'ma get more (I'ma get more)
(I'ma get more, I'ma get more, I'ma get more)
Nightmare, high-life, sleepy, night-night (Yeah)
Flashes, spotlight, pull up, night guy
Help it, peace, peace, peace to–
Bite me, ride me, strike me, indict me
Snipe it, swipe it, rapper, trapper (yeah yeah)
I'm lit, light-nin', white bitch, she thick
Pulled out in the hood Toyota
Drove back to the hood Lambo
Crushed Xans, crushed Xans in my soda
Ridin' around the city with my eyes closed (Yeah, yeah)
Crazy Girls got it poppin', AOD got it poppin' (Yeah, yeah)
Tryna' text my accountant
Ain't no service in the mountains (Straight up)
Won't you come to the bottom? (Yeah)
Know you heard a lot about 'em (Yeah)
Heard they take that then they change like a mood ring
I watched them take that then they change like a mood ring
Pulled out in the hood Toyota
Drove back to the hood Lambo
Crushed Xans, crushed Xans in my soda
Ridin' around the city with my eyes closed
I just poured a 8 in a liter
Throw some Jolly Rancher in make it sweeter
Versace my clothes, I'm with a white hoe
And she snortin' three lines like Adidas
Got a black girl rollin' off molly
Got a white bitch snortin' up snow
Say she want real niggas in the party
Parents gonna leave the keys to the condo
Bitch close the door, there's shit on your nose (That coca)
She said she want more, she said she want more
So I'ma get more
Yeah, I'ma get more
Bitch close the door, there's shit on your nose
She said she want more, she said she want more
So I'ma get more
Yeah, I'ma get more
Ooh
Ooh
Ooh
Ooh
Ooh
Ooh
Ooh
Ooh-oh-oh",https://open.spotify.com/track/0ESJlaM8CE1jRWaNtwSNj8,213
Huncho Jack,"Huncho Jack, Jack Huncho",https://open.spotify.com/album/6FED8aeieEnUWwQqAO9zT1,2017,58070453,"M-M-M-Murda
Huncho farm (Huncho), got your bitch on porn (smash, smash)
Whip's too foreign (skrrt), iced my arm (ice, shine)
Cactus Jack (yeah), got plaques on plaques (yeah)
Hits on hits (yeah), in the mix
Huncho farm (Huncho), got your bitch on porn (yeah, smash)
Whip's too foreign (skrrt, skrrt), ice on arms (ice, ice)
Shit go bad, like it's L.A. traffic (yeah)
Crushin' down Addy (yeah), bustin' out plastic (yeah)
Huncho
Basic, basic, basic, basic, I can't fuck, she basic (no)
Keep my squad upgraded (Max), number one shooter like Tracy (shoot)
Tonka truck Mercedes (Tonka), drivin' and I'm faded (skrrt)
I'm on your block, invadin' (block)
All my guns updated
It's 5 a.m. lookin' like noon (yeah)
I took her right out of saloon (it's lit)
Put five in the back, I got room
Can't fit no more chicks, ain't got room (straight up)
Yeah, new crib, I'll put that on the moon
Upstairs and we blowin' up fumes (yeah)
Don't panic, can't have no more seizures
Fuck it, I'm cashin' my leisure
I had a lot of these (oh) targets and the foes (yeah)
Took it like I stole it (skrrt skrrt), it got old, shit moldy (ugh)
Money way high as your knees
No way I can fold it (yeah)
She thinkin' I'm golden (aie)
She suck my voltage (alright)
(Yeah)
Huncho farm (Huncho), got your bitch on porn (smash, smash)
Whip's too foreign (skrrt), iced my arm (ice, shine)
Cactus Jack (yeah), got plaques on plaques, yeah (alright)
Hits on hits (yeah, yeah), in the mix (it's lit)
Huncho farm (Huncho,) got your bitch on porn (yeah, smash)
Whip's too foreign (skrrt, skrrt), ice on arms (ice, ice)
Shit go bad (oh), like it's L.A. traffic (yeah)
Crushin' down Addy (eh yeah), bustin' out plastic (yeah)
(Huncho)
Flood my AP (AP)
Make these hoes wanna take me (take me)
The gun off safety (safety)
Shoot a fuck nigga like K.D., yeah (bow)
Shit brazy (brazy)
Made my left eye lazy, yeah
Goin' up lately, yeah
Dock in the back Old Navy, yeah (alright)
We gonna get it in (get it)
My trap house look innocent (innocent)
Private residence (private)
Leavin' no evidence (yeah, yeah)
Codeine, it's medicine, yeah
Somethin' is evident, yeah
They tease the hell with it, yeah
Was next, ain't no tellin' it (yeah)
Closet filled in designer (designer)
Take a knee like the 'Niners (Kaepernick)
Join the team, don't divide us (join them)
Then watch your money go higher
Yeah, lil' help, lil' guidance
Run it back, do the title
Get the sack, move in silence (yeah)
Bring that trophy back to my place
Huncho farm (Huncho), got your bitch on porn (smash, smash)
Whip's too foreign (skrrt), iced my arm (ice, shine)
Cactus Jack (yeah), got plaques on plaques, yeah (alright)
Hits on hits (yeah, yeah), in the mix (it's lit)
Huncho farm (Huncho), got your bitch on porn (yeah, smash)
Whip's too foreign (skrrt, skrrt), ice on arms (ice, ice)
Shit go bad (oh), like it's L.A. traffic (yeah)
Crushin' down Addy (yeah), bustin' out plastic (yeah)
Huncho, Jack",https://open.spotify.com/track/5vuiHi3QYbwcm1OKJOYnrf,199
Nightcrawler (feat. Swae Lee & Chief Keef),Rodeo,https://open.spotify.com/album/4PWBTB6NYSKQwfo79I3prg,2015,480323079,"Ooh, ooh, ooh
Ooh, ooh, ooh-ooh-ooh
Ooh-ooh-ooh, ooh, uh
♪
Did you have the time of your life?
Let's have the afterparty at my place
Ayy, do you have some spare change?
On me, I've got hundreds I'll throw in your face
Yeah, order more bottles, order more models
Order more hours, shots on an island
Hotter than the summer, the winter couldn't chill me
Young, free, and wildin', order more kidneys
Dope, I'm so dope
All these hunnies pilin' on the floor
And we stuntin', know you see the glow
Throw these hundreds, thought I'd let you know
Since LA, I've been puttin' on
Cirque du Soleil, goin' on and on
I got this money, tell me what you want
For this money, can you drop it low?
Yeah, order more bottles, order more models
Order more hours, shots on an island
Hotter than the summer, the winter couldn't chill me
Young, free, and wildin', order more kidneys
Mm, when the night calls, oh-oh-oh
When the night calls, oh-oh-oh
Yeah, order more bottles (order more bottles)
Order more models (order more models)
Order more hours (order more hours)
Shots on an island (shots on an island)
Hotter than the summer (hotter than the summer)
The winter couldn't chill me (the winter couldn't chill me)
Young, free, and wildin' (young, free, and wildin')
So order more kidneys (so order more kidneys)
Freaks come out at night
We bring our fantasy to life
Point me to the ice
And I don't need your drink, high off life
Uh, someone kill the lights
I brought the party favors, just get piped
All my bitches right
But I want you and you tonight
Yeah, order more bottles (order more bottles)
Order more models (order more models)
Order more hours (order more hours)
Shots on an island (shots on an island)
Hotter than the summer (hotter than the summer)
The winter couldn't chill me (the winter couldn't chill me)
Young, free, and wildin' (young, free, and wildin')
So order more kidneys (so order more kidneys)
When the night crawls
All the money, all the hoes, and the alcohol
All these hundreds and these thousands, I'ma spend it all
Always when the night calls
When the night calls
We want money, we want hoes, we want alcohol
All these hundreds, all these thousands, I'ma spend it all
Always when the night calls
Ayy, walked up in the bank (bank)
Ordered me some funds (beep)
Walked in the strip club
Order me some ones (gang)
I walked up in the gun store (huh?)
Ordered me some guns (bang-bang)
Your bitch walked up in the spot
And she ordered me for lunch (gang, gang)
I just ordered me some brunch (ayy)
Korean spicy garlic (ayy)
Bitch, I come from eating McDonald's (uh-huh)
Girl, you know I'm from the projects (ayy)
Like I'm a G, I come through mobbin'
Like Wu-T-A-N-G, we come through wildin'
I ain't chicken, Killer Caesar with the chopper (bang-bang)
Boy, you don't blow no poles, I know, I know (no, no, no)
I got me some angles
I got me some money, fuck, I got me some haters (ayy)
I got me some FedEx (ayy, ayy), I got me some cake
I got me some UPS, I got me a freight, ayy (gang, gang)
Order some more money (beep)
Order some more money (beep)
Order some more money (beep)
Order some more bottles (ayy)
Order some more bitches (ayy)
Order some more money (gang)
I know you wanna be rich, bitch (gang, gang)
When the night crawls
All the money, all the hoes, and the alcohol
All these hundreds and these thousands, I'ma spend it all
Always when the night calls
When the night calls
We want money, we want hoes, we want alcohol
All these hundreds, all these thousands, I'ma spend it all
Always when the night calls
When the night crawls
All the money, all the hoes, and the alcohol
All these hundreds and these thousands, I'ma spend it all
Always when the night calls
When the night calls
We want money, we want hoes, we want alcohol
All these hundreds, all these thousands, I'ma spend it all
Always when the night calls",https://open.spotify.com/track/3xby7fOyqmeON8jsnom0AT,321
Antidote,Rodeo,https://open.spotify.com/album/4PWBTB6NYSKQwfo79I3prg,2015,782018158,"Don't you open up that window
Don't you let out that antidote (yeah)
Poppin' pills is all we know (ooh)
In the hills is all we know (Hollywood)
Don't go through the front door (through the back)
It's lowkey at the night show (ooh)
So don't you open up that window (ooh)
Don't you let out that antidote, yeah
Party on a Sunday (that was fun)
Do it all again on Monday (one more time)
Spent the check on a weekend (oh my God)
I might do it all again (that's boss shit)
I just hit a three peat (ooh)
Fucked three hoes I met this week (Robert Horry)
I don't do no old hoes (oh, no, no)
My nigga, that's a no-no (straight up)
She just want the coco (cocaina)
I just want dinero (paper hunt)
Who that at the front door? (Who that is?)
If it's the feds, oh-no-no-no (don't let 'em in, shhh)
Don't you open up that window (yah)
Don't you let out that antidote (yah, ooh)
Poppin' pills is all we know (yah)
In the hills is all we know (Hollywood)
Don't go through the front door (in the back)
It's lowkey at the night show (ooh)
♪
Ayy, ooh, ooh
At the night show (ooh-ooh-ooh)
At the night show (higher)
At the night show (ooh-ooh-ooh)
Ooh, at the night show (get lit, my nigga)
Ooh, at the night show
Anything can happen at the night show (yah)
Everything can happen at the night show (ooh)
Ooh, at the night show
Anything can happen at the night show (ooh)
At the night show (ooh)
Your bitch not at home, she at the night show, ooh (straight up)
Fuckin' right, hoe (ooh)
Had to catch a flight for the night show (ooh)
Let's get piped though
Bottles got us right though, we ain't sippin' light though (syke)
I ain't got no type, though
Only got one night though, we can do it twice though
It's lit at the night show (ooh)
At the night show (ooh)
At the night show (ooh)
At the night show
At the night show
Everything can happen at the night show (ooh)
At the night show
Anything can happen at the night show (ooh)
Stackin' up day to day
Young nigga, you know you gotta go get it, go get it, my nigga
They hatin', they stinkin', they waitin'
Don't be mistaken, we dyin', they stayin'
Lord, I'm on fire they think that I'm Satan
Callin' me crazy on different occasions
Kickin' the cameraman off of my stages
'Cause I don't like how he snappin' my angles
I'm overboard and I'm over-impatient
Over my niggas and these kids my ages
Dealin' with Mo' shit that's more complicated
Like these two bitches that might be related
H-Town, you got one and you Bun B like a number one
It's late night, got a late show
If you wanna roll, I got a place where
Poppin' pills is all we know (ooh)
In the hills is all we know (Hollywood!)
Don't go through the front door (through the back)
It's lowkey at the night show (ooh)
So don't you open up that window (ooh)
Don't you let out that antidote",https://open.spotify.com/track/1wHZx0LgzFHyeIZkUydNXq,262
PARASAIL (feat. Yung Lean & Dave Chappelle),UTOPIA,https://open.spotify.com/album/18NOKLkZETa4sWwLMIm0UZ,2023,72284172,"I stand tall, I fall, I get up
I fall, I get up
I fall, and I get up
I stand tall, I stand tall
Ridin' parasail, rollin' through the grass
Shadin' out the trees
Lookin' through a glass
Watchin' by the bushes, waitin' on a breeze
You is all I need
Water movin' fast, washin' memories, tryna make it last
(Parasail)
Flyin' through the bush, we flyin' through the bush
Wave, we gon' rock, wave, we gon' take a swole
We gon' swole, we gon' rock clean
We gon' shake off the mother-mother-mother-mother live
We gon' live, we gon' rock show
We gon' pop, we gon' rock, I
♪
Success comes so easy for you (oh)
They're waiting behind the call
Ridin' parasail, rollin' through the grass
Shadin' out the trees
Lookin' through a glass
Watchin' by the bushes, waitin' on-
(Ooh-ooh-ooh)
I forgive myself, I forgive myself
I choose to feel good, I choose to feel free
I will fight for everything I love, forever
♪
And I will love everything that I fight for, forever
With me
Wonder what you wanna do
When you're not with me",https://open.spotify.com/track/2Q0aElTZQtEUsoiaQfizu6,154
MELTDOWN (feat. Drake),UTOPIA,https://open.spotify.com/album/18NOKLkZETa4sWwLMIm0UZ,2023,476538568,"Yeah, tensions is definitely risin'
T'd up right now
T time, T time
T time, T time, T time
Teatime like I got a cup of this shit
Tee time like golf at a quarter to six
I love to fuck on a regular bitch
Famous hoes lame, but they stay on my dick
Heard your new joint, it's embarrassin', shit
You talk to the cops on some therapist shit
You act like you love this American shit
But, really, the truth is you scared of the six
Yeah, you scared of the six, yeah, you scared of the six
Your bodyguard put in some work on a fluke
Now you wanna go and inherit that shit
Don't talk to the boy 'bout comparisons, shit
Or come to the boy on some arrogant shit
The weapons we got are some terrorist shit
Like TV producers we, grr, we airin' this shit
She askin' for bread for her parents and shit
I told her, ""I don't got no cash"" and she said she could wait on a rack, on some Arabic shit
I pull out a million and stare at the shit
My dick just got hard 'cause a wire just hit
My schedule is out, come spin us, for real
Man, fuck all that spinnin' the narrative shit
I melt down the chains that I bought from yo' boss
Give a fuck about all of that heritage shit
Since V not around, the members done hung up the Louis, they not even wearin' that shit
Don't come to the boy 'bout repairin' some shit
Don't come to the boy 'bout sparin' some shit
You lucky that Vogue was suin' 'cause I woulda been with the Wassas in Paris and shit
♪
Is you fuckin' crazy? Uh, is you fuckin' crazy? (Ah)
And they scared of the seven (seven)
After one-three, then we turn up 11 (yeah)
Keep this shit open like 7-Eleven (it's lit)
Me at the house, I got seven in heaven
They think I'm satanic, I keep me a reverend
Shawty a therapist (yeah), poppin' her shit
She inchin' my way then she started confessin'
I know what's at stake, I'm screamin', ""Free Jeffrey""
Connect collect calls right off of the celly
Gave her the blues, not talkin' 'bout belly
Don't keep it sincere, I go Makaveli
I got the juice, now it's heavy (juice)
Always on t-time, been ready (T, ah), yeah
Is you fuckin' crazy? Uh, is you f- (yeah, stoned, let's go)
Wrappin' the cheese, wrap around me 'cause I've got property (wrap, cheese, wrap)
Chocolate AP and chocolate the Vs (Vs), got the Willy Wonka factory (Vs)
Burn an athlete like it's calories (frrt), find another flame hot as me, bitch (ooh)
♪
Yeah, is you fuckin' crazy? (Nah) is you fuckin' crazy? (What?)
Is you fuckin' crazy? (Nah, nah) is you fuckin' crazy? Yeah
Is you fuckin' crazy, or what? Is you fuckin', is you fuckin'
Is you fuckin' crazy?
How many Texas boys done ran it up? A couple, maybe (couple, maybe)
Swangin' in the pickup truck, baby, fuck Mercedes (fuck Mercedes)
I'll fuck a nigga bitch, but she can't have the baby (have the baby)
I'll shoot your ass in Walmart like I'm DaBaby (in Walmart)
The boy goin' Lionel Messi, I go Tom Brady (woo)
Used to wear the bust down back in my old days (wow)
Now I let the chains hang, you gotta tuck yours, maybe (tuck it, tuck it)
Niggas talkin' Scarface, I'm that in real life
Is you fuckin' crazy, or what? Is you fuckin' crazy? (Fuckin' crazy)
Man, the club ain't been the same since we lost Mercedes (straight up)
Man, the clique ain't been the same since they lost the greatest (nah, nah, nah)
We outside with the army, so you need the (uh-huh)
Them boys rollin' all brown like they whippin' gravy
Make a circus outside like it's Barnum's Bailey (it's lit)
Blickey hangin' on my side, it's like it's really hangin' (blickey, blickey, blaow)
She move her panties to the side, she want it raw when faded (huh, huh, huh, huh?)
Is you fuckin' crazy? Is you fuckin' crazy? Uh
Is you fuckin' crazy, or what? Is you fuckin' crazy? Yeah
Is you fuckin' crazy, or what? Is you fuckin', is you fuckin'
Is you fuckin' crazy?",https://open.spotify.com/track/67nepsnrcZkowTxMWigSbb,246
