SongName,AlbumName,AlbumLink,Year,PlayCount,Lyrics,SongLink,Duration
"I Will (feat. KXNG Crooked, Royce Da 5'9"" & Joell Ortiz)",Music To Be Murdered By - Side B (Deluxe Edition),https://open.spotify.com/album/3MKvhQoFSrR2PrxXXBHe9B,2020,67179069,"And I don't think that I can stop it (here it comes)
I do my best to try to block it (redrum)
I've been sipping on like, vodka (head's numb)
I'm blacking out, you better watch it (it's bedlam)
I thought I heard a voice in my head that said, kill
I had no other choice that was left except fill
My pencil full of poisonous lead, the devil
He wants me to murder this beat, so I will
He told me there are doubters who question my skill
They wanna put my style to the test, am I still
The best? They want the crown on my head, I said, Chill
If you want me to murder this beat, then I will
I'm a long way away from where you are in skill
Foreign wheels, my bitch wearin' four-inch heels
She on the orange pill
And she about to start taking off layers like orange peels
Sacha Baron Cohen, Farrell, where am I going with this?
Oh yeah, a bar at will
And when you throw the iron in it, I'm all that still
The truth for real, I'm real true, call that trill
This is my house, this place is mine
Posted on any corner on any coast I'm on
You niggas need to leave that lean, Henny, and coke alone
Terror to the business, married to the strippers, T-Pain
Student of the game pre-Kane, you niggas Post Malone
Elite beat boxer minus the raps
Rollin' with at least three choppers, Ryan is that
I literally keep three shotters
I'm lyrically James Todd, Tariq Trotter minus the cap
I thought I heard a voice in my head that said, kill
I had no other choice that was left except fill
My pencil full of poisonous lead, the devil
He wants me to murder this beat, so I will
He told me there are doubters who question my skill
They wanna put my style to the test, am I still
The best? They want the crown on my head, I said, chill
If you want me to murder this beat, then I will
Yeah, I slaughter goons under the moonlight
John Wilkes, that's who I'm in the booth like
Abra-, I go ham for dead presidents
And everything I record is over your head like a boom mic
Why would you irrelevant fucks want to rebel against us
Knowing your Smith & Wesson has never been clutched?
Knowing you never been rushed by the most ignorant niggas invented
Them niggas gotta send you to the
Dentist to get a whole row of elephant tusks
Your teeth gone like you been on some meth and dust forever
I see you, my niggas call me the enemy watcher
The minute we spot ya, the semi'll pop, nigga, we got ya
I'm livin' to conquer, remember the mantra, I'm grippin' the launcher
Like Em and the Dr., with no guilty conscience
I'm still shockin' like droppin' a boombox in bathwater
More shockin' than a pissed off Blanka
I just finished fuckin' a fish called Wanda
I'm finna wander off into yonder
Beyond just mentally stronger, memory monster
I remember the sponsorin' thought that conquered his triple entendre
You the cross of a unicorn and The Unabomber
Quit horsin' around in this building or you a goner
Your Willy Wonka persona won't help you any longer
I'm Optimus, I make prime examples of mini-Tonkas
Hogtie your squad and go bonkers
Spin, grab Denaun's guitar and Honky Tonk ya
Oh, your boss on par like good golfers?
I put a hole in one of you birdies with this Eagle and launch it (pew)
I thought I heard a voice in my head that said, kill
I had no other choice that was left except fill
My pencil full of poisonous lead, the devil
He wants me to murder this beat, so I will
He told me there are doubters who question my skill
They wanna put my style to the test, am I still
The best? They want the crown on my head, I said, chill
If you want me to murder this beat, then I will
Now this will probably be the illest most shit that I've ever said
God bless the dead and let Biggie possess the pencil lead
They called me a sped and said that I had a messed up head
'Cause I said motherfuck school and instead went to special ed
Sippin' Bacardi and lime I start to recollect on the time
That I startled my mom and had her scared to death
Word to Method Man
She heard some Wu-Tang coming from towards the patio
She was like, what the heck was that?
She went to check on the noise and go inspect the deck
Then I jumped out with a sword and yelled, protect your neck
Now bow to the Lord, hold up, no, better yet, kneel
Better yet, get down on all fours and take a vow to always
Rejoice in the sound of my voice, bitch, you don't have a choice
Just a third of my will will overpower yours
Using about a fourth to create the amount of force
It'll take to knock out a horse like a tranq' full of Tylen-, or
Enter my house of whores with a thousand floors
Got a crown of thorns, but it won't fit around the horns
But I'ma keep it a buck like a dollar store
I'm more than you bargained for and I am far more worse
Than a fourty-some bar Lord Jamal verse
Nothing means more than respect, so when I curse
You could say I swore to protect
My image, I have zero time or regard for
A never was, been claiming rap when it's not yours
If it was anyone's house G Rap and
Rakim would be havin' you mop floors
Run-DMC would be havin' you cleanin' sinks
Yeah, your group was off the chain, but you were the weakest link
Rest of these youngins of mine
Time to start throwing some shade, this time I'm shutting the blinds
'Cause when I'm looking at y'all, shit, it's no wonder it's why
I need a visor, 'cause y'all are just suns in my eyes
Born a cynic and more demented than
An orphanage with a morgue up in it
Next door to an abortion clinic
Newborn infants tortured and tormented
With their foreheads dented when they drop 'cause the floor's cemented
Their corpses get ornamented
The coroner with a storage bin rented
To store them in, and the torsos of forty women reported missin'
Distorted, twisted, this isn't no storybook ending
This is only the beginning
So Lord forgive me, I'm hearing voices
I can't ignore them anymore, they're winning
I thought I heard a voice in my head that said, kill
I had no other choice that was left except fill
My pencil full of poisonous lead, the devil
He wants me to murder this beat, so I will
He told me there are doubters who question my skill
They wanna put my style to the test, am I still
The best? They want the crown on my head, I said, chill
If you want me to murder this beat, then I will
And I don't think that I can stop it (here it comes)
I do my best to try to block it (redrum)
I've been sipping on like, vodka (head's numb)
I'm blacking out, you better watch it (it's bedlam)",https://open.spotify.com/track/7pEDNYd1Lf4xudWGrtVH8b,303
"Jimmy, Brian and Mike",The Eminem Show (Expanded Edition),https://open.spotify.com/album/6EzbFdrwvWpnpUjzrR57aU,2022,12849165,"Yeah, woo, yeah
That's the idea, man
The fuckin' Red Wings are playin'
Ayy, the fuckin' Red Wings are playin', man
Fuck, shut up, man, you're gonna fuckin' make me miss the game
It goes, one, two, three, four
Rush room, C4
Need more bleach, breathe more (yo, I said)
Reach for ether, either or (either one)
Markers, paint, inhale, faint
Yeah, heh, heh, smells great, heh (whoa)
Acid, you don't got that? Just melt plastic
That's it, now let it smoke and smell that shit
I can't see shit, you're foggin' up the room
Gimme that shit, bitch, you're hoggin' the balloon (hey)
I might just suck nitrous all night long
If I just die, Mike, just call my mom (9-1-1)
Greg can drink a whole keg through a funnel
Put his foot through it and crawl in it like a tunnel
From the 3-1-3 to the 8-1-0
Hey, Brian, you ain't coverin' the rush hole
You're not doin' it right, pay attention
Who the fuck taught you to smoke, Bill Clinton?
C'mon, inhale, puff, pass, puff, pass, okay, that's enough, damn
Tom, that's my mom's lamp, goddamn, dude, fuckin' calm down (sorry)
Look at you guys, you're makin' a mess, where's Jason?
""Dude, I'm in the basement with Jeff
He just dropped a bunch of weights on his chest
Help me get 'em off,"" wait, you're breakin' his neck (Alright)
You grab that end, dick, I'll grab this end
I told him not to lift when he sniffs, he don't listen
Get me drunk, let me go and get me high tonight
Jimmy, don't, Jimmy don't let me die tonight
Get me home, Jimmy, don't let me drive tonight
I just wanna get blown with Brian and Mike
Get me drunk, let me go and get me high tonight
Jimmy, don't, Jimmy don't let me die tonight
Get me home, Jimmy, don't let me drive tonight
I just wanna get blown with Brian and Mike
(Chicka) Ronnie, Bobby, Ricky and Mike (chicka)
Ronnie, Bobby, Ricky and Mike (ch-)
Ronnie, Bobby, Ricky and Mike (chicka)
Ronnie, Bobby, Ricky and Mike
I spilled beer on the carpet but the walls are drunk, you asshole
I ain't leanin' on 'em, I'm holdin' 'em up
Shit, tonight, man, I ain't holdin' 'em up
I'm openin' up shop to the cops and closin' it shut
19 shots might seem like a lot, but it's not
I ain't even buzzin', man, I swear to God (brrrr)
Tom, stop, you're gonna scare the dog
He's gonna bark and Mr. Johnson's gonna come downstairs, and, ugh
""Hey, I want some peace and quiet here
Or I'ma send the goddamn police in riot gear""
Shut up Mr. Johnson, don't even start
Go have another fuckin' heart attack, you old fart
I hate that guy, Brian, that's the hamper
What's the matter, you can't go to the damn bathroom?
""Sorry, I had to shit, dude, where's the tissue?""
I dunno, just use this XXL issue
Look at this house, who put this couch crooked?
Ow, stupid, you just stepped on my foot, now look it
It looks like I just stepped in a mud puddle, you fuckin' dick (I'm sorry)
Shut up, butthole, you prolly did it on purpose, you fuckin' drunk bastard
Here, take your keys, go boozin' up, grab shit
I hate you guys, you ain't my friends
Look what you just did to my mom's eight by tens
Now she's gonna blame me, I hope you're happy now
Party's over, everybody get your asses out
Out, I said out, put the beer down, out
Get me drunk, let me go and get me high tonight
Jimmy, don't, Jimmy don't let me die tonight
Get me home, Jimmy, don't let me drive tonight
I just wanna get blown with Brian and Mike
Get me drunk, let me go and get me high tonight
Jimmy, don't, Jimmy don't let me die tonight
Get me home, Jimmy, don't let me drive tonight
I just wanna get blown with Brian and Mike
(Chicka) Ronnie, Bobby, Ricky and Mike (chicka)
Ronnie, Bobby, Ricky and Mike (ch-chicka)
Ronnie, Bobby, Ricky and Mike
Ronnie, Bobby, Ricky and Mike",https://open.spotify.com/track/7wtDXxRShBmxJAeXzE4H3p,201
River (feat. Ed Sheeran),Curtain Call 2,https://open.spotify.com/album/3aTuW4BtsyyyyQa9LKqj8n,2022,917313105,"I've been a liar, been a thief
Been a lover, been a cheat
All my sins need holy water
Feel it washing over me
Well, little one, I don't want to admit to something
If all it's gonna cause is pain
Truth in my lies, right now, we're falling like the rain
So let the river run
He's comin' home with his neck scratched, to catch flack
Sweat jackets and dress slacks, mismatched
On his breath's Jack, he's a sex addict
And she just wants to exact revenge and get back
It's a chess match, she's on his back like a jetpack
She's kept track of all his internet chats
And guess who just happens to be movin' on to the next
Actually, just shit on my last chick and she has what my ex lacks
'Cause she loves danger, psychopath
And you don't fuck with no man's girl, even I know that
But she's devised some plan to stab him in the back
Knife-in-hand, says their relationship's hangin' by a strand
So she's been on the web lately, says maybe she'll be my Gwen Stacy
To spite her man, and I know she's using me to try to play him
I don't care, ""Hi, Suzanne,"" but I should've said ""Bye, Suzanne""
After the first night, but tonight I am
I've been a liar, been a thief
Been a lover, been a cheat
All my sins need holy water
Feel it washing over me
Well, little one, I don't want to admit to something
If all it's gonna cause is pain
The truth in my lies, now we're falling like the rain
So let the river run
One-night stand turned to two-night stand
It was, ""Come sunlight, scram,"" now we hug tight, and
He found out, now she feels deserted and used
'Cause he left, so what? He did it first to her too
Now how am I supposed to tell this girl that we're through?
It's hard to find the words, I'm aloof, nervous, and Sue
Don't want this to hurt, but what you deserve is the truth
Don't take it personal, I just can't say this in person to you
So I revert to the studio like hole-in-the-wall diners
Don't have to be reserved in a booth
I just feel like the person who I'm turning into's irreversible
I preyed on you like it's church at the pew
And now that I got you, I don't want you
Took advantage of my thirst to pursue
Why do I do this dirt that I do?
Get on my soapbox and preach, my sermon and speech
Detergent and bleach is burnin' the wound
'Cause now with her in the womb
We can't bring her in this world, should've knew
To use protection 'fore I bit into your forbidden fruit, fuck!
I've been a liar, been a thief
Been a lover, been a cheat
All my sins need holy water
Feel it washing over me
Well, little one, I don't want to admit to something
If all it's gonna cause is pain
The truth in my lies now are falling like the rain
So let the river run
My name's (oh), my name's (oh)
River (oh), watch, river run
Call me (oh), call me (oh)
River (oh, we'll let the river run)
Always the bridesmaid, never the bride, hey
Fuck can I say? If life was a highway
And deceit was an enclave
I'd be swerving in five lanes
Speeds at a high rate, like I'm slidin' on ice, maybe
That's why I may have came at you sideways
I can't keep my lies straight, but I made you terminate my baby
This love triangle left us in a wreck, tangled
What else can I say? It was fun for a while
Bet I really would've loved your smile
Didn't really wanna abort, but fuck it
What's one more lie to tell our unborn child?
I've been a liar, been a thief
Been a lover, been a cheat
All my sins need holy water
Feel it washing over me
Well, little one (I'm sorry), I don't want to admit to something (I fucked up)
If all it's gonna cause is pain
The truth in my lies now are falling like the rain
So let the river run",https://open.spotify.com/track/1wBSLonFSIZvySNhXOjPKm,223
Alfred - Outro,Music To Be Murdered By - Side B (Deluxe Edition),https://open.spotify.com/album/3MKvhQoFSrR2PrxXXBHe9B,2020,30758836,"This concludes our danse macabre
Portions of the proceeding were recorded
As for the rest of it
I'm very much afraid it was all in your mind
I don't intend to indulge in any post-mortem
If you haven't been murdered, I can only say
Better luck next time
If you have been
Goodnight, wherever you are",https://open.spotify.com/track/0UtAEonU5MhbGljzcaa5Kx,39
Unaccommodating (feat. Young M.A),Music To Be Murdered By - Side B (Deluxe Edition),https://open.spotify.com/album/3MKvhQoFSrR2PrxXXBHe9B,2020,142224810,"Oh, this what we doin'? Alright
M.A
I like a bitch that like to wobble, wobble
Shake it, shake it, break it, break it
Nigga, we made it, made it, they hate it, hate it
Pro professional, pure persistent, I'm paper chasing
I hate complaining, I hated waiting, I'll pay for patience
But I hate to pay a bill (hate that)
And I made a mill' without a major deal (I made that)
Yeah, her ass fake, but she came for real (she came, uh)
Money ain't a thing, that ain't a thing for real
It's the broke lingo (huh)
And no, ain't nothing Saweetie, this is no Quavo (Migo)
Man, I just get high, let my hoes lay low (ooh)
I just want some face but this is no facial (ooh)
Do right and kill er'body, Drake mode (hello)
Bitch, I'm tryna eat out, take your plate mode (hello)
Disrespect your life and I'm in gang mode (grrr)
You can leave this earth, bitch, I'm in rake mode (huh)
I'm in cake mode (huh), I'm in brave mode, uh
What up Marshall? I'm a martian, I'm in Wayne mode (facts)
Neck wet, big drip, I'm in rain mode (drip, drip, drip)
Eight niggas, eight hittas, take eight souls (brrr)
Collect pesos (huh), and I'm paid, so? (Paid)
Self-made goals (hey)
When the pain leaves (huh)
Where does the pain go? (Where?)
Tip of the backwood is where the flame goes (there)
To the sky is where my brain goes (wow)
Same pack, same fiend, sellin' the same clothes (wow)
Pinocchio and my pistol, they got the same nose
Me and my niggas gotta eat, we share the same stove (what?)
Case closed, bodies in my lane, bitch, lane closed
Game over, Thanos on you H-O's
On my petty shit but I don't paint toes (yeah)
Get the plunger (plunger) 'cause Marshall and M.A go plum crazy
Call us liquid plumber, 'cause even Dre know (Dre know)
Beat knocks like a beefed up Detox, you're gonna need three SWATs
A police officer's at least cuffing me up for evading and I don't stop
Please dawg, I need y'all to keep talking shit 'cause I feed off of it
I am the complete opposite of these retards who spit these weak bars
I'ma leave carnage
Each thought'll be so toxic, it'll block the wind through your esophagus
Stop it, cutting off your oxygen
And I hit them pads like a boxing gym
Better watch for Slim, better get to popping when I'm at the top again
I won't topple and I'm giving it to anyone who wanna come and get it
And I'm not gonna stop
But when they ask me is the war finished with MGK? Of course it is
I cleansed him of his mortal sins, I'm God
And the Lord forgives even the devil worshipers
I'm moving on but you know your scruples are gone
When you're born with Lucifer's horns
And you're from the school of Notorious, Puba, Cube
And The Poor Righteous Teachers tutored my students
Showed them all the blueprint and formula
But it seems like the more they studied my music
The more they remind me of eyeballs
I'm watching my pupils get cornier (uh)
But I'm contemplating yelling ""Bombs away"" on the game
Like I'm outside of an Ariana Grande concert waiting
They call me Saddam Hussein, Ayatollah Khomeini
Where's Osama been? I been laden lately
Look at how I'm behaving, they want me gone away
They wanna JonBenét me (fuck you), I'm unaccommodating
Man, I don't see why they hate me
I'm a clown like John Wayne Gacy
They call me Kanye crazy
APESHIT, Beyonce', Jay-Z
And I'm back with Andre, baby
And the doctor's operating
But he never put no scrubs on from Snoop kid out to Shady
Shady like a shadow or your silhouette, intellect
I better check to see why you feel upset
'Cause I met your bitch on the internet
Now I'm getting head like a Pillow Pet
That bimbo Kim put her lips all the way around this bone and then blow
Like a dusty cartridge from an old Nintendo
Those were the days but I bet you, I'm never gonna be broke again, no
I don't smoke but I got paper, to be blunt, I'm rolling Indo
And I keep it one comma, zero, zero, zero, zero
Real, real, real, murder, murder, murder, kill, kill, kill
Nickle-plated, twenty two, two, two
Bitch, shut the fuck up 'fore I shoot you too
Ain't shit I won't do just to get a few YouTube views
Run up in a church like pew, pew, pew
'Cause that's what I do, do, do
But, even to the untrained human eye
We ain't the same, you and I
Somebody should have explained to you why
For you to go against me, it's simply insane, you will die (yeah)
That's why they call me Kamikaze, it's plain suicide, yeah
But I know magic and here go my last trick
I'm 'bout to say abracadabra and pull a B Rabbit up out of my hat
I'm about to relapse and I betcha that you won't know how to react
But a look of disgust, I don't doubt it'd be that
As I begin to fuckin' devour the track
And you backpedal that as a cowardly act
Like a Saudi attack when the towers collapse
They call me Saddam Hussein, Ayatollah Khomeini
Where's Osama been? I been laden lately
Look at how I'm behaving me, they want me gone away
They wanna JonBenét me (fuck you), I'm unaccommodating",https://open.spotify.com/track/6U6XkwUEXvKT5hHSSLKxRn,216
Never Love Again,Music To Be Murdered By - Side B (Deluxe Edition),https://open.spotify.com/album/3MKvhQoFSrR2PrxXXBHe9B,2020,123226939,"I could be with anybody, I choose you
Still, it's no excuse to abuse you
But no one knows what I'm goin' through, so I used you
To be truthful, I wouldn't know what to do if I lose you
So I refuse to, might have a screw loose and a fuse blew
But I think I might be buildin' up a tolerance to you
'Cause one minute I'm hollerin', ""Screw you""
Next I take it back, guess you can say I'm tryna unscrew you
But the shit's about to pop off, yeah, I feel you up
Then I got you totally open as soon as I take your top off
You're so hard to resist, you knock my socks off
My friends say you're bad for me, hogwash
I'll never love again
The way I loved you
Did you find someone new?
Are you doin' this with them?
'Cause I remember when
Still remember when you was mine, yeah
We were inseparable at one time, yeah
You know my love for you was undying, yeah
You used to always have my back
Some days it feels like you're all that I have
That's why I'm tryna hold onto you for as long as I can
And you just want me for my money, so I got you wrapped all in Saran
Damn, talk about eatin' out the palm of my hand
But if not for my financials
I wouldn't have you anyways, there have been ample
Plenty days, where I'm just in a daze and I can't pull
Myself up out this rut, and you're so much of a handful
I can only take so much of you all at one time
Because too much of you's just too much to swallow sometimes
Gotta take you in doses, but when you're not at my side
I shake in convulsions
Separation anxiety 'cause we may be the closest
Yeah, baby, we hopeless, don't we make an atrocious
Combination? We know, it's like playin' with explosives
Quite dangerous though, but my brain's in hypnosis
Such a wide range of emotions
Migraines, but why the fuck am I takin' these Motrins?
Ibuprofens, like a drop of rain in the ocean
And you're my fix on the days when I'm broken
But the shit's about to go sideways, I just know it
I'll never love again
The way I loved you
Did you find someone new?
Are you doin' this with them?
'Cause I remember when
Still remember when you was mine, yeah
We were inseparable at one time, yeah
You know my love for you was undying, yeah
You used to always have my back
So I spiral downwardly 'cause I'm too cowardly to leave you
Head is clouded in a fallacy, but in reality
Somehow it seems like when I lay me down to sleep, I'm countin' sheep
You're bound to creak
'Cause every time I turn around, you keep runnin' out on me
You're my Xanax and my Valium, I'm an addict, you're a downer
You're my habit, it's like I found you in the cabinet
But it's like I can't uncap it 'cause it's childproof
A scoundrel and fiends how I feel around you
Awful, every time I lost you, felt like I had you in my pocket
Now I'm flippin' over the furniture
Punchin' holes in the walls through
Everything that we've gone through
How many times you've fucked me?
But the way it felt for me to be on top when I was on you
Swore my fealty, but word to G-O-D
I thought you loved me, bitch you tried to kill me, I'm getting off you
Quit callin' for me, hard proof's how I respond to
The Ambien and Tylenols too
Fuck all you
(Fuckin' bitch)
(We're done)",https://open.spotify.com/track/6M0R8YHdrWpVkCtwIsWOJn,177
