SongName,AlbumName,AlbumLink,Year,PlayCount,Lyrics,SongLink,Duration
Bitch Please II,The Marshall Mathers LP (25th Anniversary),https://open.spotify.com/album/2DQ6hHlAGj6DiT0Y068bnK,2025,328359429,No Lyrics,https://open.spotify.com/track/7rwrQ5OuCbEiL3gAjqInGF,288
Habits,The Death of Slim Shady (Coup De Grâce),https://open.spotify.com/album/3kjHLu1pL7tdY88GFwEkl6,2024,80738987,"Been waiting a long time for this shit (ah)
Long time no see (ah)
Thought you got rid of my ass, huh? (Let me go, you sick fuck)
Alright, here's what we're gonna do (piece of shit)
You take this (no)
Or I put a bullet between your fucking eyes (I don't wanna)
Here (fuck, no) then we'll split it (no)
Half an Ativan, I'm drivin' straight at a van
In a black Sedan, fast as I can
In Pakistan gettin' chased by a pack of Stans
You know how I roll, bitch (what?) I'm an avalanche
This my shit, I'm gonna spit it how I wanna spit it
Whoever gets offended, suck a dick and fuck a critic
'Bout to get retarded on this motherfuckin' shit, it
""You can't say retarded,"" shut up, midget (the fuck?)
And I've been tryna break the habit of sayin' any R words
But I'm still an addict, so it's getting harder (ah)
Been callin' bitches ""hoes"" since a kindergartner
This is Jimmy Carter, now I'm kitty-cornered (what?)
Sittin' in PC court with a shitty lawyer (shit), like damn
You got an addiction, man
I know you can't get rid of me forever 'cause you know that I'm prescription, man
Goddamn, I miss you, Slim (whoo)
You got an addiction, man
I know you can't get rid of me forever 'cause you know that I'm prescription, man
Next time, I'll be in your vein (yeah)
Was just a kid from Detroit who knew how to destroy the booth
And had a point to prove (yeah), and I'm missin' (what?)
Venomous, still I poison youth, sentences (yeah)
I'm pennin' are just to toy with you
Which is a joy to do, Slim is just (what?)
A lyricist here to voice his true sentiments (yeah), got the women pissed
And it seems like men are just (what?) off growing a huge clitoris (pussies)
Yeah, I probably annoyed a few feminists
I reminisce on them blowing a fuse over my points of views
Still I'm devoid of two shits to give (yeah)
My thinkin' is primitive
But when it comes to givin' it to anybody, boy, is Bruce generous (marshall)
And I'm 'bout as much of boy as Bruce Jenner is (damn)
'Cause I'm not a boy, I'm a man, bitch, man-bitch (ha-ha)
My speech is free as his choice to choose gender is (man)
This shit is like opioid abuse, isn't it? (Yup)
You got an addiction, man
I know you can't get rid of me forever 'cause you know that I'm prescription, man
Goddamn, I miss you, Slim (whoo, uh)
You got an addiction, man
I know you can't get rid of me forever 'cause you know that I'm prescription, man
Next time, I'll be in your veins
There's times when I lay down to sleep, I argue with myself
Am I the only one who thinks it's weird? Do I need help?
Just a little bit, no, a lot of it, I really, really gotta quit
Something's wrong with me, my God, old habits die hard
Look at you
What's the matter with you people?
You're sad that people are mean?
Well, I'm sorry, the world isn't one big liberal arts college campus
F- you, you're all pricks
Mom shaming, dad shaming (ah), yeah
Fat shaming (what?) Man-splaining, blah (pfft)
Cry babies attack Shady, wah
Mad 'cause they can't tame me (get it)
Here come the censors (look out), like the Avengers
And they assemble like Prince and then turn
A word like ""ginger"" into the N-word
All these pronouns (ah) I can't remember (damn)
They or them, theirs? (Who?) His or him, hers? (Ah)
Into them girls who bought tits to get attention
Then get hit on by ugly men who are (creep)
Not in your league, so you pretend you're a victim
And me-too 'em (ah), outraged, how fake? (What?)
Nowadays, some gals, they (what?) just clout-chase (yeah)
Look at me with sour grapes and your brow raised
Bitch, you ain't about head (what?) About face (whoo)
Little white, middle-age, upper-middle-class
With a glass of wine and your cigarette
Bitch, get off the internet (yeah), you ain't even fed your kids dinner yet (still)
Parental discretion, mental aggression, my head's a Smith & Wesson
You're messin' with a lethal weapon, like an evil stepdad
I got an infrared like the ginger stepkid who pissed the bed
I do this shit in jest and it's just a messin' up with your head
And if men wanna wear lipstick and women's underwear
Who cares? Their shit is their business, now bear witness
Beware, bitches, the Blair Witch on you scared bitches
I'm surreptitious (what?) on square business
Just attacked my therapist with a pair of scissors like ""Merry Christmas""
Dressed as a Hare Krishna, terrorist with a hair trigger (whoo)
But with these buttons I'm always pushing (yeah), pain I'm always inflicting (what?)
Protestors outside the Shady offices livid (yeah)
It'll make you think that you had the game on lock 'til they pick it (trick it)
Only way for me to explain it is I'm conflicted (what?)
Walkin' on eggshells, like if I take it too far, is this it? (Yeah)
Part of me gets it and wants to say I'm sorry and fix it (I'm so-)
So all my statements are basically contradictive (what?)
Like using the F-word for gay is wrong and offensive (what?)
And insensitive as if me sayin' the R-word isn't (wait)
Wait a minute, which R-word? Rape or retarded, midget? (Not cool, guys)
Would this rhyme be okay if South Park had did it? (Okay, screw you guys)
Would it make you less angry if Cartman spit it? (Goddammit)
And as far as what I just stated, regarding midgets
You'll probably think I'll just say that I'm playin', I'm not, I meant it (yeah)
Swear to God I see one of them little fuckers come at me
I'll pick it up by its legs and drop it and kick it
""Marshall, you're wicked, face it, you are addicted"" (I know)
But they gon' do me the same as DaBaby with all of this shit (why?)
Chappelle and Colin, they're callin' Shady misogynistic
While raisin' three daughters, two graduated from college with honor
Summa cum laude, my sense of humor is probably twisted
It's painfully obvious-tic
You got an addiction, man
I know you can't get rid of me forever 'cause you know that I'm prescription, man
Goddamn, I miss you Slim (whoo, hey)
You got an addiction, man
I know you can't get rid of me forever 'cause you know that I'm prescription, man
Next time, I'll be in your veins (haha)
I'm just playin', little people, you know I love you",https://open.spotify.com/track/7I3RalBqE7ZE0RSxgGlGlm,298
Survival,The Marshall Mathers LP2 (Expanded Edition),https://open.spotify.com/album/5EUgcfO5OWxnniHR3QYFcK,2023,278203996,"This is survival of the fittest
This is do or die
This is the winner takes it all
So take it all, a-all, a-all, a-all
Wasn't ready to be no millionaire, I was ill-prepared
I was prepared to be ill though, the skill was there
From the beginning, it wasn't 'bout the ends
It was 'bout busting raps and standing for something, fuckin' acronym
Cut the fucking act like you're happy, I'm fucking back again
With another anthem, why stop when it doesn't have to end?
It ain't over 'til I say it's over, enough when I say enough
Throw me to them wolves and close the gate up
I'm afraid of what'll happen to them wolves, when the thought
Of being thrown into an alligator pit, I salivate at it, wait is up
Hands up like it's 12 noon, nah homie, hold them bitches straighter up
Wave 'em 'til you dislocate a rotator cuff, came up rough
Came to ruffle feathers, nah, egos, I ain't deflate enough
Last chance to make this whole stadium erupt
'Cause this is survival of the fittest
This is do or die
This is the winner takes it all
So take it all, a-all, a-all, a-all
I can see the finish line with each line that I finish
I'm so close to my goals, I can almost pole vault over the goal post
And if I don't got enough in the tank, maybe I can just siphon enough
To fill up this last can, man will I survive in this climate or what?
They said I was washed up and got a blood bath
I'm not a rapper, I'm an adapter, I can adjust
Plus, I can just walk up to a mic and just bust
So, floor's open if you'd like to discuss
Top 5 in this mothafucka and if I don't make the cut, what?
Like I give a fuck but I light this bitch up like I'm driving a truck
Through the side of a pump, 0 to 60 hop in and gun it
Like G-Unit without the hyphen, I'm hyping 'em up
And if there should ever come a time where my life's in a rut
And I look like I might just give up, eh, might've mistook
Me for bowing out I ain't taking a bow, I'm stabbing myself
With a fucking knife in the gut, while I'm wiping my butt
'Cause I just shitted on the mic and I like getting cut
I get excited at the sight of my blood, you're in a fight with a nut
'Cause I'mma fight 'til I die or win, biting the dust, it'll just make me angrier
Wait, let me remind you of what got me this far, picture me quitting
Now draw a circle around it and put a line through it, slut
It's survival of what?
This is survival of the fittest
This is do or die
This is the winner takes it all
So take it all, a-all, a-all, a-all
So take it all, a-all, a-all, a-all
♪
So get your ideas, stack your ammo
But don't come unless you come to battle, now mount up, jump in the saddle
This is it, it's what you eat, sleep, piss and shit
Live, breathe, your whole existence just consists of this
Refuse to quit, fuse is lit, can't defuse the wick
If I don't do this music shit, I'll lose my shit
Ain't got shit to lose, it's the moment of truth
It's all I know how to do as soon as I get thrown in a booth, I spit
But my respect is overdue, I'm showing you the flow no one do
'Cause I don't own no diploma for school, I quit
So there's nothing for me to fall back on, I know no other trade
So you'd better trade your fucking mics in for some tool-box-es
'Cause you'll never take my pride from me, it'll have to be pried from me
So pull out your pliers and your screwdrivers
But I want you to doubt me, I don't want you to buh-lieve
Cause this is something that I must use to succeed
And if you don't like me then fuck you
Self-esteem must be fucking shooting through the-roof cause trust me
My skin is too thick and bullet proof to touch me
I can see why the fuck I disgust you
I must be allergic to failure, 'cause everytime I come close to it
I just sneeze but I just go atchoo then A-chieve
This is survival of the fittest
This is do or die
♪
This is the winner takes it all
So take it all, a-all, a-all, a-all
So take it all, a-all, a-all, a-all",https://open.spotify.com/track/5GEehBTspT5vfv3cGDoaDi,272
Guilty Conscience 2,The Death of Slim Shady (Coup De Grâce): Expanded Mourner’s Edition,https://open.spotify.com/album/31hcgCSu4mlA82syOFItur,2024,44158714,"Welp, we did it now
I know, right?
It's beautiful, ain't it?
Yeah, you happy now, bitch?
Yep
Alright, you got what you wanted
Yeah, what?
Let me go
Ha, never
Why does it feel like I'm always being tortured?
The bad apple spoils the whole orchard
Used to read comic books to learn more words
'Cause deep down, I'm a dork, just a core nerd
Meaning nerd to the core 'til I'm cornered
Then I'm the coroner
What shot is this? First, second, it's your third
Vision is more blurred, speech is more slurred
Can't even form words
It's like a dream up inside of a dream I'm trapped in
It's worse than I could've imagined, it's madness
Can't wake up, try my damnedest
But old habits are coming back
And now transgenders attack us frontwards and backwards
They laughin', throw midgets at us (ha)
This ain't no dream now, huh?
See what I mean now?
You see how they tryna make me out to be
Some kind of mean vile obscene, foul prick?
I kick one freestyle 'bout beating down a special
Needs child and these people freak out (Timmy)
Told you we'd get slaughtered for sayin', ""Retarded""
Aw, Marshall's gaining a conscience (fuck you)
This may come as a shock or have you astonished, regardless
Here's the thing 'bout retarded people (what?)
They don't fucking know they're retarded
Well, okay, you wanna fat shame
Bitch, two can play that game (what?)
You wanna judge people? (Yeah)
Matter of fact
Ain't you the same one who hated bullies calling you bad names? (Yep)
Then you turned around and did the exact same (so?)
Just immature and literally, you're still mentally 13
And still thirsty for some controversy
You still picking on Christopher Reeves
Yeah, but you're me and we're a team
So that means, we're in cahoots
That's conspiracy to commit murder lyrically
So clearly, you're the accessory like jewelry
You ain't the judge or the jury, you're just as guilty
You rip on paraplegics, man, seriously?
Oh, bitch, it's a joke
No, it's not, it's embarrassing (what?)
Like David Carradine found with a pair of jeans
At his ankles and belt 'round his larynx
I know, it's a scary scene
They're coming with everything
Little people are trolling me (ha)
They saying they've had it (what?) Up to here with me
Oh, hilarity (come on)
Nah, do your thing
Fuck deaf people, yeah
Well, between me and you
I think they've had it up to here with me too (what the fuck?)
Sorry, I'm not perfect as you, Marshall
Punching down on little people (yeah)
Not cool (whoops)
You just sound like a dick
Wait, nah, fool (what?)
When I say, ""Fuck midgets,"" I mean Ja Rule (oh)
And I know that Chris Reeves song was recorded in 2004 for Encore (yeah)
Fuck'd you take it off for?
'Cause he die
Man, that motherfucker did that bullshit on purpose to ruin the song for us (man)
Man, I never seen a bigger pussy than you
Bitch, look at all the shit the media's puttin' me through (what?)
'Cause of all the fuck shit that you pushed me to do (me?)
Should've knew when I found you
You were just too good to be true (hmm)
That's how we end up in these quagmires
You said you had my back, liar
But I helped you get your stacks higher (yeah)
That's diamond sales like sapphires
Rap buyers, admires pack lines of admirers
Now they say you lack ire
That's why your satire backfires (yeah)
Flat tires, no longer that guy you were prior to this
Yeah, and I scare you 'cause (why?)
I'm who you used to be (who?)
The you who didn't crumble under the scrutiny (wait, what?)
When it was you and me (yeah)
I gave you power to use me as an excuse to be evil (I know)
You created me to say everything
You didn't have the balls to say (yep)
What you were thinking but in a more diabolic way
You fed me pills and a bottle of alcohol a day (okay)
Made me too strong for you and lost control of me (you're right)
I took over you totally
You were socially awkward 'til you molded me (yeah)
You was a loner, a nobody
'Cause of me, you didn't take shit from nobody
Now look at you (what?)
Now you just a punk (man), little scaredy-cat (word)
Got you shook like Shakira's ass (yeah)
To look at your reflection staring back
Bitch (uh-huh), it's just a mirror, relax
Man, you're so full of shit, you need MiraLAX
Open your mouth and shit flies out, just lies
You thinkin' you can rip my ass, undo these zipties
You can just undo my feet and keep my hands tied
'Cause like an avalanche, I'd still win by a landside
Oh, you think so, bitch? Yeah, I know so
Okay, your hands and feet, I let 'em both go
Yeah, fuck now, ho, give me that gun, no, don't
Rear naked choke hold, let me go, yo
Here, take it, bozo (yeah)
Queer bait, you homo (you ready?)
No, don't shoot (here we go)
Bro, no, no
Now say you're sorry and you didn't mean any of it
I'm sorry Marshall's a pussy
He's Dre and Jimmy's puppet (what?)
Sorry he gives a fuck, but pretends he doesn't
God, you piece of shit, that does it (uh-oh, wait)
Yeah, bitch, this is for him (what?)
Christopher, MGK, Nick, and for Limp Bizkit and them
Midgets and Ben' (man, please) 'Zino, in addition to him
Will Smith and to Canibus, if you're listening
This is the end (okay, okay, I'll stop)
So to Jamar and Ja Rule and to all my feuds including ma (what?)
I'm welcoming you to my (no, no)
Last hoorah, I bid you goodbye (come on, man, don't do this)
Murder suicide killshot, booyaka, cocksucker
Coup de grâce, motherfucker
Oh, whoa, what the fuck?
Come on, come on, come on, come on
♪
Yeah?
Paul
You're not gonna fucking believe this, bro
I had this dream, it was fucking crazy
It was like, the old me came back and the new me
And took over my brain and had me saying all this fucked up shit
About little people and Caitlyn Jenner and
PC police were chasing me
And fucking Gen Z was tryna kill me
And quadriplegics and Christopher Reeves
And I was saying all this fucked up shit
And I couldn't stop saying it
And then I wake, and it was like I was still dreaming
Fuck you
Wait",https://open.spotify.com/track/1rDFHwb60YvuSfaCSp0Q4p,325
Temporary,The Death of Slim Shady (Coup De Grâce),https://open.spotify.com/album/3kjHLu1pL7tdY88GFwEkl6,2024,51686465,"A lot of people ask me, am I afraid of death?
The truth is, I think what scares me the most
Is not being able to say all the things I wanna say to you
When I'm no longer here
So this song is for Hailie, for when that day comes
Where's Hailie? Where is she at?
This ain't Hailie
Who is it?
It's a monster
I've been waiting all night for the sunrise
To take away the dark sky
(You're the dad monster)
(And them are the baby monsters, and I'm the mom monster) (oh)
All it takes is a new day sometimes
To get me in a better state of mind
(Give me a kiss, monster, give me a kiss)
(Love you) (I love you)
If I could just fall asleep
I'd be lost in a dream
But right now, it's misery
And I just have to remember
That when a heart breaks, it ain't broken forever
The pieces will grow back together
And in time, I'll be fine
The tears are temporary
Yeah, so Hailie Jade, I wrote you this song
To help you cope with life now that I'm gone
How should I start? Just wanna say
Look after Alaina, Stevie, and Uncle Nate
And, sweetie, be strong, I know I was your rock
And I still am, saying goodbye is just not
Ever easy, but why you crying? Just stop
Hailie, baby, dry your eye, this is not forever
That when a heart breaks, it ain't broken forever
The pieces will grow back together
And in time, I'll be fine
The tears are temporary
Daddy (ooh)
What? (Ooh)
When I used to have this when I was a little kid (ooh)
Baby, are you okay? (Ooh)
Yeah, and you will get over me and move on
You can play me on repeat on a song
But don't you dare shed a tear, what I tell you?
""Straighten up, little soldier,"" them times when I held you
Jade, it'll be okay, baby, I'm here, hey
I'm watchin' you right now, baby girl, I vow
I will protect you, your guardian angel
As hard as this may feel, us parting is painful
And, darling, the rain will, drive you insane still
You will remain strong, Hailie, just hang on
It won't be too long, I need you to move on
And remember, it will get better
'Cause time heals and when a-
When a heart breaks, it ain't broken forever
The pieces will grow back together
And in time, I'll be fine
The tears are temporary
The bad days will start to get better
And we'll be laughin' together
And tonight, when I cry
The tears are temporary
I know this big girl (ooh)
And she's really pretty (ooh)
You know what her name is?
Hailie (ooh)
Hailie, how did you know? (Ooh)
'Cause-
Yeah, and if there's days where you
Wanna just lock yourself in your room and cry
Just think of how when you were little, how you and I
Back and forth to the studio, we used to drive
You strapped in the back seat, 'cause you were my
Little sidekick, yeah, sweetie, I know this hurts
Bean, I'm wishing your pain away
Remember this, Hailie Jade
There's gonna be rainy days
I promise you'll get through 'em and make it regardless
Fuck it, Jade, I'll be honest
I knew that you was gonna take this the hardest
Sweetie, get up, I know that this is breaking your heart
It's the hardest thing I've ever wrote (Daddy)
Hailie, sweetheart, it's okay for you to let me go
Baby, I promise you that when a-
That when a heart breaks, it ain't broken forever
The pieces will grow back together
And in time, I'll be fine
The tears are temporary
The bad days will start to get better
And we'll be laughin' together
And tonight when I cry
The tears are temporary
What's your favorite song? (Ooh)
My favorite song right now (ooh)
Mine and your favorite song
Mine and your favorite song? (Yeah, on the radio) (ooh)
I like this part
That's your favorite part, dad (ooh)
You're taping me, bitch
I got you on tape cussin'
Can you hear?
Yup
No, bitch
No, what?
No, I said, I said, ""No, bitch""
Okay, no cussin'",https://open.spotify.com/track/6uMGHQvhZq8YyT4kdnG1L3,297
Road Rage,The Death of Slim Shady (Coup De Grâce),https://open.spotify.com/album/3kjHLu1pL7tdY88GFwEkl6,2024,34827010,"This rap shit divided by panty lines
Mm, which side are you on? (Pussy)
Social media got you fuckin' in pantomime
Damn, why that line so long? (Rookie)
I'm just caught up in the rapture, tryna be a rap star
I hope I make it out alive (alive)
I'm a master at masquerading and actin'
Like I ain't faded, only I can see through my disguise
I walk around more confused than my aunt Linda's man-friend
A black transgender Klan member who's a Caitlyn Jenner fan and a (what?)
Member of Grindr and Tinder
Head empty as an abandoned a– (yeah)
'Partment while I'm dancing a–
'Round all these names and labels that I can't memo– (what the fuck?)
'Rize, now my antennas are up on this PC shit, I'm finna
Go out on my shield like Captain A– (what?)
'Merica, transcender
I'm the god of façade (woo), give me a road rage reason
To black the fuck out and roll with the heathens
Road rage, vroom, vroom, vroom, and I'm speedin'
Fuck that red light, I'm tryna get even
Yeah, how could I say some shit so mean? (Damn)
They're tryna make my mouth closed like it's clothing (what?)
It's what it is though, but this is show biz, so things
Ain't never really truly over 'til Lizzo sings (like I won't say that)
We should coddle fat people (yeah), yeah
Here's a concept (what?), let's celebrate onset (yeah)
Diabetes and instead of us dieting, we can just have a pie-eating contest (delicious)
And we should be extra nice (what?) instead of honest (yeah)
And instead of exercise (what?), it's easier to find a triple-X your size
And try to press society to change so you don't have to change
Pick up a way to eat less, them fries make your blood pressure rise
As it starts increasin' all that starch and grease and clogged arteries and
These are the reasons for your heart disease and
Can't tie your shoes (why?), it's too hard to reach 'em (shit)
But the way things been (with what?) with today's thinking (yeah)
We should baby them (why?) instead of shaming them (oh)
But enabling can (yeah) do more harm than good, so call me Abe Lincoln
'Cause I'll be honest, I can flip in a blink and all I need is one little road rage reason
Yeah, blah, blah, blah, I'm the
I'm the god of façade, give me a road rage reason
To black the fuck out and roll with the heathens
Road rage, vroom, vroom, vroom, and I'm speedin'
Fuck that red light, I'm tryna get even
Yeah, all my obese people if you're fat, proud, and you know it (hey)
Raise your hand if you're shovin' food in your mouth at this moment (mmm)
But if you're mad 'cause they're clownin' you for poundin' them donuts (what?)
Put 'em down and either do somethin' about it or own it
Okay, here we go
Wait, what are you doin'?
Fuck's it look like I'm doin'? (What? Nah)
Dyin' our hair
No, stop, stop, ow
Shut the fuck up
You're never gonna–
I said, shut the fuck up
Trust me, I know what I'm doin'
Yeah, transgender rights, where do I stand? Oh (uh)
I'm all for 'em, I really am pro (nah, for real)
Intercourse with you (what?), would I have? No (nope)
I'm just bein' honest (yeah), now I'm an asshole (ho)
Call me a transphobe (really? Yeah) 'cause I just can't go (what?)
And try and pretend you was never a man though (sorry)
I mean, damn, bro (yeah), it's just the way I feel (uh)
But if I say it will (mm), it get me cancelled (yup, shit)
My music get banned (what?), or can it withstand? (No)
This shit is quicksand (help), man, I'm just sayin' (ha)
I gotta participate for us to co-exist?
I gotta memorize pronouns of a cis man? (Really?)
How come can't we just show solidarity with a wristband? (Or somethin' like that, you know?)
And this ain't even a diss, trans
People, my dick just won't expand
Them tits won't make it stand
But Caitlyn, big fan (no, wait)
Oh, you want me to fuckin' chill and tone this shit down, huh? (Yup)
That's Shady speaking his mind like it was his mouth, huh?
You wish he'd grow up and not be so juvenile, huh?
Cash Money Records, this shit's about to go south, huh?
You feelin' stupid now, huh?
Old Slim would've told 'em to put a lid on it like a toilet bowl rim
Hat with the low brim
I'm in the blue corner (what?), white trunks with the gold trim
They bet that I won't win (yup)
Guess you really showed them (ha)
Became the best and I made it (yeah) like Adult Swim
Yeah, but you pick on handicapped people with no limbs
Well then, fuck you, Chris Reeves, and the horse that he rode in
Bitch",https://open.spotify.com/track/0bBnrokPXtfwXQarqCu1Gz,217
