SongName,AlbumName,AlbumLink,Year,PlayCount,Lyrics,SongLink,Duration
The Monster,The Marshall Mathers LP2 (Expanded Edition),https://open.spotify.com/album/5EUgcfO5OWxnniHR3QYFcK,2023,1294828308,"I'm friends with the monster that's under my bed
Get along with the voices inside of my head
You're trying to save me, stop holding your breath
And you think I'm crazy, yeah, you think I'm crazy
I wanted the fame, but not the cover of Newsweek
Oh well, guess beggars can't be choosey
Wanted to receive attention for my music
Wanted to be left alone in public, excuse me
Been wanting my cake and eat it too, and wanting it both ways
Fame made me a balloon 'cause my ego inflated
When I blew, see, but it was confusing
'Cause all I wanted to do is be the Bruce Lee of loose leaf
Abused ink, used it as a tool when I blew steam
Ooh, hit the lottery, ooh-wee
But with what I gave up to get was bittersweet
It was like winning a used mink
Ironic 'cause I think I'm getting so huge I need a shrink
I'm beginning to lose sleep, one sheep, two sheep
Going cuckoo and kooky as Kool Keith
But I'm actually weirder than you think, 'cause I'm
I'm friends with the monster that's under my bed
Get along with the voices inside of my head
You're trying to save me, stop holding your breath
And you think I'm crazy, yeah, you think I'm crazy
Well, that's nothing
♪
Well, that's nothing
♪
Now I ain't much of a poet
But I know somebody once told me to seize the moment
And don't squander it
'Cause you never know when it all could be over tomorrow
So I keep conjuring
Sometimes I wonder where these thoughts spawn from
(Yeah, ponderin' will do you wonders)
(No wonder you're losing your mind, the way it wanders)
Yodel-ay-hee-hoo! I think it went wanderin' off down yonder
And stumbled onto Jeff VanVonderen
'Cause I need an interventionist to intervene between me and this monster
And save me from myself and all this conflict
'Cause the very thing that I love is killing me and I can't conquer it
My OCD is conking me in the head
Keep knocking, nobody's home, I'm sleepwalking
I'm just relaying what the voice of my head saying
Don't shoot the messenger, I'm just friends with the
I'm friends with the monster that's under my bed
Get along with the voices inside of my head
You're trying to save me, stop holding your breath
And you think I'm crazy, yeah, you think I'm crazy
Well, that's nothing
♪
Well, that's nothing
♪
Call me crazy, but I had this vision
One day that I'll walk amongst you a regular civilian
But until then drums get killed and I'm coming straight at MCs
Blood gets spilled and I take it back to the days that I get on a Dre track
Give every kid who got played that pumped up feelin'
And shit to say back to the kids who played 'em
I ain't here to save the fucking children
But if one kid out of a hundred million
Who are going through a struggle, feels and relates, that's great!
It's payback, Russell Wilson falling way back in the draft
Turn nothing into something, still can make that
Straw in the gold, chump, I will spin
Rumpelstiltskin in a hay stack
Maybe I need a straightjacket
Face facts, I am nuts for real, but I'm okay with that
It's nothing, I'm still friends with the
I'm friends with the monster that's under my bed
Get along with the voices inside of my head
You're trying to save me, stop holding your breath
And you think I'm crazy, yeah, you think I'm crazy
I'm friends with the monster that's under my bed
(Get along with) get along with the voices inside of my head
(You're tryin' to) you're trying to save me, stop holding your breath
(And you think) and you think I'm crazy, yeah, you think I'm crazy
Well, that's nothing
♪
Well, that's nothing",https://open.spotify.com/track/00bLSnliElWSOs1Ybt9dZm,250
So Much Better,The Marshall Mathers LP2 (Expanded Edition),https://open.spotify.com/album/5EUgcfO5OWxnniHR3QYFcK,2023,62300387,"You fucking groupie, pick up the goddamn phone
Bitch, where the fuck were you Tuesday? With who you say?
I wasn't at the studio bitch, what'd you do screw Dre?
You went there looking for me? Ooh, that excuse is too lame
Keep playing me you're gonna end up with a huge goose egg
You fake, lying slut you never told me you knew Drake
And Lupe? You want to lose two legs?
You try to flip this on me? If I spent more time with you
You say ""Okay, yeah, I'm cuckoo, hey?"" Well, screw you
And I'd be the third person who screwed you today
Oh, four? Dre, Drake, Lupe? Oh touché
You were too two-faced for me
Thought you was my number one, true blue ace but you ain't
And I can see you and you make that little boo-boo face
'Cause I'm hanging up this phone boo, you make my fucking Bluetooth ache
You feeling blue too late, go smurf yourself
You make me wanna smurfin' puke blue Kool Aid
Here's what you say to someone you hate
My life would be so much better
If you just dropped dead
I was laying in bed last night thinking
And this thought just popped in my head
And I thought, wouldn't shit just be a lot easier
If you dropped dead? I would feel so much better
Think I just relapsed, this bitch pushed me over the brink
Hop on the freeway trying to get some time alone and just think
Then the cops pulled me over but they let me go
'Cause I told 'em I'm only driving drunk, 'cause that bitch drove me to drink
I'm back on my fuck hoes, but a whole new hatred for blondes
But bias? I hate all bitches the same, baby come on
Excuse the pun but bitch is such a broad statement
And I am channeling my anger through every single station it's on
'Cause a woman broke my he-art, I say he-art
'Cause you ripped it in two pa-arts, and threw it in the garbage
Who do you think you are, bitch? Guess it's time for me
To get the dust off and pick myself up off the carpet
But I'll never say the L-word again, I L-L-L-L... Lesbian!
Ahh, I hope you hear this song and go into a cardiac arrest
My life would be so much better if you just
My life would be so much better
If you just dropped dead
I was laying in bed last night thinking
And this thought just popped in my head
And I thought, wouldn't shit just be a lot easier
If you dropped dead? I would feel so much better
'Cause you told me, you love me, forever, bitch, that was a lie
Now I never, wanted someone, to die, so bad in my fucking life
But fuck it, there's other fish in the sea
And I'mma have a whale of a time
Being a single sailor for the night, bitch on a scale of, 1 to 10
Shit, I must be the holy grail of, catches
Ho, I got an Oscar attached to my fucking name, de la
I might hit the club, find a chick that's tailor made for me
Say fuck it kick some shots back, get hammered and nail her
These bitches tryna get attached but they're failing to latch onto the tail
Of my bumper to scratch them with the back of my trailer
Like I'm itchin' to get hitched, yeah, I'm rich as a bitch
But bitches ain't shit, I'd rather leave a bitch in a ditch
Bitch you complain when you listen to this
But you still throw yourself at me, that's what I call pitchin' a bitch
That's why I'm swinging at this chicks on sight
Long as I got a bat and two balls it's foul, but my dick's on strike
So all that love shit is null and void, bitch I'm a droid
I avoid Cupid stupid wasn't for blowjobs you'd be unemployed
Oi-oi-oi, man oh man, you boy-boy-boy's getting sick of these girls-girls-girls
Oink-oink-oink, you fucking pigs, all you're good for is doink-doink-doink
I got 99 problems and a bitch ain't one
She's all 99 of 'em I need a machine gun
I take 'em all out I hope you hear this song and go into a cardiac arrest
Have a heart attack and just drop dead
And I'ma throw a fucking party after this, 'cause yes
My life will be so much better
If you just dropped dead (I hate you)
I was laying in bed last night thinking
And this thought just popped in my head
And I thought, wouldn't shit just be a lot easier
If you dropped dead? I would feel so much better
I'm just playing bitch, you know I love you",https://open.spotify.com/track/7ATSAXVEBlryu2EKOAo0Nh,261
Breaking News - skit,The Death of Slim Shady (Coup De Grâce),https://open.spotify.com/album/3kjHLu1pL7tdY88GFwEkl6,2024,23955620,"A'ight, now I'm 'bout to show you somethin' (what?)
(Shh, watch) now to breaking news, and it turns on this week in music
Detroit rapper Eminem, in a stunning move, has released an album (what? Shh)
In which he is actually trying to cancel himself (man, what the fuck?)
And right now, at this hour, we got protestors lining the streets downtown
Where Kimberly Gill is standing by, KG
Hi, Devin, we are outside Eminem's Mom's Spaghetti (man, this some bullshit)
Where, as you can see behind me
People are definitely upset over Eminem's new album
And are actually calling to boycott the rapper (haha)
For songs that include insensitive comments about little people
People with mental disabilities, transgender rights and the first amendment (hahahaha, haha)",https://open.spotify.com/track/0TDXeyH0hdiz0SZQo5w1nm,37
Somebody Save Me,The Death of Slim Shady (Coup De Grâce): Expanded Mourner’s Edition,https://open.spotify.com/album/31hcgCSu4mlA82syOFItur,2024,138506447,"Daddy? (Huh?)
Food's here (kept buyin' it when she gets it)
Come eat (Alaina, I'm so tired)
Just come eat (Alaina, I'll be there in a minute, I promise, stop)
Well then wake up (shut that door)
Somebody save me, me from myself
I've spent so long livin' in hell
Another pill as I start to spiral
Message to my daughters
I don't even deserve the father title
Hailie, I'm so sorry
I know I wasn't there for your first guitar recital
Didn't walk you down the aisle
Missed the birth of your first child
Your first podcast, lookin' down, sweetie
I'm so proud of how you turned out
Sorry that I chose drugs and put 'em above you
Sorry that I didn't love you enough to
Give 'em up, how the fuck do I not love you
More than a pill? Lookin' up to the ceilin'
From this floor, wonder will
Somebody save me, me from myself
I've spent so long livin' in hell
They say my lifestyle is bad for my health
It's the only thing that seems to help
Alaina, sorry that you had to hear me fall in the bathroom
Sorry that I missed you gradu- wait, Nate, I should just congratulate you
On being a dad to Carter and Liam, look at you
Little bro, sorry I left you, sorry that I'll never get to
Hold or hug my little nephews, Stevie, I'm sorry, I missed you
Grow up, and I didn't get to be the dad I wanted to be to you
Things I wanted to see you do, this is my song from me to you
Sorry, I gave up but I'm just so defeated
God, what the fuck do you want me to do?
Somebody save me, me from myself
I've spent so long livin' in hell
They say my lifestyle is bad for my health
It's the only thing that seems to help
I've been starin' at that video of Hailie
Almost daily of her playin' a guitar
In hopes maybe that'd give me the power to fight
But the addict in me's a coward
He told me that I can't do it, had a second chance, blew it
It's like I'm stuck inside an alternate reality, but I know (what?)
I'll turn it around and be able to
Walk her and Lainie one day
To the altar as proud as can be
Right now, I'm just weak
As I fall further down in this deep hole
And farther in the ground that I sink
As they lower me in my coffin
I feel the tears all fallin' down on my cheek
I'm a lost cause, baby, don't waste your time on me
I'm so damaged beyond repair, life has shattered my hopes and my dreams
I'm a lost cause, baby, don't waste your time on me
I'm so damaged beyond repair, life has shattered my hopes and my dream",https://open.spotify.com/track/4AVmC14ZG1nAKFIG67Jgyb,230
Evil,The Death of Slim Shady (Coup De Grâce): Expanded Mourner’s Edition,https://open.spotify.com/album/31hcgCSu4mlA82syOFItur,2024,57470001,"Woke up with an attitude today
Not in the mood to play (nah)
Might start a feud with Dre (yeah)
And ask him to shoot the fade (what it do?)
All I do is spray, spew the hate while I fuel the flames
Who to blame for my screwed-up brain?
You could say, in the booth, I'm A-human A-to-the-K (aww)
(Hailie, look) look at them two little beautiful (yeah)
Pewter-gray poodles, how cute are they? (The fuck?)
Well, looks like them pooches are screwed today (I'm)
Stuck in my ruthless ways (yep), and I refuse to change (yep)
Nothin' to lose or gain (nope), guess I just choose to stay
Evil (yeah), I'm so evil
Rotten to the core, a fuckin' twisted cerebral
I'm so evil, so evil
It's obvious that I'm not like other people
'Cause I'm evil, I'm so evil
Rotten to the core, a fuckin' twisted cerebral
I'm so evil, so evil
It's obvious that I am not like other people (yeah)
My medicines cabinet's big enough to fit a cab in it
Tablets, I spit like half of this capsule
It's travelin' like a javelin
Through my abdomen, my stomach's unravelin'
Might end up havin'
Slim say some shit you feel fucked up for laughin' at, yeah
And I'm phenomenal at it (what?), and that's problematic (what?)
But if y'all fanatics (huh?), maybe I'm your habit (yeah)
And I got all the dope (what?), so, send me all them addicts (get 'em all)
And watch me shoot 'em up (pew-pew) like semi-automatics (come on)
Slim snaps like a chin-strap
Had my share of lows, yeah, now I'm the exact (what?)
Opposite, just like a prostitute when she's gettin' smacked (now)
Pimp slaps, only way I'm hittin' my bottom, bitch (yeah, take 'em back)
I was five when they tried to say I stuck a live grenade
Up inside a microwave, I behave like a child, ay
Even when stakes are high as the price of Angus, I filet
By the way, I think I just gave Skylar Grey hepatitis A (ew)
But when it's sink-or-swim, I just say, ""It's not me, it's him"" (sorry)
There's a demon who's deep within
All I need is MD, or weed, or Henny, or Jim Beam, or Remy, or Seagram's Gin
Just to get underneath your skin, I would like you to meet my twin
Evil, I'm so evil
Rotten to the core, a fuckin' twisted cerebral
I'm so evil, so evil
It's obvious that I'm not like other people
'Cause I'm evil, I'm so evil
Rotten to the core, a fuckin' twisted cerebral
I'm so evil, so evil
It's obvious that I am not like other people (look it up, yeah)
Holy shit, Cait' Jenner just flipped (yo)
Told me knock this shit off and quit, and get off her dick (damn)
And I've had a bad day, I just slapped Dre
Do not tell me what I can't say (why?) That's gay (what's wrong with that?)
And not the good kind of gay either (what?)
Where two men fuck each other and hate beaver (whoa)
What the fuck? Wait, we've established I'm straight, see, the (no)
Way they try to make me the devil, the atheist (oh)
Shit can get a lot worse, these are my first thoughts
Johnny Walker, this is my third shot (yeah)
And I don't stop 'til the shots heard, pops for blocks
Got the Mossberg cocked (what?)
Couple choppers, two Glocks, a 2Pac shirt, doctors, and boxers dropped
Lookin' awkward as I walk into Oxford (stop, the fuck?)
So much ammunition, I sweat lead
And just bought you a new bedspread for your deathbed (ha)
And I just got it made like Special-Ed said
Word to Redman, I'm a meth-head
Used to get fed pet meds by my redneck stepdad
'Til I beat his ass to death with a cassette deck (ah)
So much bloodshed that when he bled from his head gash (yeah)
It's kinda like I'm a bookworm (huh?)
'Cause I ain't stoppin' 'til everything gets read
Call this sex-ed with a splash of necrophilia (what?)
'Cause when I say that I'm really the evilest
I'm fuckin' deadass (I'm fuckin' deadass, haha)
Maybe what I need now more than likely's a psych eval'
Mama, how do you like me now? (Huh?)
Are you proud of me yet, Debbie? (Huh?)
I done turned my whole life around
But I think I'm just like you now because I turned out so fuckin'
Evil, I'm so evil
Rotten to the core, a fuckin' twisted cerebral
I'm so evil, so evil
It's obvious that I am not like other people
'Cause I'm evil, I'm so evil
Rotten to the core, a fuckin' twisted cerebral
I'm so evil, so evil
It's obvious that I am not like other people",https://open.spotify.com/track/3egjuPVUzezaaKSu21wDIb,230
Rap God,The Marshall Mathers LP2 (Expanded Edition),https://open.spotify.com/album/5EUgcfO5OWxnniHR3QYFcK,2023,1235360100,"Look, I was gonna go easy on you not to hurt your feelings
But I'm only going to get this one chance (six minutes-, six minutes-)
Something's wrong, I can feel it (six minutes, Slim Shady, you're on!)
Just a feeling I've got, like something's about to happen, but I don't know what
If that means what I think it means, we're in trouble, big trouble
And if he is as bananas as you say, I'm not taking any chances
You are just what the doc ordered
I'm beginnin' to feel like a Rap God, Rap God
All my people from the front to the back nod, back nod
Now, who thinks their arms are long enough to slap box, slap box?
They said I rap like a robot, so call me Rap-bot
But for me to rap like a computer, it must be in my genes
I got a laptop in my back pocket
My pen'll go off when I half-cock it
Got a fat knot from that rap profit
Made a livin' and a killin' off it
Ever since Bill Clinton was still in office
With Monica Lewinsky feelin' on his nutsack
I'm an MC still as honest
But as rude and as indecent as all hell
Syllables, skill-a-holic (kill 'em all with)
This flippity dippity-hippity hip-hop
You don't really wanna get into a pissin' match
With this rappity brat, packin' a MAC in the back of the Ac'
Backpack rap crap, yap-yap, yackety-yack
And at the exact same time, I attempt these lyrical acrobat stunts while I'm practicin' that
I'll still be able to break a motherfuckin' table
Over the back of a couple of faggots and crack it in half
Only realized it was ironic, I was signed to Aftermath after the fact
How could I not blow? All I do is drop F-bombs
Feel my wrath of attack
Rappers are havin' a rough time period, here's a maxi pad
It's actually disastrously bad for the wack
While I'm masterfully constructing this masterpièce
'Cause I'm beginnin' to feel like a Rap God, Rap God
All my people from the front to the back nod, back nod
Now, who thinks their arms are long enough to slap box, slap box?
Let me show you maintainin' this shit ain't that hard, that hard
Everybody want the key and the secret to rap immortality like Ι have got
Well, to be truthful the blueprint's
Simply rage and youthful exuberance
Everybody loves to root for a nuisance
Hit the Earth like an asteroid
Did nothing but shoot for the Moon since (pew!)
MCs get taken to school with this music
'Cause I use it as a vehicle to ""Bus the rhyme""
Now I lead a new school full of students
Me? I'm a product of Rakim
Lakim Shabazz, 2Pac, N.W.A, Cube, hey Doc, Ren
Yella, Eazy, thank you, they got Slim
Inspired enough to one day grow up, blow up and be in a position
To meet Run-D.M.C., induct them
Into the motherfuckin' Rock and Roll Hall of Fame
Even though I'll walk in the church and burst in a ball of flames
Only Hall of Fame I'll be inducted in is the alcohol of fame
On the wall of shame
You fags think it's all a game, 'til I walk a flock of flames
Off a plank and, tell me what in the fuck are you thinkin'?
Little gay-lookin' boy
So gay, I can barely say it with a straight face, lookin' boy (ha-ha!)
You're witnessin' a mass-occur
Like you're watching a church gathering take place, lookin' boy
""Oy vey, that boy's gay!"" That's all they say, lookin' boy
You get a thumbs up, pat on the back
And a ""Way to go"" from your label every day, lookin' boy
Hey, lookin' boy! What you say, lookin' boy?
I get a ""Hell, yeah"" from Dre, lookin' boy
I'ma work for everything I have, never asked nobody for shit
Get outta my face, lookin' boy!
Basically, boy, you're never gonna be capable
Of keepin' up with the same pace, lookin' boy, 'cause-
I'm beginnin' to feel like a Rap God, Rap God
All my people from the front to the back nod, back nod
The way I'm racin' around the track, call me NASCAR, NASCAR
Dale Earnhardt of the trailer park, the White Trash God
Kneel before General Zod
This planet's Krypton-, no, Asgard, Asgard
So you'll be Thor and I'll be Odin
You rodent, I'm omnipotent
Let off, then I'm reloadin'
Immediately with these bombs I'm totin'
And I should not be woken
I'm the walkin' dead, but I'm just a talkin' head, a zombie floatin'
But I got your mom deep-throatin'
I'm out my Ramen Noodle
We have nothin' in common, poodle
I'm a Doberman, pinch yourself in the arm and pay homage, pupil
It's me, my honesty's brutal
But it's honestly futile if I don't utilize what I do though
For good at least once in a while
So I wanna make sure somewhere in this chicken scratch I scribble and doodle enough rhymes
To maybe try to help get some people through tough times
But I gotta keep a few punchlines
Just in case 'cause even you unsigned
Rappers are hungry lookin' at me like it's lunchtime
I know there was a time where once I
Was king of the underground
But I still rap like I'm on my Pharoahe Monch grind
So I crunch rhymes, but sometimes when you combine
Appeal with the skin color of mine
You get too big and here they come tryin'
To censor you like that one line
I said on ""I'm Back"" from The Mathers LP 1 when I
Tried to say I'll take seven kids from Columbine
Put 'em all in a line, add an AK-47, a revolver and a .9
See if I get away with it now that I ain't as big as I was, but I'm
Morphin' into an immortal, comin' through the portal
You're stuck in a time warp from 2004 though
And I don't know what the fuck that you rhyme for
You're pointless as Rapunzel with fuckin' cornrows
You write normal? Fuck being normal!
And I just bought a new raygun from the future
Just to come and shoot ya, like when Fabolous made Ray J mad
'Cause Fab said he looked like a fag at Mayweather's pad
Singin' to a man while he played piano
Man, oh man, that was a 24/7 special on the cable channel
So Ray J went straight to the radio station
The very next day, ""Hey Fab, I'ma kill you!""
Lyrics comin' at you at supersonic speed (J.J. Fad)
Uh, summa-lumma, dooma-lumma, you assumin' I'm a human
What I gotta do to get it through to you I'm superhuman?
Innovative and I'm made of rubber so that anything
You say is ricochetin' off of me, and it'll glue to you and
I'm devastating, more than ever demonstrating
How to give a motherfuckin' audience a feeling like it's levitating
Never fading, and I know the haters are forever waiting
For the day that they can say I fell off, they'll be celebrating
'Cause I know the way to get 'em motivated
I make elevating music, you make elevator music
""Oh, he's too mainstream""
Well, that's what they do when they get jealous, they confuse it
""It's not hip-hop, it's pop,"" 'cause I found a hella way to fuse it
With rock, shock rap with Doc
Throw on ""Lose Yourself"" and make 'em lose it
I don't know how to make songs like that
I don't know what words to use
Let me know when it occurs to you
While I'm rippin' any one of these verses that versus you
It's curtains, I'm inadvertently hurtin' you
How many verses I gotta murder to
Prove that if you were half as nice, your songs you could sacrifice virgins too?
Ugh, school flunky, pill junkie
But look at the accolades these skills brung me
Full of myself, but still hungry
I bully myself 'cause I make me do what I put my mind to
And I'm a million leagues above you
Ill when I speak in tongues, but it's still tongue-in-cheek, fuck you
I'm drunk, so, Satan, take the fucking wheel
I'ma sleep in the front seat
Bumpin' Heavy D and the Boyz, still ""Chunky but Funky""
But in my head, there's something I can feel tugging and struggling
Angels fight with devils and here's what they want from me
They're askin' me to eliminate some of the women hate
But if you take into consideration the bitter hatred
I have, then you may be a little patient
And more sympathetic to the situation
And understand the discrimination
But fuck it, life's handin' you lemons? Make lemonade then!
But if I can't batter the women
How the fuck am I supposed to bake them a cake then?
Don't mistake him for Satan; it's a fatal mistake
If you think I need to be overseas and take a vacation
To trip a broad, and make her fall on her face and
Don't be a retard, be a king? Think not
Why be a king when you can be a god?",https://open.spotify.com/track/1eKZjOja6i7iKS7N2Bzj8D,363
