SongName,AlbumName,AlbumLink,Year,PlayCount,Lyrics,SongLink,Duration
In Too Deep,Music To Be Murdered By - Side B (Deluxe Edition),https://open.spotify.com/album/3MKvhQoFSrR2PrxXXBHe9B,2020,95007771,"""This could never work,"" is what we said at first
But whatever this is, it's working
But we're in two different worlds and (yeah)
I'm not your husband (nah), you ain't my girlfriend
All I know is that (what?)
When I'm with you, I'm a different person, yeah
And I ain't never met a chick as perfect
Girl, you're a ten, so here I am (yeah)
Laying here with her again
Thinking 'bout you
She's asleep, you're texting me around two
Crying face emoji, you say, ""This is me without you""
We're sneaking out to meet at cheap hotel rooms or
Sex in the car, then I'll text you tomorrow
Do I question it? Nah, no objection at all
'Cause both of us are still involved, so
As I'm peelin' off, all I'm thinking 'bout is
I'm not happy here (nah)
With her
Rather have you (yeah)
Rather have me too
'Cause you're not happy there (you're not happy there)
With him
Rather have me (I know, but)
We just in too deep (I'm in way too deep)
You're laying there with him, thinking 'bout me
He's asleep, you say, let's meet around three
You went to leave the house, he caught you sneaking out
Now he's freaking out
You thought he was sleepin' soundly, woah
You say you're going for a drive, you don't question him
When he stumbles in, like, ""Where the fuck you've been?""
Then you pump his ear with what he wants to hear
Tell him you love him, yeah, wipe each other's tears
But it's been a couple years since we been doin' dirt
You or my girl, don't wanna see either of you get hurt
But now the lines are getting super blurred
Can't tell if I'm cheating on her with you or cheating on you with her
But really, nobody's at fault, can't help who you love
Hope they don't ever hear us talk
'Cause we both are getting sloppy
Probably subconsciously part of me's hoping we get caught 'cause
I'm not happy here (nah)
With her
Rather have you (yeah)
Rather have me too
'Cause you're not happy there (you're not happy there)
With him
Rather have me (I know, but)
We just in too deep (I'm in way too deep)
We're laying here with them, thinking 'bout us
'Cause now when we get home, we get jealous
Of each other being someone else's
Call us Long John Silver's 'cause we selfish
But I just wanna see ya
Don't care if it's at the Ritz or Motel 6
If I'm there with ya, rich or poor
When I'm laying here with ya, it could be the kitchen floor
I could stay in bed with ya starin' at ya 'til the morn'
I just wanna be your secret lover, yeah
I'd rather share ya than to not have you at all
So once a year or twice a month I'm here if you want it
Yeah, I'm open season
And I'm always game, so keep it a hundred, dear, haha
'Cause we could never be
Each other's everything's
You got a wedding ring
So it's him instead of me
But I'll be your second string
Now and forever because
I'm not happy here (nah)
With her
Rather have you (yeah)
Rather have me too
'Cause you're not happy there (you're not happy there)
With him
Rather have me (I know, but)
We just in too deep (I'm in way too deep)",https://open.spotify.com/track/1Fcl0NpPPx7YCUSmQFRUEe,194
Cinderella Man,Curtain Call 2,https://open.spotify.com/album/3aTuW4BtsyyyyQa9LKqj8n,2022,361897412,"Yeah
You know, technically
I'm not even really supposed to be here right now
So fuck it, might as well make the most of it
♪
Yeah!
Feels good!
Guess I'm lucky
Some of us don't get a second chance
But I ain't blowing this one
Nah, man!
Shit, I feel like I can do anything now
Who can catch lightning in the bottle, set fire to water?
Coming out the nozzle on the fire hose, flyer than swatters
(Cinderella man, Cinderella man
Cinderella man, Cinderella man)
Smash an hourglass, grab the sand, take his hands and cup 'em
Spit a rhyme and freeze the clock, take the hands of time and cuff 'em
(Cinderella man, Cinderella man
Cinderella man, Cinderella man)
There's a storm coming that the weatherman couldn't predict
I start the bug, prick you better, flee cause I get ticked
It's a wrap, I was down, when I was down, I was kicked, I got up
I'm back to punch you to the ground, you trick, it's a trap
Fuck my last CD, the shit's in my trash
I'll be god damned if another rapper gets in my ass
I hit the gas and I spit every rap as if it's my last
You can die in the blink of an eye
So bat your eyelashes, and keep winking and blowing kisses
'Cause you're flirting with death
I'm destroying your livelihood, I ain't just hurting your rep
I catch a flow and get going, no remorse I'm showing, ain't slowing for no one
Knowing there is nothing you can do about it
Zero in on the target like a marksman, the target is you
I shut your lane down, took your spot, parked in it too
Arsenic flow, lighter fluid saliva: what can you do?
Go get your crew to hype you up stand behind you like ""Whoooo!""
That boy's hot enough to melt Hell, burn Satan too
Fry his ass and put his ashes back together with glue
See you can hate em, he don't blame you frankly he would too
This game could ill afford to lose him, how 'bout you?
Now guess who?
Here's a clue
He came to a ball in his wife beater lost his Nike shoe
It's in your ass, he's in your ass, he's all up in your psyche too
Now, what's his name?
(Cinderella man, Cinderella man)
(Cinderella, Cinderella man, Cinderella man)
If I had a time machine, I'd be Cinderella man
Music is my time machine so call me (Cinderella man, Cinderella man)
(Cinderella man, Cinderella man)
Fuck catching lightning, he struck it, screamed ""Shut up"" at thunder and flipped the world upside down and made it rain upward
(Cinderella man, Cinderella man)
(Cinderella man, Cinderella man)
Rewound the future to the present, paused it - don't ask how
Fuck the past, mothafucka, he's the shit right now he's
(Cinderella man, Cinderella man)
(Cinderella man, Cinderella man)
Cinderella man, Cinder Fellow, Shady dane
Came to wrap the game up in cellophane, raise hell, from Hell he came
But didn't come to bore you with the Cinderella story
Nor did he come to do the same, can't afford to be a lame-o
In this day and age and at this stage of the game
Mediocrity can no longer be allowed to fly
So say ""bye"" to the old, ""H-I"" to the new que será
Consider it his last hurrah, the coup de grâce
Raise 'em high in the sky, keep 'em up, time to bring the place alive
Thanks for being patient, I will make no more mistakes
Shit, my potato's baked, homie, the veggies on my plate can fly
My filet is smoking weed, yeah, faggot, the steaks are high
Shit, I ain't even suppose to be here
By the grace of God, the skin on my teeth! and the hair on my nuts, I skated by
Now y'all are on thin ice with ankle weights I hate to lie
How fucking irritated are you? How much in your face am I?
It ain't shit you could do but fear it
Proof is here in spirit and I'm the spitting image
I'll mirror it when I stand near it, your pussy lyric: I ""cunt"" hear it
Who forms pyramids and raps circles around square lyricists, who?
Here's a clue
He came to a ball in his wife beater lost his Nike shoe
It's in your ass, he's in your ass, he's all up in your psyche too
Now, what's his name?
(Cinderella man, Cinderella man)
(Cinderella man, Cinderella, Cinderella man)
If I had a time machine
(Cinderella man, Cinderella man)
I'd be
Music is my time machine so call me (Cinderella man, Cinderella man)
♪
(Cinderella man, Cinderella man)",https://open.spotify.com/track/5eePARgaJdjj41WMgvctZE,279
Farewell,Music To Be Murdered By - Side B (Deluxe Edition),https://open.spotify.com/album/3MKvhQoFSrR2PrxXXBHe9B,2020,85252433,"For what it's worth
You were a slut at birth
If the world had a dick
You'd fuck the Earth
I tried to get over you
It doesn't work
You're still a cunt
I'm still a fucking jerk
Same as it ever was, yeah
Say it'll change but it never does
Ain't gonna ever 'cause
You're the cause of my pain and the medicine
Never met someone who played games with my head as much
Fate tethered us together like two felons
Must've fell in love with skeletons
Everyone's got 'em, thought that you were Cinderella but
Feels like I slept with the wicked stepmother
But how the hell am I
Still in love with the
Motherfucking chick there's at least a million of
They say love the one you quit
But this shit is killing us
Our love's on some other shit
I'm a glutton for punishment
You're the gloves, I'm the punching mitts
It's above and beyond us
Cuffing, I'm shoving the girl I love inside of an oven
If I catch you sucking another dick
You better unsuck it
You snuck in the crib and tried to jump under the covers again
Why am I tucking you in?
Probably 'cause
I gotta tell myself another lie
'Cause that's what helps
To get me by
'Cause I'm in hell
This is my, goodbye, farewell
Wanna hold you, wanna choke you, wanna love you
Wanna hate you, wanna kill you, wanna hurt you
Wanna heal you, yeah
Wanna lose you, keep you, bruise you
Beat, abuse you, treat you mutual
It's juvenile, delusional, as usual
You're beautiful, I'm average
I'm brutal, you're a savage
My ride or die chick who's always cruising for a bruising
Yeah, it's kinda like we're tryna light a dynamite stick
Though we might get along like shit
Fight, hit, bite, spit, unite, split
Yeah, you're awful but you're mine
And they say love is blind, we see each other fine
But it's no wonder, I'm the only one you'll find
To put up with your shit, I need a plumber line
But nothing comes to mind besides the number 90
'Cause since '06 you flipped my fucking life, upside down
Now the sky's ground, look at my frown, it's a smile now
Look at my mouth, it's my eyebrows, make it rain upwards
We're on the ninth cloud, two insane lovebirds
I should fly south 'cause man am I great, ain't lyin' to myself
But I'm just plain stubborn, I'm Audie five thou'
But this is my house, bitch you get out
Then we duke it out, then it dies down
Then we say, fuck it, cry our eyes out, then
I gotta tell myself another lie
'Cause that's what helps
To get me by
'Cause I'm in hell
This is my goodbye farewell
This relationship is all that it's cracked up to be
Never lack lust in that, 'cause we act nuts
'Cause that's what attracts us
Trick you with a back rub
Tell you to relax then dump your ass in the bathtub
Yeah, now that's love, may sound pathetic
But fuck the world 'cause they out to get us
I love you but I won't exchange vows
Hey now, don't get carried away
No way I'll get married, it'll take a rain cloud to wet us
Yeah, but we're so insane 'bout each other
May take the same route and way out as Junior Seau
Break out Berettas lay down in bed and blow our brains out together
Who knows how it's gonna play out?
Or whether death's what our ending would be
One of us shot in the back while attempting to flee
But I go to bat for you, defending your honor
Yeah, no contingency fees, something we're not, nah
We're not pretending to beef, don't cost a penny to be with me
Time we're spending is free, we could be broke as a joke
Won't make a difference to me, don't have to give me a thing
Could've been a 50 cent ring from out of a vending machine
Love unconditionally, there's no other fish in the sea
Guess I'm a prisoner see, addiction is a disease
I gotta tell myself another lie
'Cause that's what helps
To get me by
'Cause I'm in hell
This is my, goodbye farewell
Love you girl, do you feel the same?
I don't wanna play games, no games, ah-ah
You're the only that can out my flame
Baby, just play it straight, straight, no games, ah-ah",https://open.spotify.com/track/7xeDETVgMCoPkHU3dXtN9x,247
She Loves Me,Music To Be Murdered By - Side B (Deluxe Edition),https://open.spotify.com/album/3MKvhQoFSrR2PrxXXBHe9B,2020,22764029,"She loves me, she loves my knot
Not for who I am, but what I got, yeah
And I don't wanna blow up her spot
But da-na-na, na-na, da-naa (woo)
Lady, I been watchin' you from the back every time that you walk past
Hate to put you on blast but you got a bomb ass (yeah)
Been checkin' you out ever since the second you
Stepped in through Naunie's dressing room
Girl, you're stunning, I'd bet that you'd zap me
If I was next to you, sparks'll fly, I expect 'em to
I'd be shocked if they didn't
'Cause you're Carmen Electra-cute (cutie)
And those ain't just sound effects
I knew something was special soon as we swapped info, I knew that
She loves me, she loves me not
For who I am, but what I got
But she loves me, she loves me not (aha)
She loves me (one more time)
I said, 'cause she loves me (she loves me), she loves me not
For who I am (she loves me), but what I got
But she loves me, she loves me not
She loves me
Sorry I missed your call again, I be in the studio usually
But tomorrow afternoon for me'd work beautifully
If your schedule's open, you say, ""That's cool with me
But you stood me up twice, Slim, you're 0-for-2 with me""
'Cause like a basket, you've been going through hoops for me
Well, if the ball's in my court, why don't we shoot for three?
Yeah, I'll pick you up and we'll cruise through the D
And as soon as we hung up, I'm like, ""Woo""
'Cause she loves me (she loves me), she loves me not
For who I am (she loves me), but what I got
But she loves me, she loves me not (aha)
She loves me (ayo, lemme do this bridge right quick)
She pulls me close and whispers to me, oh-oh
Lies in my ear, but that's all I wanna hear
That's okay, long as we both know this is all it is, woah
She can have my love for as long as we both are here
We're back in my spot now (yeah), the music is loud, so (what?)
I turn the boombox down (shh), we cut off our cell phones
You're killin' me soft now, wanna hit it like Balboa
'Cause girl, you're a knockout, your body is out cold (out cold)
(Woo) I put the moves on you like a U-Haul
Bend you over the foosball table, your shoes fall
To the floor, but canoodlin', I'm not in the mood for
Gotta get me out of these drawers if you wanna spoon, doll (yeah)
But before we get to droppin' these drawers
There's options to explore
We can fuck in the closet (yeah) or on my elevator (uh)
And maybe when it stops and the door opens
We fall out and we just get off on this floor (haha)
You say you're falling for me, but not 'cause I'm famous
Then explain to me who that tattoo that's on your leg's of
Girl, your game is an A-plus, but you think I don't notice
Who the screensaver on your damn phone is
It ain't 'cause who I am, bullshit, I like you
Just don't take me for no stupid ass, no disrespect
'Cause even though you're like my truest fan, know it's
Clear you only love me 'cause I'm Superman, Lois, but fuck it
'Cause she loves me (she loves me), she loves me not
For who I am (she loves me), but what I got
But she loves me, she loves me not
She loves me (yeah, one more time)
I said, 'cause she loves me (she loves me), she loves me not
For who I am (she loves me), but what I got
But she loves me, she loves me not (haha)
She loves me
She loves my knot, haha
I'm just playin', I ain't got no foosball table",https://open.spotify.com/track/0BUFqsMsqAmKQPhLBXnmv7,204
Bump Heads,The Eminem Show (Expanded Edition),https://open.spotify.com/album/6EzbFdrwvWpnpUjzrR57aU,2022,47708427,"Nigga
Yeah (yeah, yeah)
Here we go again (Shady)
Shady Records Mixtape
The invasion (G-G-G-G-Unit)
Part two (here we go again)
Conspiracy theory
International version
The evil genius, Green Lantern
Let's go
Does it make you mad when I switch my flow?
You can't understand how I get my dough
50 Cent, I'm on fire 'cause Shady said so
I'm on fire (here we go now)
Everybody's in a rush to try to get the throne
I just get on the track and try to set the tone
I ain't tryna use nobody as a steppin' stone
But don't compare me, I'm better off just left alone (exclusive)
And I ain't even tryna go there with record sales
I'm just tryna keep it humble and respect myself
Say, ""What up?, Keep steppin', and just rep D12""
Keep my nose clean, stay away from weapons, jail
And livin' reckless, but if you go check my belt
You may see something else I use to protect myself
A vest, to stop a Ruger and deflect the shells
And send 'em back at you faster than they left the barrel
And I don't even carry guns no more, I don't got to
Got undercover cops that'll legally pop you
And I done seen a lot of people cross the line
But this motherfucker Ja must have lost his mind
That X, got him thinkin' he was DMX
Then he switched to Pac, now he's tryna be him next
So which one are you? X, Luther, Pac or Michael?
Just keep singin' the same song, recycled
We'd all much rather get along than fight you
Me and Hailie dance to your songs, we like you
And you don't really wanna step inside no mic booth
Come on now, you know the white boy'll bite you
I'll hurt your pride, dawg, and you know I don't like to
But I will if I have to, with syllable after
Syllable I just slap you, killin' you faster
Than you poppin' pill after little pill of them tabs
Of that shit you on, but if you want it, you got it
You'd bump this shit too, if we ain't diss you on it
But if we lock horns, we can charge harder than Busta (Green Lantern!)
We bump heads with any motherfucker that wants to (yeah)
So what's the deal, where was all the tough talk?
When I walked up to you like, ""Ja, what up, dawg?""
How come you didn't say you had a problem then?
When you was standin' there with all your men, we coulda solved this then
I'm a grown man, dawg, come holla
All you did was slap hands, smile, and swallow
Another one of them little X pills in front of me
And tell me 50 Cent was everything you wanna be
Come on!
I know you don't want it with me
You know you don't want it with me
You talk and soon you gon' see
You don't wanna bump heads with me
I know you don't want it with me
You know you don't want it with me
You talk and soon you gon' see
You don't wanna bump heads with me
Tony!
You couldn't son me if my father helped you
My punchlines is hot, my bars will melt you (what?)
Ja, you Stuart Little, shells'll lift you
Every other week, I'm buyin' a new pistol
I clap at your ass with this chrome .38
And put six through your hats a seven and three-eight
Irv, you ain't Suge Knight, you Shook Knight
I'll put my knife in your wind pipe and breeze through the turnpike
You know and I know who took your chain
You got robbed two times, so your ass is lame
I'm down to die for this shit, all I need is bail
You better stick to the movies with Steven Seigel, bitch
I know you don't want it with me
You know you don't want it with me
You talk and soon you gon' see
You don't wanna bump heads with me
I know you don't want it with me
You know you don't want it with me
You talk and soon you gon' see
You don't wanna bump heads with me (Lloyd Banks!)
Fuck that, I'm miles away
And these industry niggas startin' to get outta hand
Like I won't find your whereabouts by stompin' 'em out your man
We killin' New York, even in Compton, they understand
I'm on the block where you was raised (break it, break it)
Blowin' chocolate up out your van and (break it down!)
They see me pop a boy icy 'cause I could
You been gone so long, you probably forgot your way around the hood (hood)
'Cause when you paranoid, it's hard to make a song
How you want it with us if half of your artists got makeup on?
Every magazine I open, you on your knees takin' prayer pictures
And you ain't even got shot yet, you scared bitches
You don't know nothin' 'bout what pain is, sucker
I'll put your ass underground like a train conductor, motherfucker!
I know you don't want it with me (that's my man, Paul Rosenberg)
You know you don't want it with me (walk the bell)
You talk and soon you gon' see (Shady Records)
You don't wanna bump heads with me (Don Robinson)
I know you don't want it with me (Interscope Worldwide)
You know you don't want it with me
You talk and soon you gon' see (look out for the tour, Anger Management)
You don't wanna bump heads with me (Europe and Japan)
Yeah, nigga
Yeah, Shady Aftermath
G-Unit
Fuck you think they call us G-Unit for?
'Cause we move units, huh-uh
Don't think we ain't billin' you for this motherfuckin' studio time
Matter of fact, keep it on 50, we'll call it even, ha",https://open.spotify.com/track/4OYGHze5MiMkgozardIRxU,281
These Demons (feat. MAJ),Music To Be Murdered By - Side B (Deluxe Edition),https://open.spotify.com/album/3MKvhQoFSrR2PrxXXBHe9B,2020,30670347,"Yeah, you know what? (Loud Pack)
Haters are funny, man (haha)
It's like, you're gonna hate it no matter what it is
Yet you still click on it (Zombie on the track)
I want you to change, but don't change (yeah)
I want you to grow up, but don't age
I want the rage, but don't get too angry
I want the new, but old Shady
I want you to say what they won't say (yeah)
Just don't go too far, but go cray
I want you to almost lose it, man
They keep movin' the goal post, don't they?
Just cut to the chase, like OJ
In his Bronco goin' off the roadway (skrr)
And get off my dick
If I said my balls were yarn, you bitches would crochet
All I ever wanted's a rope chain
From the day I saw Cool J on Soul train
Now I got that Kangol, two cables
One yellow and white gold plated
Just to let 'em know I made it
I told my dawgs we gon' get right in a year, yeah
What did it cost? Now I dip, gone in a Lear
Still have all these demons comin' for my neck, yeah, yeah
I ain't never comin' down, yeah, yeah
This pandemic got us in a recession
We need to reopen America (what?)
Black people dyin', they want equal rights
White people wanna get hair cuts (haha)
Some people protest, some people riot (what?)
But we ain't never escapin' this virus (nah)
To the cops that are racially biased (what?)
We no longer enable these liars
You get 'em on tape, they stick to a story
Like Spider-Man crawin' up side of a wall and
Some are just unabiding-ass lawmen (yeah)
Like Garrett Rolfe and like Derek Chauvin (yeah)
No cap, still riding with Colin
Though some people don't like me at all and (yeah)
Some are like bees to flowers (why?)
'Cause some people find me appalling (haha)
Ooh, I say a line, people are outraged (oh no)
The press slams me again (yeah), people aren't having it nowadays
Give an album that I put out in like 2000 you griped out praise
But I wake up everyday even more caked up
Than the makeup on your clown face
And I laid my foundation
I told my dawgs we gon' get right in a year, yeah
What did it cost? Now I dip, gone in a Lear yeah
Still have all these demons comin' for my neck, yeah, yeah
I ain't never comin' down (Yeah), yeah, yeah
I got a question (what?)
What rhymes with pariah? (I don't know)
Mm, uh, LEGO? (Oh shit)
You just bit into the lit end of the wick
Shit, I meant, shit end of the stick
I'm addicted to friction and mischief
It's like your bitch's midriff, shit gets my dick stiff as a stick shift
Dick as in Cheney, drip as in saline
They bring my name up just to get ratings
It's like trying to choose between Bizzy, Layzie, and Wish against Krayzie
'Cause I got a bone to pick with Slim Shady (Shady)
Will thug (thug) and harm any (harm any)
Who attempt to diss Hailie (Hailie)
Bitch, I will go in like it's raining
And I get cancelled like once a day (yeah)
Why would I go? It's more fun to stay (ah)
You get me to leave, it's no fuckin' way
I got a better chance of fuckin' Young M.A. (ooh)
Ooh, sounds like I'm zoning
So me sayin' I'm out, nice to know me
It's like askin' me where my shin is
It's down right below me (haha)
Uh, oh, well we can play hide the salami (yeah)
If your gal'd like to blow me (yeah)
My wave is like a tsunami (yeah)
These flows you're still tryna wrap your head around
Like you're a swami (ha)
Just call me the mic kamikaze with Mike Zombie
And I'ma just keep bombing (woo)
'Cause the game is mine, like an IED (yah)
If they ever do cancel me like Live PD
Said I'm takin' somethin' with me if I'm leaving (brr)
It's time to murder you now, psych, meet me
I might be D to the fuckin' I-Z-Z
Y from rappin' circles around these hoes
Just like girdles and every word from my mouth so fire
I should be burnt to the ground
There's a fuckin' circus in town, yeah bitch, this verse finna clown ICP
R. Kelly sex tape, I see pee (look)
My shit is intense, like tipis
You gettin' wiped, like TP
You don't like me? You can bite my little white wee-wee
And I repeat, you can bite my little white wee-wee long as I L-I-V-E
And ever since my pre-teens, striped Lee jeans and
Grandma Nan's little black and white TV (yeah)
Now I'm so bougie that I stick out my pinkie every time I drink tea
Used to wanna wife Sweet Tee (Sweet Tee)
Used to rock wife beaters, now I let your wife beat me (yeah)
So you can eat shit, but I might be the shit
So when I say ""Eat shit,"" I mean me",https://open.spotify.com/track/086LXfSk4U5XEALardCE7k,207
